id,label,left_title,left_manufacturer,left_price,right_title,right_manufacturer,right_price
3456,0,Microsoft Windows Vista Ultimate Full Version [DVD],Microsoft,399.95,Microsoft Windows Vista Business Retail No Open Box Returns,,unknown
3457,0,Microsoft Windows Vista Home Basic Upgrade [DVD],Microsoft,99.95,Microsoft Windows Vista Business (PC),,unknown
3458,0,The Print Shop 22 SB CS,Encore Software,unknown,The PrintShop V22 Deluxe,,29.9
3459,0,Microsoft Office Small Business 2007,Microsoft,735.33,Microsoft Office 2004 Software Suite OEM Mac Apple & Mac Software,,unknown
3460,0,QuickBooks Premier Manufacturer and Wholesale Edition 2007,Intuit,399.95,Intuit QuickBooks Premier Professional Services Edition 2007 Software Win Tax & Finance Software,,unknown
3461,0,Marine Aquarium & Goldfish Screen Saver by Encore Software,Encore Software,unknown,Encore Software Marine Aquarium + Sharks Win 98 ME 2000 XP,,7.69
3462,0,3D Home Architect Landscape V.8 by Encore Software,Encore Software,39.99,Total 3D Home & Landscape Deluxe 9 (Individual Software Inc),,unknown
3463,1,MediaRecover,Aladdin Systems,29.99,Allume MediaRecover,,unknown
3464,0,Adobe Photoshop Elements 4.0,Adobe,89.99,Adobe Photoshop CS3 (Mac OS X v. 10.4.8),,649.0
3465,0,Adobe Photoshop CS3 Extended,Adobe,999.0,Adobe Photoshop Elements 4.0 Mac Academic,,unknown
3466,0,Cubase SE3 Educational Edition,Steinberg,unknown,Steinberg Cubase Studio 4 Software (Educational Discount) Music Production Software,,179.95
3467,1,WebObjects 5.2,Apple,699.95,Apple Web Objects 5.2 Software Apple & Mac Software,,unknown
3468,1,3D Home Architect Landscape Designer V8,Encore Software,29.99,Encore Inc 3D Home Architect Landscape Designer V 8.0,,unknown
3469,0,Punch! Professional Home Design Suite,Punch Software,99.95,Punch Software Professional Home Design Suite (Small Box),Punch Software,62.99
3470,0,Final Draft 7 Professional,Final Draft,289.99,Final Draft Scriptwriter's Suite 2.5 (Screenwriting Software),,unknown
3471,0,Adobe Creative Suite CS3 Web Standard [Mac],Adobe,999.0,Adobe CS3 Design Standard Upgrade Windows,,unknown
3472,0,Adobe Creative Suite CS3 Design Standard Upgrade [Mac],Adobe,399.0,Adobe CS3 Design Premium Academic,,unknown
3473,0,Microsoft Windows Vista Ultimate Upgrade [DVD],Microsoft,259.95,Microsoft Windows XP Pro SP2 Retail,,unknown
3474,1,Punch! Ultimate Deck and Landscape,Punch! Software,29.0,Punch Software 13100 Punch! Ultimate Deck & Landscape Complete Product Creativity Application (S) Complete Product Standard PC,,unknown
3475,0,CA Internet Security Suite 2007 3 User,Computer Associates,69.95,CA ISS2007LEC10 CA Internet Sec Ste 2007 W/Warranty XL Box Ecommerce 10U,,unknown
3476,1,Terror Strike,Encore,19.95,Encore Software Terror Strike Win XP,,unknown
3477,0,Microsoft CRM Professional CAL 3.0 Product Upgrade License Pack User CAL,Microsoft,9980.0,Microsoft Windows Server 2003 Client Additional License for Devices 5-Pack (823930),,unknown
3478,0,Mavis Beacon Teaches Typing 16,Broderbund,19.99,Encore Software Mavis Beacon Typing 17 Standard by Broderbund,,unknown
3479,0,Punch! 5 in 1 Home Design,Punch Software,39.99,Punch Software 86100 Prof Home Design Platinum V10 SB Win 98 ME NT 2000 XP,unknown,84.97
3480,0,Microsoft Windows Vista Ultimate Upgrade [DVD],Microsoft,259.95,Microsoft (R) Windows Vista (TM) Home Premium,,unknown
3481,0,QuickBooks Premier Non-Profit Edition 2007,Intuit,399.95,Quicken 2007 Premier Win CD,Intuit,unknown
3482,0,Microsoft Office Small Business 2007 Full Version,Microsoft,449.95,Microsoft Office Basic Edition 2003 License and Media,,unknown
3483,0,Adobe After Effects CS3,Adobe,999.0,"Adobe After Effects CS3 Professional (Media, TLP, Non-Profit)",,unknown
3484,0,Panda Internet Security 2007,Panda Software,69.95,Symantec Norton Internet Security 2007 (1 User),,unknown
3485,0,Adobe Production Studio Premium,Adobe,1699.0,Cakewalk Sonar Home Studio 6 Software Music Production Software,,unknown
3486,0,English Literature Basics (Win/Mac) (Jewel Case),Fogware Publishing,9.99,Total 3D Home Deluxe (Jewel Case) (JCE-TH6),,unknown
3487,0,Snap! Spelling,,unknown,Cross Stitch Design Studio,,9.59
3488,0,Instant Immersion German Audio,Topics Entertainment,unknown,Instant Immersion Japanese (Audio Book) (Audio Book),,19.95
3489,0,Mavis Beacon Typing 17 (Win/Mac),Encore Software,19.99,Encore Software Mavis Beacon Typing 17 Deluxe by Broderbund,,unknown
3490,0,Adobe Acrobat 7.0 Professional,Adobe,449.99,Microsoft Office and Windows Training Professional,,unknown
3491,0,School Zone Pencil-Pal Software Big Phonics (CD-ROM & Book),,unknown,School Zone Interactive Math 2 on Track Software,,9.45
3492,0,Microsoft Windows Small Business Server Premium 2003 R2 Upgrade,Microsoft,709.0,Microsoft Windows Vista Ultimate Upgrade,,unknown
3493,0,PrintMaster 17 Platinum,Encore Software,39.99,Marine Aquarium & Goldfish Screen Saver,,unknown
3494,0,Adobe Acrobat Professional 8 (Windows),Adobe,273.0,Individual Software Inc Systemsuite 8 Professional (US POS),,unknown
3495,0,Readiris Pro 11,,129.99,Readiris Pro 11 Corporate Edition for PC,,unknown
3496,0,Microspot Interiors,Microspot Ltd.,99.95,Microspot Interiors (INTS3 .6 SB),,unknown
3497,1,Marketcircle Daylite V3 .0 (Mac),CSDC,149.0,Daylite V3 .0 Marketcircle (Mac 10.4 or Later),,unknown
3498,0,Home Design Architect Series 3000 V10,Punch! Software,149.95,Encore Inc 3D Home Architect Home Design Deluxe Version 9,,unknown
3499,0,Instant Immersion Italian Deluxe V2.0,Topics Entertainment,29.99,Instant Immersion Language Lab Deluxe Edition,,unknown
3500,0,Registry Mechanic by Encore Software,Encore Software,46.52,Encore Inc Registry Mechanic 6.0,,unknown
3501,0,QuickBooks Pro 2007 Small Business Financial Software,Intuit,199.95,Quicken Basic 2007 (Client Access License) Software for Windows Tax & Finance Software,,unknown
3502,0,Hoyle Texas Hold 'Em Poker (Jewel Case),Encore,9.99,Texas Hold'em No Limit Tournament Poker,,unknown
3503,0,Adobe Photoshop CS3 Extended,Adobe,999.0,Adobe Photoshop CS3 Extended (Academic Complete Package),,unknown
3504,0,Sierra Hallmark Card Studio Special Edition Windows,Nova Development,unknown,Hallmark Card Studio 2006,,29.36
3505,0,Instant Immersion Italian Deluxe V2.0,Topics Entertainment,29.99,Instant Immersion 33 Languages,,unknown
3506,0,Funny Faces Deluxe,Fogware Publishing,19.99,MyInvoices & Estimates Deluxe,,unknown
3507,0,Punch! Home Design Architectura Series 18,Punch Software,129.99,Punch Software Home Design Studio Mac,Punch Software,135.99
3508,0,Microsoft Office Small Business 2007,Microsoft,735.33,"Microsoft OneNote 2007 Complete Package (1 PC CD, Win English)",,unknown
3509,0,Adobe Creative Suite CS3 Web Standard,Adobe,799.0,Adobe Creative Suite 3 Web Premium Complete Package,,unknown
3510,0,Adobe Illustrator CS3 Upgrade from Freehand [Mac],Adobe,199.0,Adobe Dreamweaver CS3 Upgrade,unknown,unknown
3511,0,Adobe Premiere Pro CS3,Adobe,799.0,Adobe CS3 Web Premium Upsell,,unknown
3512,0,WASP Barcode Labeler Complete Package (3 Users) Std CD,WASP Technologies,unknown,Adobe Creative Suite 3 Web Standard Complete Package Academic CD Mac,Unknown,369.0
3513,0,Elementary School Success Deluxe 2006,Topics Entertainment,49.99,Topics Entertainment Reference Success Deluxe 2006,,unknown
3514,0,Before You Know It Deluxe Spanish Edition,Encore Software,29.99,Spanish Before You Know It Deluxe,,unknown
3515,0,Adobe Acrobat 7.0 Professional,Adobe,449.99,Adobe Flash CS3 Professional (Mac),,unknown
3516,0,WASP Barcode Labeler Complete Package (3 Users) Std CD,WASP Technologies,unknown,VortexML V.2 Complete Package (1 User) Win CD,Unknown,363.63
3517,0,Registry Mechanic by Encore Software,Encore Software,46.52,OnOne Software Smartscale Software,,unknown
3518,0,Adobe Creative Suite CS3 Design Standard Upgrade [Mac],Adobe,399.0,Adobe Illustrator CS3 Upgrade from Freehand for Mac,,unknown
3519,0,Instant Immersion Japanese Deluxe 2.0,Topics Entertainment,39.99,Instant Immersion German Deluxe 2.0,,unknown
3520,0,Scrabble Champion Edition,Encore,19.95,ChataChecker Family Edition,,unknown
3521,0,Microsoft Visio Standard 2007,Microsoft,259.95,Microsoft Windows Vista Ultimate Upgrade,,unknown
3522,0,Instant Immersion German Deluxe 2.0,Topics Entertainment,39.99,Instant Immersion Italian Audio (Audio Book),,unknown
3523,0,OmniOutliner Professional 3.0,,69.95,Adobe CS3 Flash Professional Upgrade,Unknown,205.99
3524,1,Calculation Skills V1 Add & Sub Basic Core Learning,,unknown,SOS Aggregation Company Calculation Skills V1 Add & Sub Basic Core Learning,SOS-Aggregation-Company,15.91
3525,0,Punch! Professional Home Design Suite,Punch Software,69.99,Punch Software Punch ! Professional Home Design Suite for Windows,Punch Software,62.99
3526,0,Microsoft Mappoint 2006 Standard Edition,Microsoft,299.0,Microsoft Mappoint 2006 CD (Standard Edition),,unknown
3527,0,F-Secure Internet Security 2007,,79.99,Panda Internet Security 2007,,unknown
3528,0,Timbuktu Remote Control Software,Netopia,199.99,Now Up-to-Date & Contact for Windows,Now Software,114.99
3529,0,Adobe InDesign CS3 Upgrade [Mac],Adobe,199.0,Adobe Dreamweaver CS3 Upgrade,Unknown,unknown
3530,0,WASP Barcode Labeler Complete Package,WASP Technologies,unknown,Adobe Acrobat Standard V.8.0 Complete Package,,295.25
3531,0,Adobe Creative Suite CS3 Production Premium,Adobe,1699.0,Adobe CS3 Web Premium,,unknown
3532,0,Microsoft Office FrontPage 2003 Academic Version Windows,Microsoft,159.98,Microsoft Office Outlook 2007,,unknown
3533,0,Microsoft OEM 3PK XP Home Edition SP2,Microsoft Corporation,unknown,Microsoft Windows XP Home Edition SP2 Retail Box,,199.99
3534,0,Mavis Beacon Teaches Typing Deluxe V17,Encore Software,39.99,Mavis Beacon (R) Teaches Typing V. 17 Deluxe,,unknown
3535,0,Adobe Photoshop CS3 Extended,Adobe,999.0,Adobe InDesign CS3 Academic (Mac),,unknown
3536,0,Adobe Creative Suite CS3 Design Premium Upgrade [Mac],Adobe,599.0,Adobe CS3 Design Standard Academic,,unknown
3537,0,Microspot X-Rip (Mac),Microspot Ltd,349.99,Microspot MacDraft PE Personal Edition,,unknown
3538,0,Apple Logic Pro 7.2 Upgrade,Apple,299.0,Apple Software T9163LL/A Logic Pro 6,Apple Software,unknown
3539,0,Family Tree Maker Version 16 Collectors Edition,Encore Software,unknown,Encore Software Family Tree Maker Version 16 Collectors Edition SB CS,,81.97
3540,0,ValueSoft Tune Transfer for iPod Software for Windows XP,ValueSoft,29.95,SplashID Windows Mobile Software for Pocket PC,,unknown
3541,0,Crystal Reports XI Professional Edition,Business Objects,495.0,I CopyDvds 2 Professional Edition,,unknown
3542,0,Peachtree by Sage Complete Accounting 2007,Sage Software,269.99,Peachtree (R) Compatible Continuous Checks - Accounting for Windows Versions 3.5-7.0,,unknown
3543,1,Cranium Collection 2006,Encore Software,19.99,Cranium Collection 2006 (SB CS by Encore),,unknown
3544,0,Adobe Photoshop CS3,Adobe,649.0,"Adobe Photoshop CS3 Extended Complete Package (Academic CD, Windows)",,unknown
3545,0,Adobe InDesign CS3,Adobe,699.0,Adobe CS3 Design Premium Upgrade,,unknown
3546,0,Family Tree Maker Version 16 Deluxe,Encore,69.95,Family Tree Maker 16 Collector's Edition,,unknown
3547,0,World of Warcraft,Blizzard Entertainment,19.99,Vivendi Blizzard World of Warcraft,,unknown
3548,0,Math Success Deluxe,,39.99,Elementary School Success Deluxe,,unknown
3549,0,HP DSS Software V.4.0 Complete Package,Hewlett-Packard,630.36,ScanSoft PDF Create! V.4.0 Complete Package,,unknown
3550,1,Scrabble with Bonus Clue,Encore,19.99,Encore Software Scrabble with Bonus Clue Win 98 ME 2000 XP,,unknown
3551,0,RiverDeep Adventure Workshop (8th Edition) 4th-6th Grade,RiverDeep,unknown,Encore Software - Adventure Workshop 8 (1st-3rd),,17.97
3552,1,Totally Spies Total Swamp Romp (PC & Mac),Brighter Minds Media Inc.,19.99,Totaly Spies: Total Swamp Romp by Brighter Minds,Brighter Minds Media Inc.,19.99
3553,1,Instant Immersion Italian Deluxe V2 .0,Topics Entertainment,29.99,Instant Immersion Italian Deluxe 2.0,,unknown
3554,0,I Copy DVDs 2 Professional Edition,,69.99,I Copy DVDs 2 Ultra Edition,,unknown
3555,0,Microsoft Windows Small Business Server CAL 2003 License Pack,Microsoft,unknown,Windows Vista Business SP Microsoft,,272.38
3556,0,Adobe Flash Pro CS3,Adobe,699.0,Adobe Premiere Pro CS3 Upgrade,,unknown
3557,0,Punch! Home Design Architectural Series 4000 V10,Punch!,199.99,Punch Software Punch! Home Design Suite Professional Complete Product Architectural Standard 1 User (S) Complete Product PC,,unknown
3558,0,Adobe Production Studio Premium,Adobe,1699.0,Sony Sound Forge Audio Studio 8 Music Production Software,Sony Pictures Digital Entertainment,unknown
3559,0,Steinberg Cubase 4 Digital Audio Software,Steinberg,999.99,Software,,unknown
3560,0,Microsoft Visual Studio Professional 2005 Upgrade,Microsoft,549.0,Office Pro 2007 Upgrade (Microsoft),,unknown
3561,0,Print Shop Deluxe,Encore,49.99,Cosmi Print Perfect Clip Art Deluxe,,unknown
3562,0,Punch! Super Home Suite,Punch Software,49.99,Punch Software 17100 Punch ! Super Home Suite,Punch Software,45.99
3563,1,Crystal Reports 11 Pro French Upgrade,Business Objects,479.78,Crystal Reports 11 Pro French Upgrade,,unknown
3564,0,Mavis Beacon Typing 17 (Win/Mac),Encore Software,19.99,Mavis Beacon 16,,unknown
3565,0,Microsoft Word 2007 Version Upgrade,Microsoft,109.95,Microsoft Academic Microsoft Visio 2003 Professional,,unknown
3566,0,Instant Immersion German V2.0 (PC & Mac),Topics Entertainment,29.99,Instant Immerse Spanish DLUX 2,,unknown
3567,0,Punch! 5 in 1 Home Design,Punch Software,39.99,Instant Home Design,,unknown
3568,0,Sibelius 5 Educational Edition,Sibelius Software Ltd.,329.0,Microspot MacDraft Professional Edition,,unknown
3569,0,Adobe Creative Suite CS3 Web Standard Upgrade,Adobe,399.0,Adobe CS3 Production Premium Upgrade,Unknown,unknown
3570,0,The Sims 2 Pets Expansion Pack,Aspyr Media,34.99,The Sims 2 Seasons Expansion Pack,,unknown
3571,0,Norton Antivirus Mac 10.0,Symantec,69.95,Norton Antivirus 2004,,unknown
3572,0,QuickBooks POS: Pro Multistore 6.0,Intuit Inc.,1399.95,QuickBooks (R),,unknown
3573,0,Adobe Photoshop CS3 Extended,Adobe,999.0,Adobe Lightroom,,unknown
3574,0,QuickBooks Simple Start 2007,Intuit,99.95,QuickBooks (R),,unknown
3575,0,Microsoft Office 2004 Professional (Mac),Microsoft,499.99,Microsoft Excel 2007 (PC),,unknown
3576,0,The Print Shop Pro Publisher 22 Deluxe [DVD],Encore,99.99,The Print Shop 22 Pro Publisher Deluxe Complete Package 1 User Win,,unknown
3577,0,Adobe Illustrator CS3 Upgrade [Mac],Adobe,199.0,Adobe InDesign CS3 for Mac Upgrade,,unknown
3578,0,Adobe Audition 2.0 Upgrade,Adobe,129.0,Adobe CS3 Web Standard Upgrade,,unknown
3579,0,Microsoft Windows Vista Ultimate Upgrade [DVD],Microsoft,259.95,Microsoft Windows XP Home Edition SP2 OEM,,unknown
3580,0,Microsoft Digital Image Suite 2006 Plus Pinnacle Studio 10,Microsoft,99.95,Pinnacle Studio Plus Titanium Edition V. 10.5 Complete Package 1 User,,unknown
3581,0,Finale Allegro,Finale,199.95,eMedia Finale Allegro,,unknown
3582,0,Microsoft Office Mac 2004 English 3PK DSP,Microsoft Corporation,unknown,Microsoft OneNote 2007 (PC),,99.95
3583,1,Total Training for Adobe Creative Suite 3: Design Premium Bundle,Total Training,299.99,Total Training for Adobe Creative Suite 3 Design Premium,,unknown
3584,0,Hallmark Card Studio Deluxe,Sierra Home,49.99,Hallmark Card Studio 2004,,unknown
3585,0,Adobe Flash CS3 Professional,Adobe,199.0,Adobe Flash CS3 Upgrade (Mac),Unknown,unknown
3586,0,Punch! Master Landscape & Home Design,Punch! Software,59.99,Encore Software 3D Home Architect Landscape Design Deluxe Version 9,,unknown
3587,0,Microsoft Office 2004 Standard Upgrade (Mac),Microsoft,239.99,Microsoft Office 2004 Software Suite OEM Mac Apple & Mac Software,,unknown
3588,0,Print Shop Deluxe,Encore,49.99,Print Shop Deluxe 21,,unknown
3589,0,Time Money & Fractions Grades 1-2,School Zone,9.99,Time Money & Fractions Grades 1-2 Workbook & CD-ROM,,unknown
3590,1,Canopus Let's Edit,Canopus,99.0,Canopus Let's Edit Video Editing Software Win Consumer Video Editing Software,,unknown
3591,0,Bias Peak LE 5,Bias,129.0,Bias Peak Pro 5 Software Music Production Software,,unknown
3592,0,OmniOutliner Professional 3.0,,69.95,Resumaker Professional 12.0 (Individual Software),Individual Software,unknown
3593,0,Peachtree by Sage Pro Accounting 2007,Sage Software,169.99,Peachtree (R) Compatible Continuous Forms - Accounting for Windows 8.0-2004 Version,,unknown
3594,0,Internet Security Barrier X4 Antispam Edition,Intego Inc.,unknown,OEM Internet Security Suite 2007 3-User Single Pack,,32.85
3595,0,Adobe Fireworks CS3,Adobe,299.0,Adobe InDesign CS3 Academic,,unknown
3596,0,3D Home Architect Home V.8 by Encore Software,Encore Software,39.99,Essential Software Architecture,,unknown
3597,0,Punch! Master Landscape & Home Design,Punch! Software,99.99,Punch!Master Landscape Pro V10 and Home Design,,59.97
3598,0,Adobe Photoshop CS3,Adobe,649.0,Adobe InDesign CS3 Upgrade,,unknown
3599,0,Microsoft Office Mac 2004 English,Microsoft Corporation,unknown,Office Mac 2004 Microsoft,,331.77
3600,0,Adobe Acrobat Professional 8 Mac,Adobe,273.0,Adobe Acrobat 8 Professional for Mac Upgrade,,unknown
3601,0,Adobe Creative Suite CS3 Web Premium,Adobe,1399.0,Adobe Creative Suite (V3.0) Design Premium Mac,Unknown,1482.0
3602,0,Microsoft Office 2004 Standard Upgrade (Mac),Microsoft,239.99,Adobe CS3 Design Standard Upgrade Windows,,unknown
3603,0,System Care Professional,Avanquest,49.95,I CopyDvds 2 Professional Edition,,unknown
3604,1,Recam Remote Monitoring Software,Mobi-Technologies-Inc.,129.0,Mobi-Cam 70008 Monitoring and Notification Software,Mobi-Technologies-Inc.,89.69
3605,0,NetManage Rumba Unix-Hp Edition V. 7.3 Upgrade License,NetManage,unknown,Rumba As/400 Edition V. 7.2 Upgrade Package 1 Processor Tier P60 C,unknown,26759.24
3606,0,NetManage Rumba Web AS/400 Edition,NetManage,unknown,Rumba AS/400 Edition V. 7.2 Upgrade Package 1 Processor Tier P50 C,unknown,20069.43
3607,0,Steinberg Cubase Studio 4,Steinberg,499.99,Steinberg Cubase 4 Educational Discount Music Production Software,,unknown
3608,0,Adobe CS3,Adobe,149.0,Adobe CS3 Web Standard,,unknown
3609,0,Adobe Creative Suite CS3 Web Premium,Adobe,1399.0,Adobe CS3 Web Standard Upsell,,unknown
3610,0,World History (Win/Mac) (Jewel Case),Fogware Publishing,9.99,Total 3D Home Deluxe (Jewel Case) (JCE-TH6),,unknown
3611,1,ClickArt 1.2 Million 2006 DVD,Encore Software,unknown,Encore Inc ClickArt 1.2 Million 2006 DVD,,42.27
3612,0,Retrospect 6.0 Desktop Mac Upgrade,Dantz,59.99,EMC Insignia Retrospect Desktop 6.x,,unknown
3613,0,The Print Shop 22 Deluxe,Encore,49.99,The Print Shop (R) 22,,unknown
3614,0,Microsoft Office Student and Teacher Edition 2004 Macintosh,Microsoft,149.99,Microsoft Microsoft Office Pro 2004 Software Suite Mac Apple & Mac Software,,unknown
3615,0,PrintMaster Platinum V 17.0,Encore Software,39.99,PrintMaster Gold V 17.0 (Win 98 ME 2000 XP),,unknown
3616,0,Hoyle Puzzle & Board Games,Encore Software,19.95,Hoyle (R) Card Games 2007,,unknown
3617,0,Doom 3 (Mac),Aspyr Media,39.99,Adobe Illustrator CS3 (Mac),,unknown
3618,0,Adobe Creative Suite CS3 Production Premium Upsell,Adobe,1199.0,Adobe Creative Suite 3 (CS3) Web Standard 3 Windows Upsell from Dreamweaver or Flash,,unknown
3619,0,Microsoft Windows XP Professional Full Version with SP2,Microsoft,299.99,Avid Xpress Pro Video Editing Software for Mac and Windows Professional Editing Software,,unknown
3620,0,TLC Arthur's Kindergarten Learning System,Encore,19.99,Encore TLC Dr Seuss Reading Learning System,,unknown
3621,0,3D Home Architect Landscape V.8 by Encore Software,Encore Software,39.99,Punch! Home Design Architectural Series 18 (by Punch Software),Punch Software,unknown
3622,0,Britannica Deluxe,Avanquest Software,29.95,Business PlanMaker Deluxe,,unknown
3623,0,SureTrak Project Manager 3.0,Primavera Systems,499.0,"SureTrak Project Manager V. 3.0 Complete Package, 1 User CD Win",,unknown
3624,0,OnOne Software Intellihance Pro,OnOne Software,unknown,OnOne Software Genuine Fractals 5 Full,unknown,148.97
3625,0,Microsoft Office 2004 Professional (Mac),Microsoft,499.99,Microsoft Word 2007 (CAL),Unknown,unknown
3626,0,Microsoft OneNote 2007 Upgrade,Microsoft,79.95,Microsoft OneNote 2007 (PC),,unknown
3627,0,Microsoft Mappoint 2006 with GPS,Microsoft,349.0,Microsoft Office 2004 Software Suite (Mac Apple & Mac Software),,unknown
3628,0,Adobe Illustrator CS3,Adobe,599.0,Adobe Illustrator CS3 Upgrade from Freehand for Mac,,unknown
3629,0,Adobe Premiere Pro 2.0,Adobe,849.0,Adobe CS3 Production Premium,,unknown
3630,0,Punch! Master Landscape Professional & Home Design V10.0,Punch!,69.95,Punch Software Punch ! Home Design Suite Professional Complete Product Architectural Standard 1 User (S) Complete Product PC,,unknown
3631,0,Adobe Illustrator CS3 Upgrade from Freehand [Mac],Adobe,199.0,Adobe Illustrator CS3 (Mac),,unknown
3632,0,Adobe Dreamweaver CS3 Upgrade,Adobe,199.0,Adobe Dreamweaver CS3 Academic Edition,Adobe Education Box,195.99
3633,0,QuickBooks Premier Non-Profit Edition 2005,Intuit Inc.,499.95,Intuit QuickBooks Simple Start Edition 2007 Software for Windows Tax & Finance Software,,unknown
3634,0,Punch! 5 in 1 Home Design,Punch Software,39.99,Punch Software Punch ! 5 in 1 Home Design,Punch Software,35.99
3635,0,Microsoft Windows Small Business Server CAL 2003 License Pack,Microsoft,unknown,Microsoft System Center Essentials 2007 License (20 Clients) Win English,Unknown,379.43
3636,1,Hoyle Card Games,Encore Software,9.99,Encore Software Hoyle Card Games (Win 98 ME 2000 XP),,7.47
3637,0,Aircraft Collector's Second Edition,,19.95,Abacus Software S532 Military Aircraft Collection for PC,Abacus Software,18.99
3638,0,Adventure Workshop 7th Edition,Encore Software,19.99,Encore Software Adventure Workshop 1st-3rd Grade 7th Ed SB CS by Riverdeep,,17.97
3639,0,Adobe Dreamweaver CS3 Upgrade [Mac],Adobe,199.0,Adobe CS3 Web Premium Upgrade,,unknown
3640,0,Adobe After Effects CS3,Adobe,999.0,Adobe Premiere Pro CS3,,unknown
3641,0,Family Tree Maker 11.2 Collector's Edition,Encore,109.95,Family Tree Maker Deluxe 11.2,,unknown
3642,0,Mavis Beacon Typing 17 (Win/Mac),Encore Software,19.99,Mavis Beacon Teaches Typing 16 Deluxe,,unknown
3643,0,Microsoft Office & Windows Training,,29.99,Microsoft Office 2004 Student/Teacher Edition,,145.99
3644,0,Cisco Systems Enterprise CiscoWorks v.6.1 for Windows Upgrade CWW-6.1 - Win-MR,Cisco Systems,unknown,Cisco CiscoWorks v.6.1 for Windows Upgrade CWW-6.1 - Win-MR,Unknown,225.0
3645,0,Microsoft Works Suite 2006,Microsoft,99.0,Microsoft Academic Microsoft Visio 2003 Professional,,unknown
3646,0,Adobe Photoshop CS3 Extended Upgrade,Adobe,349.0,Adobe Photoshop Lightroom,,unknown
3647,0,WASP Barcode Labeler Complete Package (3 Users) Std CD,WASP Technologies,unknown,Adobe Photoshop CS3 Extended Complete Package (1 User) Academic CD Mac,Unknown,279.0
3648,0,Microspot MacDraft Professional,Microspot Ltd.,349.99,Microsoft Money 2007 Premium,,unknown
3649,1,Hoyle South Beach Solitaire,Encore,9.99,Encore Software Hoyle South Beach Solitaire Win 98 ME 2000 XP,,unknown
3650,0,Adobe Creative Suite CS3 Web Standard Upgrade,Adobe,399.0,Adobe CS3 Web Standard Upsell,,unknown
3651,0,Adobe Creative Suite CS3 Web Premium,Adobe,1399.0,Adobe Creative Suite 3 (CS3) Design Suite Standard Upgrade (Upsell),,unknown
3652,0,Microsoft Productivity Pack for Windows Mobile,Microsoft,29.99,Pinnacle Mobile Media Converter Software for Windows iPod Software,,unknown
3653,0,3D Home Architect Landscape Designer V8,Encore Software,29.99,Punch! Master Landscape and Home Design (25100),Punch Software,45.99
3654,0,Microsoft Office Mac 2004 English,Microsoft Corporation,unknown,Microsoft Office OneNote 2007 Complete Package,unknown,78.99
3655,0,M-Audio Pro Tools M-Powered 7.3,M-Audio,299.99,Ableton Live 6 Software Music Production Software,,unknown
3656,0,Microsoft OneNote 2007,Microsoft,99.95,Microsoft Office 2004 Software Suite OEM Mac Apple & Mac Software,,unknown
3657,0,Microsoft Office 2004 Professional (Mac),Microsoft,499.99,Microsoft Office 2004 Software Suite OEM Mac Apple & Mac Software,,unknown
3658,0,Adobe CS3 Design Premium (MacOSX DVD),Adobe,599.0,Adobe CS3 Design Standard Academic,,unknown
3659,0,Microsoft Visual Studio Team Edition for Software Testers 2005 with MSDN Premium,Microsoft,2309.0,Microsoft Visual Studio Team Suite 2005 with MSDN Premium Subscriptions Complete Product,,unknown
3660,1,iaudioize Magnetic Time for PC and Mac,SOS Aggregation,39.99,iaudioize Magnetic Time for PC and Mac,,unknown
3661,0,Instant Immersion Japanese (Audio Book),,unknown,Instant Immerse Italian DLUX 2,,36.11
3662,0,Microsoft Windows Server 2003 Client Additional License for Devices 5 Pack,Microsoft,209.0,Microsoft Windows XP Professional Edition (Upgrade),,unknown
3663,0,Adventure Workshop 1st-3rd Grade 8th Edition,Encore,19.99,Encore Software Adventure Workshop 4th-6th Grade 7th Ed SB CS by Riverdeep,,unknown
3664,0,Safekeeper Plus,,39.99,Bling Software Limited Safekeeper Plus,,39.99
3665,0,Punch! Home Design Architectural Series 4000 V10,Punch!,199.99,Punch Software 24100 Punch! 5 in 1 Home Design Complete Product Architectural 1 User Complete Product,,unknown
3666,0,QuickBooks Premier Non-Profit Edition,Intuit Inc.,499.95,QuickBooks Premier Professional Services Edition (2007) Software Win Tax & Finance Software,,unknown
3667,0,Adobe Creative Suite CS3 Design Standard [Mac],Adobe,1199.0,Adobe Creative Suite (V3.0) Design Premium Mac,,1482.0
3668,0,Adobe Photoshop Elements 5 and Premiere Elements 3 Bundle Win MiniBox,Adobe,242.62,Adobe Premiere Elements 3 and Adobe Photoshop Elements 5 Software for Windows Consumer Video Editing Software,unknown,unknown
3669,0,Instant Immersion Japanese 2.0,Topics Entertainment,19.99,Instant Immerse German DLUX 2.0,,unknown
3670,0,Adobe Photoshop CS3 Extended Upgrade [Mac],Adobe,349.0,Adobe Photoshop Elements 4.0 Photo-Editing Software for Mac,,unknown
3671,0,Microsoft Office 2004 Standard Upgrade (Mac),Microsoft,239.99,Microsoft Windows XP Professional Edition (Upgrade),,unknown
