id,label,left_title,left_manufacturer,left_price,right_title,right_manufacturer,right_price
4957,1,DK Amazing Animals 1.1,Global Software Publishing,9.99,Global Software DK Amazing Animals 1.1 Win 95/98/2000/XP/Vista,Global Software Publishing,9.08
4958,0,Microsoft PowerPoint 2004 Upgrade (Mac),Microsoft,109.99,Microsoft Office Word 2004 for Mac Full Version,,unknown
4959,0,Adobe Creative Suite CS3 Web Standard,Adobe,999.0,Adobe CS3 Web Premium Academic,,unknown
4960,1,Power On Now Up-to-Date & Contact Windows,Power-On Software,129.99,Now Software Nuw45e1k Now Up-to-Date & Contact for Windows,Power-On Software,114.99
4961,0,PDF Converter Professional V4 English,Nuance Communications Inc.,99.99,I CopyDvds 2 Professional Edition,,unknown
4962,0,Reader Rabbit Learning System 1st Grade,Encore Software,29.99,Reader Rabbit Reading Learning System 2007,,unknown
4963,0,Microsoft Office 2004 Professional (Mac),Microsoft,499.99,Microsoft Academic Microsoft Office Project 2003 Professional,,unknown
4964,0,QuickBooks Premier Manufacturer and Wholesale Edition 2007,Intuit,399.95,QuickBooks Pro 2007 (R),,unknown
4965,0,Microsoft Windows Vista Business Full Version [DVD],Microsoft,299.95,Microsoft Windows Vista Business Full Version,,unknown
4966,0,Punch! Home Design Architectural Series 18,Punch!,129.99,Punch Software Professional Home Design Suite for Windows,Punch Software,62.99
4967,0,Microsoft Office Excel 2007,Microsoft,229.95,Microsoft Word 2004,,unknown
4968,0,Instant Immersion Italian Deluxe 2.0,Topics Entertainment,49.99,Instant Immersion Spanish Deluxe 2,,unknown
4969,0,Punch! Professional Home Design Suite,Punch Software,69.99,Punch! Home Design Architectural Series 18 (Small Box),Punch Software,unknown
4970,0,QuickBooks Premier Non-Profit Edition 2007,Intuit,399.95,Intuit Inc QuickBooks Premier Non-Profit Ed 2005,,unknown
4971,0,Microsoft PowerPoint 2004 (Mac),Microsoft,229.99,Microsoft Money 2007 Premium (PC),,unknown
4972,1,Microspot Interiors,Microspot Ltd.,99.95,Microspot Interiors (Mac 10.2 or Later),,unknown
4973,0,Microsoft OneNote 2007 Upgrade,Microsoft,79.95,Microsoft Office 2004 Standard,,unknown
4974,0,TLC Arthur's Kindergarten Learning System,Encore,19.99,Dr. Seuss Reading Learning System,,unknown
4975,0,Steinberg Nuendo 3 Digital Audio Software,Steinberg,2499.0,Steinberg Cubase Studio 4 Music Production Software,,unknown
4976,0,TLC Dr. Seuss Reading Learning System,Encore,19.99,Student Home Learning System,,unknown
4977,0,Adobe Premiere Pro CS3,Adobe,799.0,Adobe CS3 Web Standard,,unknown
4978,0,Instant Immersion Italian Platinum,Topics Entertainment,129.99,Instant Immersion 33 Languages,Topics Entertainment,unknown
4979,0,Microsoft Office Small Business 2007 Full Version,Microsoft,449.95,Microsoft Money 2007 Home and Business (PC),,unknown
4980,0,Quicken 2007 Premier,Intuit,79.95,QuickBooks (R) Pro 2007,,unknown
4981,1,Final Cut Express 2.0 Upgrade,Apple Software,99.99,Final Cut Express 2.0 Upgrade (Apple Software M9372Z/A),Apple Software,79.99
4982,0,Scrapbook for Windows,,unknown,ACT! 2004 for Windows,,249.95
4983,0,Punch! Super Home Suite 3.0,Punch Software,49.99,Punch Software Punch ! Super Home Suite,unknown,unknown
4984,0,Microsoft Office 2004 Standard (Mac),Microsoft,399.99,Microsoft Excel 2007 (CAL),Unknown,unknown
4985,0,Civilization IV DVD-ROM (Mac),Aspyr Media,49.99,Sid Meier's Civilization IV Mac,,unknown
4986,0,Wheel of Fortune Deluxe,Encore,19.99,Encore Software Wheel of Fortune Deluxe,,unknown
4987,0,Quicken 2007 Premier,Intuit,79.95,Quicken (R) for Mac 2007,,unknown
4988,0,National Geographic Presents: Forces of Nature,,29.99,National Geographic Photo Gallery Topics,,unknown
4989,0,Total 3D Home & Landscape Design Suite Version 9,Individual Software,39.99,Punch ! Professional Home Design Suite for Windows (14100),Punch Software,62.99
4990,0,Adobe Acrobat Pro Upgrade (Pro to Pro) Mac,Adobe Software,273.0,Adobe Acrobat Professional 7,,unknown
4991,0,Century Software TinyTerm Plus V.4.0 Complete Product,Century Software,unknown,Sony Creative Software Vegas43 ; DVD Production Suite V.7.0 Complete Product,,262.82
4992,0,Microspot Interiors,Microspot Ltd.,99.95,Star Wars Empire at War (Mac Intel),,unknown
4993,0,Adobe Creative Suite CS3 Web Premium [Mac],Adobe,1599.0,Adobe CS3 Web Standard Upgrade,,unknown
4994,0,Blues Clues Preschool,Humongous Entertainment,unknown,Brain Play Preschool 1st Grade,,25.99
4995,0,Microsoft Productivity Pack for Windows Mobile,Microsoft,29.99,Resco Explorer 2007 for PocketPC Windows Mobile Software for Pocket PC,,unknown
4996,0,ValueSoft Tune Transfer for iPod Software for Windows XP,ValueSoft,29.95,Powerhouse Migo for iPod for Windows,,unknown
4997,0,Adobe Dreamweaver CS3,Adobe,399.0,Adobe InDesign CS3 Upgrade,,unknown
4998,0,Family Tree Maker 2008 Platinum,Encore,99.95,Family Tree Maker Version 16 Deluxe (Media),,unknown
4999,0,Encyclopedia Britannica Deluxe (2008) Win/Mac,Avanquest,29.95,Britannica Deluxe (2008) Win/Mac,,unknown
5000,1,Math Success Deluxe 2008,Topics Entertainment,49.99,Topics Entertainment Math Success Deluxe 2008,,unknown
5001,0,Microsoft Windows Vista Home Basic Upgrade [DVD],Microsoft,99.95,Microsoft Windows XP Professional Edition (Upgrade),Unknown,unknown
5002,0,Punch! Home Design Architectural Series 4000 V10,Punch!,199.99,Punch Software Professional Home Design Suite for Windows,Punch Software,62.99
5003,0,Microsoft OneNote 2007 Upgrade,Microsoft,79.95,Microsoft Office 2004 Standard Upgrade,,unknown
5004,0,Microsoft Visio Standard 2007,Microsoft,259.95,Microsoft Word 2007 Upgrade (PC),,unknown
5005,1,Mavis Beacon Teaches Typing 16,Broderbund,19.99,Mavis Beacon 16,,unknown
5006,0,Adobe Creative Suite CS3 Web Premium,Adobe,1399.0,Adobe Creative Suite 3 Web Standard Complete Package,,1056.98
5007,1,Hoyle Board Games,Encore,9.99,Encore Software Hoyle Board Games (Win 98 ME 2000 XP),,unknown
5008,0,Webroot Spy Sweeper Antispyware,Webroot Software,29.95,Webroot Desktop Firewall,Webroot Software,unknown
5009,0,Peachtree by Sage Premium Accounting for Nonprofits 2007,Sage Software,599.99,Peachtree (R) Compatible Continuous Checks - Accounting for Windows 8.0-2004 Version,,unknown
5010,0,Adobe Acrobat Professional 8 (Windows),Adobe,273.0,System Care ? Professional,,unknown
5011,0,Microsoft Windows Small Business Server CAL 2003 License Pack,Microsoft,unknown,Microsoft Windows Server 2003 Client Access License (CAL) 20-Pack (per user),Microsoft,688.99
5012,0,Microsoft Office Small Business 2007 Full Version,Microsoft,449.95,Microsoft (R) Office 2004 for Mac Standard Edition Upgrade Version,,unknown
5013,0,Adobe Creative Suite CS3 Design Standard Upgrade [Mac],Adobe,399.0,Adobe Creative Suite 3 Design Premium Product Upgrade Package 1 User Upgrade,,unknown
5014,0,Age of Empires III,Destineer,49.99,Age of Empires III : WarChiefs Expansion Pack,,unknown
5015,0,Punch! Master Landscape & Home Design,Punch Software,99.99,Punch Software 20100 Punch! 5 in 1 Home Design,Punch Software,35.99
5016,1,Wisdom of the Bible Holy Land Edition,Hip Interactive,29.99,Tri Synergy Inc Wisdom of the Bible Holy Land Edition,,unknown
5017,0,Microsoft Windows XP Home Edition Full Version with SP2,Microsoft,199.0,Microsoft Windows Server Enterprise Edition License & Software Assurance 1U,,unknown
5018,0,SystemSuite 8 Professional,Individual Software,49.99,Avanquest USA LLC System Care Professional,,unknown
5019,0,Adobe Premiere Pro CS3,Adobe,799.0,Adobe CS3 Design Premium Upgrade,,unknown
5020,0,Family Tree Maker Version 16 Collector's Edition (SBCS),Encore Software,99.99,Family Tree Maker V 16 Essentials,,unknown
5021,0,Microsoft Excel 2004 (Mac),Microsoft,229.99,Microsoft Office 2004 for Mac Standard Edition Upgrade Version,,unknown
5022,0,Punch! Professional Home Design Suite,Punch Software,69.99,Punch ! Home Design Architectural Series 4000 v. 10.0 (Architectural PC),,unknown
5023,0,Genuine Fractals Print Pro 4.1,OnOne Software,unknown,OnOne Software Inc. Genuine Fractals Print Pro 5 Upgrade,,66.97
5024,0,Adobe Premiere Pro 2.0,Adobe,849.0,Adobe Premiere Pro CS3 Upgrade,,unknown
5025,0,Punch! Master Landscape & Home Design,Punch Software,99.99,Punch ! Home Design Architectural Series 18 (Punch Software),Punch Software,118.99
5026,1,StudyWorks! Teaching Pro: Middle School Math & Science (Win/Mac),Global Software Publishing,29.99,Middle School Math & Science (Teaching Pro by StudyWorks!) for Win/Mac,Global Software Publishing,unknown
5027,0,NetManage Rumba Unix-Hp Edition V. 7.3 Upgrade License,NetManage,unknown,Rumba As/400 Edition V. 7.4 Upgrade License 1 Processor Tier P10 C,unknown,3223.26
5028,0,Adobe CS3,Adobe,149.0,Adobe After Effects CS3,Unknown,unknown
5029,0,Adobe Photoshop CS3 Extended,Adobe,999.0,Adobe CS3 Design Standard,,unknown
5030,0,Instant Immersion Spanish Audio Deluxe,Topics Entertainment,39.95,Topics Entertainment Instant Immersion Ingles Audio Deluxe,,unknown
5031,0,Total 3D Home & Landscape Design Suite Version 9,Individual Software,39.99,3D Home Architect Landscape V.8 by Encore Software,,unknown
5032,0,Instant Immersion Italian V2.0,,29.99,Instant Immersion 33 Languages,Unknown,unknown
5033,0,Apple Logic Pro 7.2 Upgrade,Apple,299.0,Onone Software QX-Tools Pro 7 Upgrade,,unknown
5034,0,Adobe Creative Suite CS3 Design Standard Upgrade [Mac],Adobe,399.0,Adobe Dreamweaver CS3 Upgrade,unknown,unknown
5035,1,Punch! Viacad 2D/3D,Punch! Software,99.0,Viacad 2D/3D (Win 2000 XP Vista),,unknown
5036,0,Adobe Acrobat Professional 8 (Windows),Adobe,273.0,Adobe Flash CS3 Professional Complete Package 1 User Academic CD Windows,,unknown
5037,0,Microsoft Windows Small Business Server Premium 2003 R2 Upgrade,Microsoft,709.0,Microsoft Windows XP Professional Edition (Upgrade),,unknown
5038,0,Microsoft Excel 2004 (Mac),Microsoft,229.99,Microsoft Word 2007,,unknown
5039,0,Adobe Photoshop CS3 Extended Upgrade [Mac],Adobe,349.0,Adobe Photoshop CS3 for Mac,,unknown
5040,0,Punch! Home Design Architectura Series 18,Punch! Software,129.99,"Punch! 5 in 1 Home Design Complete Package (1 User CD, Win)",,unknown
5041,0,OnOne Software PXL Smartscale Windows and Macintosh,OnOne Software,unknown,OnOne Software Plug-in Suite Full,unknown,393.68
5042,0,Symantec Backup Exec 11d for Windows Small Business Server,Symantec,885.83,Symantec Backup Exec 11d for Windows Small Business Server Standard with Continuous,,unknown
5043,0,Instant Immersion Spanish (Audio Book),,unknown,Instant Immersion Translator Deluxe 2.0,,22.9
5044,0,Adobe Photoshop CS2 (Mac) [Old Version],Adobe,649.0,Adobe Illustrator CS3 (Mac),,unknown
5045,1,Computrace LoJack for Laptops 3 Year License (Mac),Absolute Software,99.95,Absolute Software Computrace LoJack for Laptops 3 Year License Mac 10.2 or Higher,,80.97
5046,0,The Sims 2 Nightlife Expansion Pack,Aspyr Media,34.99,The Sims 2 University Expansion Pack,,unknown
5047,0,Adobe Creative Suite CS3 Production Premium Upgrade,Adobe,799.0,"Adobe Creative Suite 3 Design Premium Product Upgrade Package, 1 User Upgrade",,unknown
5048,0,Adobe Production Studio Premium,Adobe,1699.0,Adobe CS3 Production Premium Upgrade,,unknown
5049,0,Microsoft Office & Windows Training Professional,,unknown,Microsoft Virtual PC 7.0 (Windows XP Home),,205.99
5050,0,Microsoft Works Suite 2006,Microsoft,99.0,CSDC Namo WebEditor Suite 2006 (Client Access License),,unknown
5051,0,Computrace LoJack for Laptops 3 Year License (Mac),Absolute Software,99.95,Computrace LoJack for Laptops 1 Year License (Win XP),,unknown
5052,0,Adobe Creative Suite CS3 Design Premium (Mac),Adobe,1599.0,Adobe CS3 Design Premium,,unknown
5053,0,Adobe Flash Pro CS3 Upgrade [Mac],Adobe,199.0,Adobe CS3 Production Premium,,unknown
5054,0,QuickBooks Simple Start 2007,Intuit,99.95,QuickBooks Pro 2007 (Windows),,unknown
5055,0,Sony Sound Forge 9 Boxed Upgrade,Sony Media,232.05,Sony Creative Software SFAS9000 Sound Forge Audio Studio 9,,unknown
5056,1,Adventure Workshop Preschool,Encore Software,29.99,Encore Software Adventure Workshop Preschool (Jewel Case),,unknown
5057,0,Adobe Photoshop Elements 4 Edu Mac,Adobe Education Box,69.0,Adobe Photoshop Elements 4.0 Mac,,unknown
5058,0,Black & White Platinum Pack,Feral Interactive,29.99,InterVideo WinDVD 8 Platinum,,unknown
5059,1,Adobe Premiere Pro CS3 Upgrade,Adobe,299.0,Premiere Pro CS3 Mac Upgrade,,unknown
5060,1,McAfee VirusScan Plus 3 User,McAfee,59.99,McAfee Inc McAfee VirusScan Plus Sub 1:1 3U MB EN,,unknown
5061,0,QuickBooks Point-of-Sale Basic 6.0,Intuit,799.95,QuickBooks (R) Point of Sale 2007: Basic Retail Management 6.0 Bundle,,unknown
5062,1,Adobe Fireworks CS3 [Mac],Adobe,299.0,Adobe Fireworks CS3,,unknown
5063,0,OnOne Essentials for Adobe Photoshop Elements Version 2 Full,OnOne Software,59.95,OnOne Essentials v.1.0 for Photoshop Elements Complete Product (Graphics/Designing) 1 User Complete Product Standard English PC/Mac,,unknown
5064,0,The Universe (Win/Mac) (Jewel Case),Fogware Publishing,9.99,Total 3D Home Deluxe (Jewel Case) (JCE-TH6),,unknown
5065,0,Elementary Advantage,,unknown,Elementary School Success Deluxe,,12.95
5066,0,Adobe Creative Suite CS3 Web Standard Upgrade,Adobe,399.0,State Standards Grade 8,,unknown
5067,0,3D Home Architect Home Design Deluxe Version 9,Encore,29.99,3D Home Architect Landscape V.8 by Encore Software,,unknown
5068,0,Classification & Ecology (Win/Mac) (Jewel Case),Fogware Publishing,9.99,Merriam-Webster's Dictionary (Win/Mac) (Jewel Case) (10462),,unknown
5069,0,Peachtree by Sage Premium Accounting 2007,Sage Software,499.99,Sage Peachtree Complete Accounting 2007 (Windows) Tax & Finance Software,,unknown
5070,1,Family Tree Maker Version 16 Essentials,Encore,29.95,Encore Inc Family Tree Maker V 16 Essentials,,unknown
5071,0,Retrospect 6.0 Desktop Mac,Dantz,99.99,EMC Insignia Retrospect Server 6.0 for Mac Upgrade,,unknown
5072,1,Talk Now ! Learn Afrikaans Beginning Level,Eurotalk,29.99,Topics Entertainment Talk Now ! Afrikaans Beginners,,unknown
5073,0,Avid Liquid vs 7 Software,Avid Technology,888.75,Software,,unknown
5074,0,Microsoft Windows Small Business Server Premium 2003 R2 Upgrade,Microsoft,709.0,Microsoft Windows Server 2003 for Small Business License (5 Device CALs),,unknown
5075,0,Sibelius 4 Professional Edition,Sibelius Software Ltd.,599.99,Adobe Acrobat Professional 7,Unknown,350.0
5076,0,The Print Shop 21 Deluxe by Broderbund,Encore Software,unknown,Encore Software The Print Shop 22 SB CS by The Print Shop,,25.97
5077,0,Adobe Production Studio Premium,Adobe,1699.0,Sony Media Software Acid Music Studio 7 (Music Production Software),,unknown
5078,0,Adobe Illustrator CS3 [Mac],Adobe,599.0,Adobe InDesign CS3 for Mac,,unknown
5079,1,Jumpstart 1st Grade,Knowledge Adventure,unknown,Jumpstart 1st Grade (JC),,9.9
5080,0,Cosmi Talking Math & More for Kids (Windows),Cosmi,unknown,Learning QuickBooks (R) for Windows (R),,39.99
5081,0,Microsoft Office & Windows Training Professional,,unknown,Microsoft Academic Microsoft Office Project 2003 Professional,,176.99
5082,0,Classification & Ecology (Win/Mac) (Jewel Case),Fogware Publishing,9.99,Poetry Fiction and Drama (Win/Mac) (Jewel Case) (10172),,unknown
5083,0,Microsoft Visio Standard 2007,Microsoft,259.95,Microsoft Windows Vista Business (PC),,unknown
5084,0,Home Design Architect Series 3000 V10,Punch Software,149.95,Punch Home Design Architectural Series 18,Punch Software,118.99
5085,0,Corel WordPerfect Office X3 Professional Edition,Corel,399.99,Sony Vegas 6 Video Editing Software (Professional Edition),Sony Pictures Digital Entertainment,unknown
5086,0,Microsoft Mappoint 2006 Standard Edition,Microsoft,299.0,Microsoft Project Standard 2007 (CAL),Unknown,unknown
5087,0,Microsoft Word 2004 Upgrade (Mac),Microsoft,109.99,Microsoft Project Standard 2007,,unknown
5088,0,Adobe After Effects Professional 6.5 Upgrade from Standard to Professional,Adobe,499.99,Adobe After Effects Professional 7 Software for Windows Effects Software,,unknown
5089,0,Adobe Creative Suite CS3 Web Premium Upgrade [Mac],Adobe,499.0,Adobe Illustrator CS3 Upgrade from Freehand for Mac,,unknown
5090,0,Punch! Professional Home Design,Punch Software,89.99,Adobe CS3 Flash Professional,Unknown,unknown
5091,0,Adobe Flash Pro CS3,Adobe,699.0,Adobe Photoshop CS3,,unknown
5092,1,Punch! Professional Home Design Suite,Punch Software,69.99,Punch Software Punch ! Professional Home Design Suite (Small Box),Punch Software,62.99
5093,0,Instant Immersion American Sign Language Win/Mac,Topics Entertainment,9.99,Instant Immersion Language Lab Deluxe Edition,,unknown
5094,0,Adobe After Effects CS3 Upgrade,Adobe,299.0,Adobe Photoshop CS3 for Mac Upgrade,,unknown
5095,0,Lego Star Wars (DVD) (Mac),Aspyr Media,29.99,Aspyr Star Wars Battlefront Mac OS X,,unknown
5096,1,Makemusic Finale 2007 Win/Mac,Makemusic,600.0,Make Finale 2007 Software Music Production Software,Unknown,unknown
5097,0,Sequel (PC/Mac) Music Creation & Performance Software,Steinberg,129.0,Sony Media Software Super Duper Music Looper Software Music Production Software,Sony-Media-Software,unknown
5098,0,Microsoft Virtual PC for Mac 7.0 with Windows 2000,Microsoft,249.99,Microsoft Windows XP Home Edition SP2 Retail Box,,unknown
5099,1,Adobe Illustrator CS3 [Mac],Adobe,599.0,Adobe Illustrator CS3 for Mac,,unknown
5100,0,Microsoft Office Student and Teacher Edition 2004 Macintosh,Microsoft,149.99,Microsoft Office 2004 Std Upgrade,,unknown
5101,0,Microsoft Excel 2004 (Mac),Microsoft,229.99,Microsoft Project Standard 2007,,unknown
5102,0,Microsoft Windows Server 2003 Client Additional License,Microsoft,809.0,Microsoft Windows Server 2003 Small Business License (5 Device CALs),,unknown
5103,0,Microsoft ASP .NET Web Matrix,Microsoft,30.0,Microsoft (R) MapPoint (R) 2006,,unknown
5104,0,Adobe Acrobat Professional 8 (Windows),Adobe,273.0,Sony Vegas Pro 7 + DVD Editing Software with Sound Forge 8 for Windows Professional Editing Software,,unknown
5105,0,Final Draft 7 Screen Writing Software,Final Draft,249.99,Final Draft 7 Screen Writing Software (Mac/Win),,unknown
5106,0,Microsoft Windows Small Business Server CAL 2003 License Pack,Microsoft,unknown,Microsoft Windows Vista Business (PC),,299.99
5107,0,QuickBooks Pro 2007 for Mac,Intuit,199.95,QuickBooks Point of Sale 2007: Basic Retail Management 6.0,,unknown
5108,0,Adobe Premiere Pro CS3,Adobe,799.0,Adobe Dreamweaver CS3 Academic Edition,Adobe,unknown
5109,0,Adobe Photoshop Elements 5.0 / Premier Elements 3.0,Adobe,149.99,Adobe Photoshop Elements 4.0 (Mac Academic),,unknown
5110,0,System Care Professional,Avanquest,49.95,OrgChart Professional 1.3,,unknown
5111,0,Hoyle Kids' Games JC,Encore,9.99,Hoyle (R) Card Games 2007,,unknown
5112,1,Apple Logic Pro 7.2,Apple,999.0,Logic Pro 7.2 (Apple/Emagic) Music Production Software,,unknown
5113,0,High School Advantage,Encore Software,29.95,Encore Middle School Advantage 2008 (Training/WBT PC),,33.97
5114,0,Punch! Master Landscape & Home Design,Punch! Software,99.99,"Punch! 5 in 1 Home Design Complete Package (1 User CD, Win)",,unknown
5115,0,Hoyle Card Games,Encore Software,19.99,Encore Hoyle Card Games,Encore,unknown
5116,0,Project X Project Management Software,Marware,199.95,Graphics Software,,unknown
5117,0,Registry Mechanic by Encore Software,Encore Software,46.52,Software,,unknown
5118,0,Windows Vista Business Spanish Full Version [DVD],Microsoft,329.95,Microsoft Windows Vista Business (PC),,unknown
5119,1,World of Warcraft 60 Day Pre-Paid Time Card,Blizzard Entertainment,29.99,Vivendi-Universal Games Inc 72305 World of Warcraft 60 Day Prepaid,,unknown
5120,0,Symantec Backup Exec SBS AWS 11D Win SBS Agent for Windows Systems,Symantec,447.74,Symantec Backup Exec 11D for Windows Small Business Server Premium with Continuo,,unknown
5121,0,Punch! 5 in 1 Home Design,Punch Software,39.99,Punch Software Professional Home Design Platinum Version 10,unknown,99.99
5122,0,Instant Immersion Spanish Deluxe 2.0,Topics Entertainment,49.99,Photo Explosion Deluxe (R) 2.0,,unknown
5123,0,Wacky Farm,,19.95,Wacky Farm,unknown,unknown
5124,0,World of Rainbow Fish,,19.99,World of Wild Cats,unknown,unknown
5125,0,Photo Explosion Deluxe 3.0,Nova Development,49.99,Photo Explosion Deluxe 3.0 Nova,,49.99
5126,1,Power Director 3,Avenquest Publishing USA Inc.,79.95,CyberLink Power Director 3,Avenquest Publishing USA Inc.,unknown
5127,0,Microsoft Office Small Business 2007 Full Version,Microsoft,449.95,Microsoft Office 2004 Software Suite OEM Mac Apple & Mac Software,,unknown
5128,0,Adobe Creative Suite CS3 Design Premium [Mac],Adobe,1799.0,Adobe CS3 Production Premium Upsell,,unknown
5129,0,Quicken Legal Business Pro 2007,Nolo Press,79.99,Business PlanMaker Pro 2008 (PC),,unknown
5130,0,Microsoft Visio Standard 2007 Version Upgrade,Microsoft,129.95,Microsoft Project Standard 2007 (CAL),Unknown,unknown
5131,0,Punch! Professional Home Design Suite,Punch Software,69.99,Punch Master Landscape & Home Design Architectural (1 User) PC,,unknown
5132,0,Microsoft Windows Terminal Server 2003 Client Additional License for Users - 5 User,Microsoft,669.0,Novanet Media/Client Server V. 10 License 3 Additional Servers Linux,,unknown
5133,0,M-Audio Pro Tools M-Powered 7.3,M-Audio,299.99,Steinberg Studio Case 2 Music Production System Educational Discount,,unknown
5134,0,WASP Bar Code WASP Bar Code Labeler Complete Package 3 Users Std CD,WASP Technologies,unknown,IBM WebSphere MQ Link for R/3 v. 1.2 Complete Package 1 Server CD,unknown,12567.39
5135,0,Professor Teaches Excel & Word,,19.99,Individual Software PMM-XW4 Professor Teaches Excel & Word 2007 Win 2000 XP Vista,unknown,17.97
5136,1,Mavis Beacon 17 Standard,Encore Software,19.95,Mavis Beacon Teaches Typing 17 Standard (PC/Mac) Encore,,unknown
5137,0,Family Tree Maker Version 16 Deluxe,Encore,69.95,Encore Inc Family Tree Maker Version 16 Collectors Edition,,unknown
5138,0,Microsoft Windows Server 2003 Client Additional License,Microsoft,809.0,Microsoft Windows Vista Business Upgrade License,,unknown
5139,0,Essential Business Tools 2.0,,19.99,Emedia Essential Bass Guitar DVD,Unknown,unknown
5140,0,World Book Encyclopedia,,19.99,Oxford World Encyclopedia,Tri Synergy Inc.,16.31
5141,0,Adobe Creative Suite CS3 Master Collection Upgrade [Mac],Adobe,1399.0,Adobe Creative Suite (V3.0) Design Premium Mac,,1482.0
5142,0,Allume Boost XP for Windows,Smith Micro Software,29.99,Abacus Scrapbook for Windows,,unknown
5143,0,Instant Immersion Translator Deluxe 2.0,Topics Entertainment,49.99,Instant Immersion Japanese (Audio Book) (Audio Book),,unknown
5144,0,Jumpstart Reading with Karaoke,Knowledge Adventure,29.99,Jumpstart Phonics (JC),,unknown
5145,0,Alsoft DiskWarrior : Mac Universal Binary,Alsoft,unknown,Alsoft Disk Warrior V/5 CD,,107.95
5146,0,Microsoft CRM Small Business Ed CAL 3.0 License Pack User CAL,Microsoft,9929.0,Microsoft Windows Server 2003 for Small Business License 5 Device CALs Open,,unknown
5147,1,Century Software TinyTerm Plus V.4.0 Complete Product,Century Software,unknown,Century Software TinyTerm Plus V.4.0 Complete Product Connectivity/Data Access 1 User (S) Complete Product Standard English PC,,188.97
5148,0,Art Explosion T-Shirt Factory Deluxe 3.0,Nova Development,29.99,Art Explosion (R) 800000,,unknown
5149,0,Reel Deal Casino Shuffle Master Edition,Phantom EFX,19.99,Reel Deal Casino Quest (Win 95/98/ME/2000/Xp),,unknown
5150,0,Microsoft Word 2004 Upgrade (Mac),Microsoft,109.99,Microsoft Windows Vista Business (PC),,unknown
5151,0,Microsoft Windows Vista Business Full Version [DVD],Microsoft,299.95,Microsoft Windows Vista Home Basic Upgrade (PC),,unknown
5152,0,Adobe Creative Suite CS3 Production Premium,Adobe,1699.0,Sony Vegas 7 + DVD Production Suite Software Full Version Video Editing and DVD Creation,,unknown
5153,0,Makemusic Finale 2007 Win/Mac,Makemusic,600.0,Make Finale 2006 Software Music Production Software,,unknown
5154,0,Punch! 5 in 1 Home Design,Punch Software,39.99,Punch Software Punch ! Professional Home Design Suite for Windows,Punch Software,62.99
5155,0,Mavis Beacon Teaches Typing Deluxe V17,Encore Software,39.99,Mavis Beacon 16,,unknown
5156,1,Vegas Movie Studio + DVD +8 Platinum,Sony Media,129.95,Sony Vegas Movie Studio + DVD V8 Platinum Edition Video Editing Software Professional Editing Software,unknown,129.95
5157,0,Hoyle Card Games,Encore Software,29.99,Hoyle Card Games,,unknown
5158,0,Adobe Creative Suite CS3 Design Premium,Adobe,1599.0,Total Training for Adobe Creative Suite 3 Design Premium,,unknown
5159,0,Computrace LoJack for Laptops 4 Year Subscription,Absolute Software,119.99,LoJack for Laptops Subscription Package 1 Year 1 Notebook,,unknown
5160,0,Microsoft Office FrontPage 2003 Academic Version Windows,Microsoft,159.98,Microsoft Windows XP Pro SP2 Retail,,unknown
5161,0,Adobe Flash Pro CS3,Adobe,699.0,Adobe CS3 Web Standard,,unknown
5162,0,Microsoft Windows XP Professional Full Version with SP2,Microsoft,299.99,Microsoft Windows XP Home Edition SP2 OEM,,unknown
5163,0,Adobe Premiere Pro CS3,Adobe,799.0,Adobe Contribute CS3,,unknown
5164,0,Microsoft Windows XP Professional Upgrade with SP2,Microsoft,199.99,Publisher 2007 Upgrade Microsoft (CAL),,unknown
5165,1,Hoyle Puzzle & Board Games 2007,Encore Software,19.99,Encore Software Hoyle Puzzle Games 2007 Win 98 ME 2000 XP,,unknown
5166,0,Jumpstart World 2nd Grade,Knowledge Adventure,19.99,Jumpstart Advanced 2nd Grade (PC/Mac) Knowledge Adventure,,unknown
5167,0,emedia Rock Guitar Method,emedia,39.99,emedia EG03014 Bass Method OS X,emedia,53.99
5168,0,Computrace LoJack for Laptops 3 Year License (Mac),Absolute Software,99.95,Absolute Software Computrace LoJack for Laptops 1 Year License Mac 10.2 or Higher,,unknown
5169,0,Instant Immersion Japanese Deluxe 2.0,Topics Entertainment,39.99,Instant Immersion Italian Deluxe 2.0,,unknown
5170,0,Weekly Reader Preparing for Kindergarten,,19.99,Reader Rabbit Kindergarten Special 2-CD Edition,,unknown
5171,0,Hoyle Puzzle & Board Games,Encore Software,19.95,"Hoyle Puzzle & Board Games 2005 Complete Package (1 User, PC CD, Win)",,unknown
