id,label,left_title,right_title
1058,1,Arlo Adjustable Wall Mount,Arlo Support d'inclinaison de caméra montable au plafond
1059,1,GoPro HERO5 Black 4K Camera,GoPro HERO5 Black
1060,0,Canon EF 70-300mm f/4-5.6L IS USM Autofocus Telephoto Zoom Lens,Canon EF-S 55-250mm f/4-5.6 IS STM Telephoto Zoom Lens for Select Canon Cameras
1061,1,GoPro Hero3+ Rechargeable Battery Battery LN53806 - AHDBT-302,GoPro Rechargeable Battery for HERO3 and HERO3+
1062,0,Gateway MX8000 6-Cell Li-Ion Battery (SQU-412),Canon LP-E17 Rechargeable Battery Pack
1063,0,DCH-100KT Smart Kit,Mini-caméra bullet HD Cloud sans fil
1064,0,GoPro Hero 4/3 Plus 2 and Camera Accessories Set,GoPro Battery BACPAC Hero
1065,1,ViewSonic VFD820-50 8-Inch Digital Photo Frame,ViewSonic VFD820-50 8-Inch Digital Photo Frame (Black)
1066,0,Uniden UDR444A 4.3 LCD Wireless Video Surveillance System,GoPro Hero Extended Battery Pack 4000mAh Epic L40GH
1067,0,Canon EF-S 55-250mm Camera & Camcorder Lenses,Sigma 70-300mm F4-5.6 DG Macro Lens
1068,1,Panasonic Lumix FZ100 Digital Camera,Panasonic Lumix FZ100
1069,0,16 Rods Octagon Softbox for Bowen or Alien Bee Monolight Strobe Studio,Go Pro Helmet Mount
1070,0,GoPro Rechargeable Battery for GoPro HERO3+ and HERO3,GoPro Dual Battery Charger
1071,0,Nikon AF-S 50mm f1.8G Single Lens Reflex Camera,Nikon AF-S DX 10-24mm f3.5-4.5G ED Digital SLR Camera
1072,0,Mixchips 26H3216 AUM 8MB SIMM RFB,Canon EF 70-200mm f/2.8L IS II USM Telephoto Zoom Lens for EOS SLR Cameras
1073,0,Nikon Telephoto AF Micro-Nikkor 105mm f/2.8G ED-IF AF-S VR Autofocus Lens,Nikon 10-24mm f/3.5-4.5G ED AF-S DX Zoom-Nikkor Lens
1074,0,Canon Right Angle Finder C (Includes ED-C and ED-D Adapters for All SLR Camera Digital Camera Viewfinder Attachment Accessories),"Canon LC-E6 Battery Charger for Canon EOS 5D Mark II, 7D & 60D Digital SLR-US Accessories"
1075,1,Canon ES-52 Lens Hood for EF 40mm f/2.8 STM Pancake,Lens Hood ES-52 Canon Lens
1076,0,D-Link DCS-2210L Full HD PoE Day/Night Network Camera,D-Link DCS-2332L
1077,0,Fujifilm Instax Mini 8 Camera with 3 Packs of Film and Bag,Veho VCC-005-MUVI-HDPRO Mini HD Body Camera Action Camcorder
1078,0,Transcend 32 GB Class 10 SDHC Flash Memory Card,10 PACK Transcend TS8GSDHC10 8GB SDHC Class Flash Memory Card
1079,0,Canon EF 70-300mm f/4-5.6L IS USM Autofocus Telephoto Zoom Lens,Canon EF-S 55-250mm f/4-5.6 IS STM Telephoto Zoom Lens for Select Canon Cameras
1080,1,GoPro 3-Way Camera Mount,GoPro 3-Way Mount
1081,0,Billingham Professional 335 Black Camera Bag,GoPro HERO3 Black Edition
1082,0,"8.1-Megapixel Digital Camera with 18x Optical Zoom, Black DMC-FZ18K",14.1 Megapixel Lumix Digital Camera DMC-FX700
1083,0,Canon DSLR EOS 60D Camera (Body Only),Canon DSLR EOS 5D Mark II Camera (Body Only)
1084,0,Aluratek 7 Digital Photo Frame,Panasonic Lumix FZ200 12.1 Megapixel Digital Camera
1085,0,GoPro Junior,GoPro Jaws Flex Clamp Mount
1086,1,Knog Qudos Action Video Light for GoPro Silver,Knog Qudos Action Video Light for GoPro Silver
1087,1,Transcend 128GB SDXC Class 10 UHS-1 Flash Memory Card Up to 90MB/s (TS128GSDXC10U1) - Computer Accessories & Peripherals,"Transcend 128GB SDXC Ultimate UHS-1 Memory Card, Class 10 Card"
1088,1,Manfrotto Professional DSLR Digital Camera Backpack 30,Manfrotto Professional Backpac 30 for reflex - Black MBMP-BP-30BB
1089,0,Panasonic Lumix Vario 14-45mm ASPH O.I.S Lens,Tamron AF 18-270mm F3.5-6.3 Di II VC PZD Nikon Mount
1090,0,Canon 24-105mm f/4L IS EF USM AF Lens,Canon EF 17-40mm f/4L USM L Series Wide-Angle Zoom Lens
1091,0,Nikon AF-S Nikkor 55-300mm f/4.5-5.6G ED VR DX Lens,Nikon AF-S Nikkor 105mm f/2.8G IF-ED VR
1092,0,SanDisk SD Secure Digital Card,Sandisk Ultra microSDXC Card
1093,0,Canon imageFORMULA DR-F120 Sheetfed Scanner - 600 dpi Optical,Canon Electronic Viewfinder EVF-DC1
1094,0,Barcode Technologies ZQ110 Mobile Receipt Printer,Garmin 1 010-11874-00 Rechargeable Batteries
1095,0,GoPro Grab Bag,Canon Gadget Bag 2400 Digital SLR camera carrying case
1096,0,Nikon D7100 Kit 24.1-megapixel digital SLR camera with 18-105mm zoom lens,Canon EOS Rebel T3i Digital SLR Camera Body Only
1097,0,GoPro Hero 3+ Silver Edition Battery,Panasonic VW-VBK360 Li-Ion Battery Pack
1098,0,Samsung SMART 20.3 Megapixel Black Digital Camera EV-NX300ZBATUS,Canon EF-S 18-55mm f/3.5-5.6 IS STM Lens
1099,1,Sony PXW-FS7 II Camera,Sony PXW-FS7M2 XDCAM Super 35 Camera System
1100,0,12.1 Megapixel Digital Camera DMC-FX48S Panasonic FX48S 4x Optical Zoom,Lumix Digital Camera DMC-LC40S Panasonic LC40S
1101,0,Canon BP-2L14 Series Battery for MV800/900 MD100/MD200/DC300,Canon NB-5L Rechargeable Lithium-ion Battery For the PowerShot SD-800 and SD-700 IS Series Digital
1102,0,Pentax DSLR 18-55mm Kit Lens,Canon EOS Rebel T3i Body Only
1103,0,Canon PowerShot SX540 HS Camera 20.3MP 1/2.3 CMOS 5184 x 3888 Black Specifications Canon Black Digital Cameras (1067C002 4549292056426),Canon PowerShot G7 X Mark II
1104,0,GoPro 3 Way Grip Arm Tripod Mount,GoPro Suction Cup (Official) Camera & Photo Accessories
1105,1,360RIZE Pro6E 360° Plug-n-Play Rig for GoPro HERO4,360RIZE Pro6LE 360° Plug-n-Play Rig for GoPro HERO4/3+/3
1106,0,Panasonic Li-Ion Battery Pack,Virb Lithium-ion Batterie
1107,0,Manfrotto Quick Release Plate 504PLONG,GoPro HERO3 Silver Edition Camera
1108,0,Canon EF Telephoto Zoom Lens 70 mm-200 mm,Canon EF-S 10-22mm USM
1109,0,Nikon DSLR Nikkor AF-S 28-300mm f3.5-5.6G ED VR Nikkor VR Camera,Nikon Zoom-Nikkor 10-24mm f/3.5-4.5G ED AF-S DX Lens
1110,0,Sony Compact Camera with 20X Optical Zoom - DSC-WX350,Sony Digital Camera (Black) - DSCW800
1111,1,Panasonic Lumix GF1K Series 12.1 Megapixel Interchangeable Lens Camera Kit,Panasonic Lumix GF1 with 14-45mm lens
1112,0,Camera & Camcorder Accessories,Canon Battery Charger CG-800 for 800 Series Batteries
1113,0,Canon PowerShot A2300 IS 16.0 MP Digital Camera with 5x Optical Zoom (Black) Point & Shoot Camera,Canon 20.1-Megapixel PowerShot G7 X Mark II Digital Camera
1114,0,Manfrotto Pro Video Head 75mm (MVH502A),Manfrotto MK190XPRO3-BHQ2 Aluminum 3 Section Tripod Kit w/ Ball Head
1115,0,Canon Telephoto EF 85mm f/1.8 USM Autofocus Lens,Canon Digital SLR Camera with EF 17-40mm F4L USM
1116,0,Canon DSLR EOS 1300D EF-S 18-55 IS II Single Lens Reflex Camera Kit,Canon DSLR EOS Rebel T6 EF-S 18-55mm f/3.5-5.6 IS II Kit
1117,0,MicroSD 16G,Sony DSCW800/B 20.1 MP Digital Camera (Black) Digital Cameras
1118,0,Transcend 64GB SDXC Class 10 Flash Memory Card Up to 30MB/s (TS64GSDXC10E) Camera & Photo Accessories,8GB SDHC Class 10
1119,1,SanDisk Extreme Pro CompactFlash 16GB 160MB/s,SanDisk Extreme Pro CompactFlash Card 16GB 160MB/s
1120,1,Canon DSLR EOS 5D Mark IV Camera with EF 24-105mm f/4L IS II USM Lens,Canon DSLR EOS 5D Mark IV Camera with 24-105mm f/4L II Lens
1121,0,Veho VCC-005-MUVI-HDPRO Mini HD Body Camera/Action Camcorder,GoPro HERO+ LCD HD Video Recording Camera
1122,0,Panasonic Lumix FZ100 DMC-FZ100,Lumix FZ60 16 Megapixel Digital Camera Panasonic DMC-FZ60K
1123,0,Transcend 128GB SDXC Class 10 Flash Memory Card,10 PACK Transcend TS8GSDHC10 8GB SDHC Class Flash Memory Card
1124,0,Sigma 10-20mm f/4-5.6 DC AF Lens for Sony Alpha Digital SLR Cameras,Sigma 120-400mm f/4.5-5.6 DG APO HSM Autofocus Zoom Lens for Sony
1125,0,Transcend 16GB SDHC Secure Digital Class 10,Fujifilm 4GB SDHC Memory Card Speed Class 10
1126,0,Canon Power Shot SX510 HS Point and Shoot Camera,Canon EOS 6D Body Digital SLR Camera
1127,0,Veho VCC-004 MUVI Atom No Proof Glory Body Camera/Action Camcorder Bundle,Veho Muvi HD10 Handfree Camcorder
1128,0,Canon Deluxe Gadget Bag 100EG (Holds 1-2 Cameras and 3-4 Lenses),MCOCEAN Accessories Set for GoPro Hero 4 / 3 Plus 2 and Camera
1129,0,Panasonic Lumix DMC-GH4 4K Micro Four Thirds Digital Camera Body,Fujifilm X-E2S Mirrorless Camera Body Silver
1130,1,Logitech Webcam C930e,Logitech C930e Webcam
1131,0,Nilox Battery F 60 Evo,GoPro Mic Stand
1132,0,Sony Alpha a6000 Mirrorless Camera with 16-50mm Retractable Lens Black,Sony ILCE A3000 Mount Type
1133,1,Sony Alpha Kit,Sony a6000 with 16-50mm Lens Digital Cameras
1134,0,Manfrotto 4 Section Aluminum Tripod MK190XPRO4-BHQ2,Manfrotto 3 Section Aluminum Tripod Kit MK190XPRO3-BHQ2
1135,0,Nikon EN-EL4A Rechargeable Battery,Sony Alpha a7 Mirrorless Digital Camera
1136,0,Sony VCT R100 Camera Tripod,Vanguard Alta Pro 263AT
1137,0,Sony 35mm f/1.8 Prime Lens for Most NEX E-Mount Cameras,Sony Alpha E-Mount FE 24-70mm f/2.8 GM Zoom Lens
1138,1,GoPro Hero3+ Camera Tethers,GoPro Camera Tethers
1139,1,Nilox Battery F 60 Evo,Nilox Battery F 60 Evo
1140,0,Goalinn 3 Way Grip Arm,Nilox Remote Control F60 Evo
1141,0,Sony Alpha ILCE6000L/S 24.3MP Mirrorless Digital Camera 4x 3.0 inch wide type TFT LCD (Silver),"Sony Cyber-shot Digital Camera RX100 II, 20.2MP, Black"
1142,0,GoPro Rechargeable Battery For HERO4 HERO4 - AHDBT-401,GoPro HERO4 Silver-US Video
1143,1,GoPro Hero 4 Black Edition,GoPro Hero 4 with Batteries and Dual Charger
1144,0,Sony Alpha a7RII Mirrorless Digital Camera M - Good,Panasonic GH4 Body Mirrorless
1145,0,Panasonic Lumix 5 Megapixel Digital Camera DMC-FZ20S,Panasonic Lumix Digital Camera DMC-LC40S
1146,0,Transcend SDXC 64GB Class 10,Transcend Ultimate - flash memory card 4 GB SDHC
1147,0,DOLICA Aluminum Alloy Proline Tripod,MeFoto RoadTrip Kit
1148,0,NIKON Nikon,Sigma 4.5mm F2.8 EX DC Circular Fisheye HSM (Nikon)
1149,0,Tamron DSLR Camera Tamron 18-270mm F/3.5-6.3 Di II VC PZD Nikon Mount Lens Kit,Sigma SLR Camera Sigma 70-300mm F4.0-5.6 DG APO Macro Nikon
1150,0,WTC-T201C Camera quan sat,WTC-D102H Camera quan sat
1151,0,Vigilance 3-Mpixel Outdoor Poe Mini Bullet Camera,D-Link DCS-6210BS Outdoor Full HD Vandal-Resistant Mini Fixed Smoked Dome Network Camera
1152,0,Nikon AF-S 70-200mm f/2.8G IF-ED VR II Lens,Nikon AF-S DX Nikkor 10-24mm f/3.5-4.5G ED Lens
1153,0,Sony Handycam Camcorder (White),Canon XF100 HD Professional Camcorder
1154,0,Honeywell Lettore 4850DR Appoggio,Sony VCT U14 Quick Release Plate
1155,1,Canon EF 75-300mm f/4-5.6 III Telephoto Zoom Lens,Canon EF 75-300 f/4-56 III (non-USM) Telephoto Lens
1156,0,Canon DSLR EOS 7D Camera with 18MP 1080HD Lens,Canon DSLR EOS 80D Camera with 18-135mm IS USM Lens
1157,1,Canon Wireless Remote Controller for Canon Digital SLR Cameras,RC-6 Wireless Remote Controller for Digital SLR Cameras
1158,0,Leica Battery for Total Stations TPS 1000 and 2000 GEB187,Zebra Single Battery Charging Cradle
1159,0,Canon GL2 Package 2,VIXIA HF G10 Canon VIXIA G10
1160,0,GoPro Curved and Flat Adhesive Mounts,GoPro Camera Tethers 5 Pack
1161,0,D-Link Mydlink Home Monitor 360 Wireless N HD Camera - Black Friday 2017,Full HD Cloud Wless IP Camera
1162,0,Logitech ConferenceCam 960-000866,Manfrotto HDSLR Remote Control
1163,1,Sigma 24-70mm f/2.8 IF EX DG HSM Autofocus Lens for Canon EOS,Sigma 24-70mm F2.8 EX DG HSM (Canon)
1164,0,Digital Foci Image Moments Powerful Digital Photo Album Frame,SanDisk Extreme SDXC 128GB 90MB/s UHS-I U3/Class 10
1165,1,Action outdoor Dual Battery Charger,Action outdoor Dual Battery Charger
1166,0,GoPro Doble Battery Charger for Hero 3/ 3+,GoPro HERO3 Black Edition Camera In-Car Video
1167,0,"Panasonic NE-1054 Inverter, Sony LED 55 4K Android TV XBR-55X707D, JBL Pulse 2 Portable Speaker, Bravia Led KDL-55W655D Full HD, Altavoz Bluetooth Flip 3, 65 Ultra HD TV XBR-65X857D, Panasonic NN-GD693RPH Microonda, XBR-65X757D, 32 NN-GF574S, NN-ST651, SkullCandy CHOPS BUDS Auriculares, NN-GF574M, NN-ST765SRPH Xtreme - portátil, 40 KDL-40W657D, Go Panasonic CAPACIDAD 0.9 P³ 800 WATTS, NN-SA968WRPH, NN-SA768W, NN-ST762SRBH, 48 KDL-48W657D, 49 XBR-49X707D TV, Sony E PZ 16-50 mm F3,5-5,6 OSS Lens, Barricade portatil",Samsung NX300 Mirrorless Digital Camera with 20-50mm F/3.5-5.6 ED II Lens White + Accessory Bundle
1168,1,Panasonic Lumix G Vario Lens 14-45mm F3.5-5.6 ASPH Micro Four Thirds MEGA Optical I.S.,Panasonic Lumix G Vario 14-45mm f/3.5-5.6 Asph Mega OIS
1169,0,Action outdoor Dual Battery Charger,Action outdoor 3 Way Grip Arm
1170,1,Fujifilm Instax Mini 25 Camera (White) uses Film,Fujifilm Instax MINI 25 Instant Film Camera (White)-US
1171,0,D-Link Cloud Camera DCS-5222L,D-Link Cloud Camera DCS-5020L
1172,0,Mydlink Home HD Monitor 360 Cam - Black Friday 2017,D-Link Cámara Vigilance Full HD Outdoor PoE Mini Bullet DCS-4703E
1173,0,Sony 128Gb UHS-I Class10 40MB/s SF128U,Transcend Premium Secure Digital SDXC Card Class 10 128GB
1174,0,D-Link Wireless Camera DCS-5020L,D-Link HD Outdoor PoE Camera DCS-2310L
1175,0,Ksix Selfie Leds Flash,NetPower 6
1176,1,GoPro Accessories Kit,GoPro Accessories Kit
1177,0,Sony Camera & Photo Accessories,Manfrotto X-PRO 3-Way Head Tripod
1178,0,Canon Powershot SX60 16.1MP Digital Camera 65x Optical Zoom Lens 3-inch LCD Tilt Screen (Black) Point & Shoot,Canon EOS Rebel T5i Telephoto Kit with 18-megapixel digital SLR camera and 18-135mm STM zoom lens
1179,1,Elmo Microscope Camera Adapter,GoPro Floaty Backdoor
1180,0,Sony Hand Strap STP GB1AM,Sony RMT-DSLR2 Wireless Remote
1181,0,Sony FE 24-70mm f/2.8 GM Standard zoom lens for E-mount mirrorless cameras,Canon EF 40mm f/2.8 STM Pancake Lens Hood
1182,0,Vanguard Alta Pro 263AT,GoPro Helmet Mount
1183,0,GoPro Handler AFHGM-001,GoPro Jaws Flexible Clamp Action Camera Mount
1184,0,GoPro Hero3+ Kit with WiFi Remote and Accessories,GoPro Dual Battery Charger
1185,0,Nikon DSLR D5300 24.1 MP Camera Kit with 18-55mm & 55-300mm VR Lenses + Accessory Bundle,Nikon Digital SLR D5100 Camera With 18-55mm VR Lens
1186,0,Manfrotto Adapter,Sony VCT R100 Camera Tripod
1187,0,Canon EOS 5D Mark IV Body,Canon EOS Rebel T7i EF-S 18-55 IS STM Kit
1188,0,GoPro HDMI Cable,GoPro Flat + Curved Adhesive Mounts
1189,0,Canon Camera Cover (Body Cap) for EOS Bodies and Extension Tube Fronts Caps Covers,Canon EOS 80D - body only
1190,0,Panasonic Lumix G X Vario Lens 12-35mm F2.8 ASPH Professional Micro Four Thirds POWER Optical I.S.,Panasonic Lumix GX Vario 12-35mm f/2.8 II Asph Power OIS
1191,0,Sony HDRCX405B Full HD,Handycam Full Hd
1192,0,Manfrotto 4 Section Aluminum Tripod Legs with Q90 Column (Black) Camera & Photo Accessories,Vanguard Alta Pro 263AT tripod
1193,0,GoPro Dual HERO System for HERO3+,GoPro Hero3 Silver
1194,1,Sony Alpha A7 Body Only Digital SLR Camera,Sony Alpha a7 Mirrorless Digital Camera
1195,0,D-Link Wi-Fi Pan & Tilt Day/Night Camera DCS-5009L,D-Link Wireless AC Day/Night HD Mini Bullet Cloud Camera
1196,0,Grandstream GXV3611IR_HD Network Surveillance Camera,Arlo Smart Home Black UV Resistant Silicone Skins Pack for Wireless CCTV HD Security Camera
1197,0,GoPro Camera Tethers GoPro DSLR,GoPro Wi-Fi Remote Accessory Kit GoPro
1198,1,Canon DSLR EOS 6D Camera with EF 24-105mm f/4L IS USM Lens,Canon DSLR EOS 6D(N) Digital Camera with Canon 24-105mm f/4.0L IS USM AF Lens
1199,0,Sony 128Gb UHS-I Class10 40MB/s SF128U,Kingston Digital 16GB MicroSDHC UHS-I U3 Action Card
1200,0,Manfrotto 055 Series 67 3-Section Carbon Fiber Tripod,Manfrotto MK190XPRO4-BHQ2 4-Section Aluminum Tripod
1201,0,Go Pro Tripod Adaptor,GoPro Headstrap Mount + Quick Clip (GoPro Official Mount)
1202,0,GoPro Hero 3+ Black,GoPro Helmet Front Mount
1203,0,Sony Handycam HDR-CX210 High Definition Camcorder (Silver),Sony Handycam HDR-CX110 HD Camcorder (Red)
1204,1,Manfrotto Pro Video Head 75mm (MVH502A),Manfrotto Pro Video Head 75mm (MVH502A)
1205,0,Transcend 64GB UHS-1 Class 10 SDXC Memory Card,"Transcend 64GB microSDXC UHS-I 300x, Class 10"
1206,0,GoPro And Sport Cameras Ksix Selfie Extension,Red Filter Action outdoor
1207,0,Sony Rechargeable Battery,Panasonic DMW-BCG10 Rechargeable Lithium-Ion Battery
1208,0,Canon XF105 Professional Camcorder,Sony HDR-CX190 HD Camcorder
1209,0,Nikon Telephoto AF Micro-Nikkor 105mm f/2.8G ED-IF Autofocus Lens,Nikon AF-S DX 10-24mm f/3.5-4.5G ED
1210,0,Gateway M465 6-Cell Li-Ion Battery,DMW-BCG10 Rechargeable Lithium-Ion Battery for Select Panasonic Cameras
1211,0,Arlo Wire-Free Security System with 3 HD Cameras Arlo Camera VMS3330-100NAS,Netgear VMS3230-100EUS IP security camera Interior y exterior Bala Color blanco cámara de vigilancia@es Netgear VIGILANCE FULL HD OUTDOOR VANDAL-PROOF POE DOME - Black Friday 2017 @es
1212,1,GoPro Fixation Latérale GoPro latérale,Side Mount Go Pro Side Mount - Accessories Video Cameras Electronic & Orienteering Devices at Barrabes.com
1213,1,Sony Digital SLR Camera a6000 Body (Black) with Lexar Professional 633x 64GB SDXC Card,Sony Alpha a6000 Mirrorless Digital Camera - Body only
1214,1,Metabones Canon EF to Micro Four Thirds T Speed Booster ULTRA 0.71x (Black Matt),Metabones Canon EF to Micro Four Thirds Speed Booster ULTRA 0.71x
1215,0,"Pyle PLCMTR71 Weatherproof Rearview Backup Camera System Kit with 7 LCD Color Monitor, IR Night Vision Camera, Dual DC Voltage 12-24 for Bus, Truck, Trailer, Van Car Safety & Security",PowerLine HD Day Night Cloud Camera Kit PowerLine Day/Night Kit
1216,0,Nikon DSLR Nikkor AF 50mm f1.8D Camera,Nikon 18-105mm f/3.5-5.6G ED VR AF-S DX Nikkor Autofocus Lens
1217,0,SanDisk Extreme Pro - flash memory card 32 GB SDHC UHS-II,Transcend 128GB SDXC Ultimate UHS-1 Memory Card
1218,1,Aluratek 8 LCD Digital Photo Frame,Greddy Oil Cooler Kit
1219,0,Canon DSLR EOS 6D Body Only,Canon DSLR EOS 6D WG Digital Camera Body Only
1220,0,Toro Cordless Batteries,Oregon Leaf Blower Accessories
1221,0,Veho Muvi Micro Pro Camcorder,VEHO MUVI HD NPNG Special Edition Bundle
1222,0,Canon EF 50mm f/1.8 II Camera Lens - Fixed,Canon Telephoto EF 85mm f/1.8 USM Autofocus Lens
1223,0,Canon PowerShot A2300 (Black) A2300,Canon PowerShot G7 X Mark II
1224,0,Fujifilm X100 Silver,Canon EF 17-40mm f/4L USM
1225,0,Canon EF 75–300mm f/4–5.6 III Telephoto Zoom Lens,Canon EF-S 10-22mm f/3.5-4.5 USM Lens
1226,1,Canon DSLR EOS 60D Camera Body Only-US Interchangeable Lens Cameras,Canon DSLR EOS 60D Camera Body
1227,1,128GB CF Compact Flash Card 160MB/s 1000X,Transcend Ultimate - flash memory card 128 GB CompactFlash
1228,0,Canon CanoScan 9000F Mark II Document Scanner,Canon Deluxe Gadget Bag 100EG Camera and Lens Holder
1229,1,64GB CF CARD,Transcend Ultimate - 64 GB CompactFlash
1230,0,Canon EOS Rebel T5i with EF-S 18-135mm IS STM Lens and 32GB Deluxe Accessory Bundle-US DSLR Camera Bundles,Canon EOS SL1
1231,0,Pelican 0945 Memory Card Case,16GB CF CARD (400X)
1232,0,Sony Spare Lens Protector for RX0 Consumer Video Cameras,Sony Semi-Hard LCD Screen Protector for A7 or A7R Digital Camera
1233,0,Sony Portable CD Player,Sony Rechargeable Battery
1234,1,Arlo Smart Home Black UV-Resistant Silicone Skins Pack for Wireless CCTV HD Security Camera,Netgear Replaceable Black Silicone Skins for Wireless CCTV HD Security Camera
1235,0,D-Link Home Panoramic HD Camera DCS-8200LH 1280 x 720 Pixels,D-Link Professional IP Camera Full HD Cloud Wireless
1236,0,Netgear Replaceable Black Silicone Skins,Arlo Security System - 2 Wire-Free HD Cameras
1237,0,Sony Alpha a7 Mirrorless Digital Camera with FE 28-70mm f/3.5-5.6 OSS Lens,Canon EF-S 18-55mm f/3.5-5.6 IS STM Lens
1238,0,Nilox F60 Reloaded Full HD Wifi,Nilox Battery F 60 Evo
1239,0,Lezyne 3-Way With 4/5 6mm CRV Hex Bits,Kupo Hex Stud Female 3/8-16 to 1/4-20
1240,0,Canon DSLR EOS Rebel T7i EF-S 18-55 IS STM Kit,Canon EF-S 18-55mm f/3.5-5.6 IS STM Lens
1241,0,Canon EF-S Focusing Screen (Precision Matte) Miscellaneous Accessories,Fujifilm Passport / ID Photo Digital Camera LCD Head and Shoulders Indicator Miscellaneous Accessories
1242,0,Hynix 3rd SM8G24F14-70-HP4N SIMM,Canon EF 70-200mm f/4L USM Telephoto Zoom Lens
1243,0,Fujifilm Instax Mini 8,Veho VCC-005-MUVI-HD10 Mini HD Body Camera
1244,1,Transcend SDXC 64GB Class 10,Transcend TS64GSDXC10 CVK 64GB 9p SDXC Class 10 Secure Digital Extended Capacity Card
1245,1,Nikon DSLR SB-700 Flash,Nikon DSLR SB-700 Speedlight
1246,0,Sony Cyber-shot DSC-RX100 III 20.1-megapixel compact digital camera with Wi-Fi,Sony Cyber-shot WX80 Black
1247,0,Canon PowerShot G7 X Mark II,Canon EOS 5D Mark II (body only)
1248,0,Sigma Circular Fisheye HSM (Nikon),Sigma 10-20mm f/4-5.6 EX DC AF Lens for Sony Alpha Digital SLR Cameras
1249,0,WinTech WTC-D102H Camera,16G MicroSD Card
1250,0,Dolica Tripod and Pan Head,Vanguard Alta Pro 263AT tripod
1251,1,Nikon Fisheye Lens,Nikon Nikkor 16mm f/2.8D AF Fisheye Lens
1252,0,SanDisk Extreme Pro 32 GB SDHC UHS-II Flash Memory Card,Fujifilm 4 GB SDHC Class 10 Flash Memory Card
1253,0,SanDisk DSLR/HD Camcorder CF Compact Flash Memory Card 64GB,SanDisk DSLR/HD Camcorder CF Compact Flash Memory Card 64GB
1254,0,"Pyle PLCMTR71 Weatherproof Rearview Backup Camera System Kit with 7 LCD Color Monitor, IR Night Vision Camera, Dual DC Voltage 12-24 for Bus, Truck, Trailer, Van-US Video Monitors",Panasonic Lumix GF1 (with 14-45mm lens) DMC-GF1
1255,0,Canon Lens Hood EW-75 II for 20mm,CANON Poignée Grip BG-E21 (Eos 6D Mark II)
1256,0,SanDisk Extreme microSDHC 64Gb Type 10,Action Outdoor Floating Hand Grip Bobber
1257,1,Manfrotto MVH500AH 755CX3 Lightweight Fluid Video System with Carbon Fiber Legs and Bag (Black),Manfrotto Aluminum Tripod with Carbon Fiber Leg MVH500AH-755CX3
1258,0,Transcend 16GB Compact Flash Card,Transcend 128GB Compact Flash
1259,0,Sigma 10-20mm f4-5.6 DC HSM for Canon,Sigma 18-250mm f/3.5-6.3 DC OS HSM Autofocus Zoom Lens For Pentax Cameras
1260,0,Stealth Cam DSLR CORE 3.0 MP Infrared Scouting Camera Combo,Samsung NX300 Mirrorless Digital Camera with 20-50mm F/3.5-5.6 ED II Lens (White) + Accessory Bundle
1261,0,16GB Full-HD Camcorder Panasonic HDC-TM15K,Lumix 5 Megapixel Digital Camera Panasonic DMC-FZ20S
1262,1,Sony NXCAM HDTV Camcorder PXW-X200,Sony NXCAM CMOS Exmor R Camcorder HXR-NX100
1263,1,Ericom Powerterm Lite 1-4U Maintenance Ericom Maintenance - 1041 Emulation Software,Polycom Lamp 1530-29756-001 Desktop Video Conferencing
1264,1,GoPro HERO3+ Black Edition,Hero 3+ Black Edition
1265,1,Transcend 128GB SDXC Class 10 Flash Memory Card Up to 30MB/s (TS128GSDXC10) Camera & Photo Accessories,Transcend 128GB SDXC Class 10
1266,0,Vector Image Engagement Images,BATERIA LP-E10 (EOS1100D)
1267,0,GoPro And Sport Cameras Ksix Selfie Extension For GoPro And Sport Cameras,Motardinn NetPower 6
1268,0,Manfrotto Tripod System,Manfrotto Video Camera Plate
1269,1,GoPro Auto Charger,GoPro Auto Charger with Dual USB Ports
1270,1,"Arlo Smart Home Security Camera System - 3 HD, 100% Wire-Free, Indoor/Outdoor Cameras with Night Vision",Arlo Wire-Free Security System with 3 HD Cameras
1271,0,Nikon 16mm f/2.8 AFD,Nikon Telephoto AF Micro-Nikkor 105mm f/2.8G ED-IF AF-S VR Autofocus Lens
1272,0,SanDisk 128GB SDHC UHS-I Ultra Secure Digital,Transcend Premium Micro SDXC Class 10 UHSI with Adapter
1273,1,"Chromo CI-216 Dimmable Ultra High Power Panel/Camcorder Video Digital SLR Camera Light for Canon, Nikon, Pentax, Panasonic, Sony, Samsung and Olympus Cameras","Chromo CI-216 Dimmable Ultra High Power Panel/Camcorder Video Digital SLR Camera Light for Canon, Nikon, Pentax, Panasonic, SONY, Samsung and Olympus Cameras"
1274,1,Kingston 128GB SDXC Flash Memory Card,Kingston Digital 128GB SDXC UHS-I Speed Class 3 Flash Memory Card
1275,1,Uniden UDR444 Guardian 4.3-Inch Video Surveillance System with 2 Cameras,Uniden UDR444A 4.3 LCD Wireless Video Surveillance System
1276,0,Transcend Compact Flash Card 1000x,16GB CF CARD (400X)
1277,0,GoPro Fixation lateral Gopro Lateral - Que-Du-Sport,GoPro Fixation strap Gopro Strap - Promo-Optique
1278,0,GoPro Arnés,Soporte Frontal Para Casco Go Pro
1279,1,GoPro HDMI Cable,GoPro HERO3 HDMI-Micro HDMI Cable
1280,0,GoPro Suction Mount,GoPro Chest Harness
1281,1,SanDisk 32GB microSDHC Card,SanDisk 32GB microSDHC Card
1282,1,Canon DSLR EOS 80D Camera with EF-S 18-135mm IS USM Lens Kit,Canon DSLR EOS 80D - EF-S 18-135mm IS USM lens
1283,1,Nikon DSLR Nikkor AF-S 28-300mm f3.5-5.6G ED VR Camera,Nikon DSLR Nikon EF 28-300mm f/3.5-5.6G ED VR Camera
1284,0,Manfrotto Quick Release Plate,Manfrotto 190 MK190XPRO3-BHQ2 Kit
1285,0,Panasonic Lumix 12-35mm f2.8 G X VARIO II Lens,Panasonic Capture Life On The Move DMCGX85KK
1286,0,"12.2-Megapixel Digital Camera with 28mm Wide-Angle Lens, Black Panasonic DMC-FX100K",12.1 Megapixel Digital Camera Panasonic DMC-FS15K
1287,0,Transcend 64GB Ultimate SD SDXC Class 10 Memory Card,Transcend 4 GB SDHC Class 10 Memory Card
1288,0,Kupo Kupole Extension 6.6' - Black,GoPro HERO3: Black Edition Camera
1289,0,Canon EOS Rebel T5i,Canon EOS Rebel SL1 Alkosto Online Store
1290,0,Nikon DSLR D610 Body Only Accessory Bundle,Nikon Digital SLR D5100 18-55mm VR Lens
1291,0,Infrared HD Video Surveillance System,Full HD WDR Varifocal Day & Night Outdoor Smoked Dome Network Camera
1292,0,Canon BP-2L14 Series Battery Pack for MV800/900 MD100/MD200/DC300,Panasonic VW-VBT190 Battery Pack
1293,1,Canon Printhead,Genuine Canon imagePROGRAF iPF710 Printhead
1294,0,SanDisk Extreme microSDHC 64Gb Type 10,Kingston Ultimate SDXC 64GB Clase 10 UHS-1
1295,0,Canon Timer TC-80 N 3 3,Canon EOS 80D DSLR Camera with 18-135mm IS USM Lens
1296,1,Sony Cyber-shot DSC-RX100 III 20.1-megapixel compact digital camera with Wi-Fi,Sony Cyber-shot DSC-RX100 III Digital Camera
1297,0,GoPro HERO+ LCD HD Video Recording Camera,Veho VCC-005-MUVI-HD10 Mini HD Body Camera
1298,0,Canon GL2 Package 2,Canon PowerShot G1 X
1299,0,Logitech ConferenceCam 960-000866,Logitech Camera 960-000841
1300,0,GoPro Hero4 Silver Edition GoPro Edition,GoPro HERO3+: Silver Edition Sports & Action Video Cameras | Gear Outlet
1301,0,WIFI EN95610 Wireless Security Camera System,D Link DCS 2330 L HD Camera
1302,0,Fujifilm Instax Mini 8 Instant Film Camera,Kupo Hex Stud with 3/8 Inch to 16 Feet and 1/4 -20 Feet Lighting Accessories
1303,0,"Infrared HD Video Surveillance System, 8 1080p Indoor Outdoor Cameras AHD / HD-TVI System","WIFI-EN95610 Wireless Security Camera System, 360 Outdoor Antenna Wireless System for Network IP Cameras"
1304,1,Sony AS30V High Definition POV Action Video Camera HDR-AS30V Body Mounted Cameras,Sony HDR-AS30V 1080/60p action video camera with Wi-Fi and GPS
1305,0,GoPro Side Mount,GoPro Rechargeable Battery for HERO3 and HERO3+
1306,1,SanDisk Extreme 32GB Compact Flash Card,SanDisk Extreme 120MB/s 60MB/s Memory & Storage
