id,label,left_title,right_title
541,0,Accu-Tech MVH500A Fluid Drag Video Head with MVT502AM Tripod and Carry Bag,Manfrotto MVH500AH 755CX3 Lightweight Fluid Video System with Carbon Fiber Legs and Bag (Black)-US
542,0,Panasonic Lumix DMC-FZ200 Digital Camera,Panasonic DMC-FZ200 12.1-megapixel digital camera with 24X optical zoom
543,0,IP Camera Wireless AC HD Color Night Vision,D-Link Cloud Camera 7100 (DCS-7010L)
544,1,Ubiquiti Networks UVC-G3-DOME IP Interior y exterior Bullet Camera DCS-8200LH 1280 x 720 pixels Black,UniFi Video Camera G3 Dome 1080p Indoor/Outdoor IP with Infrared
545,0,Logitech C310 HD Web Camera,Logitech C310 HD 720P
546,0,Kingston Digital 16 GB Class 4 microSDHC Flash Card with SD Adapter Blank Video Media,Transcend 32 GB Class 10 SDHC Flash Memory Card Camera Photo Accessories
547,1,VEHO MUVI HD NPNG Special Edition Bundle,Veho VCC-005-MUVI-NPNG MUVI HD Mini Handsfree ActionCam with Waterproof Case and 8 GB Memory - No Proof Glory Edition
548,1,"Elevator Security Camera, Infrared CCTV, Corner Mount, Wide Angle Lens","SE-D300M1 Wireless Surveillance Camera System, Outdoor, 4 Camera Wireless System"
549,1,GoPro HERO4 Black Moto Camera Kit,GoPro HERO4 Black Moto Camera Kit - GoPro Hero Session
550,0,Avenger A2030 Steel C-Stand with Grip Kit,ViewSonic VFD820 8-Inch Digital Photo Frame
551,1,Sony Handycam HDR-CX110 HD Camcorder (Black),Sony Handycam HDR-CX110 HD Camcorder (Blue)
552,0,Canon Camera & Camcorder Chargers CDWG.com,GoPro Doble Battery Charger for Hero 3/ 3+
553,0,GoPro Hero Extended Battery Pack 4000mAh Epic L40GH,GoPro Dual battery charger USB
554,0,Sony HXR-NX100,Go Pro Side Mount
555,0,GoPro HERO6 Black Edition Camera,GoPro HERO3 Black Edition Camera
556,0,Manfrotto Pro Single Carbon Fibre Kit 100 - 509HD,Manfrotto Pro Video Head 75mm (MVH502A)
557,0,Fujifilm Instax Mini 8 Instant Film Camera,Covert PIR Camera System
558,1,Kupo 40 Extension Grip Arm KG203511,"Kupo 40-Inch Extension Grip Arm with Big Handle - Black, KG203511-US"
559,0,SanDisk Extreme Pro 32 GB SDHC UHS-II,SanDisk UHS-II Prices
560,0,Canon Camera Remote Control Series,Canon Deluxe Backpack 200EG
561,0,GoPro Dual Battery Charger for GoPro HERO3+ and HERO3,GoPro Dual Battery Charger + (for HERO4 Black/HERO4 Silver)
562,1,D-Link DCS-4602EV HD Kamera,D-Link DCS-942L Cómara de seguridad WiFi N Visión Nocturna
563,0,Sigma 15mm F2.8 EX DG Diagonal Fisheye,Sigma 70-300mm f/4-5.6 APO Macro Autofocus Lens
564,1,D-Link Pan & Tilt Camera DCS-5009L,D-Link Wi-Fi Cloud Rotating Day/Night Camera
565,0,GoPro HD Camera AWRCC-001 GoPro AWRCC-001 Wi-Fi Remote Charging Cable,Manfrotto HDSLR Clamp-On Remote Control
566,0,Canon BG-E21 Battery Grip (6D Mark II)  Canon,Canon EOS 5D Mark IV Camera with 24-105mm f/4L IS II USM Lens
567,0,Canon DSLR EOS Rebel T5 Camera Body with EF-S 18-55mm IS Lens and EF 75-300mm f/4-5.6 III Lens Tripod Bag,Canon EF 75-300mm f/4-5.6 III Telephoto Lens
568,1,HJC RPHA 11 Darter,HJC RPHA 11 Darter
569,0,Transcend 128GB SDXC Ultimate UHS-1 Memory Card Class 10,Transcend 128GB SDXC Class 10 Flash Memory Card
570,0,SanDisk 32GB Extreme Plus microSDHC Card,Transcend 8GB Class 10 SDHC Card
571,0,Panasonic DMW-BCG10 Rechargeable Lithium-Ion Battery,GoPro BacPac for Hero 4/3/ 3+
572,0,GoPro Protective Lens + Covers voor GoPro Hero3+,GoPro Hero3+ Rechargeable Battery
573,0,Sony Alpha a7RII Mirrorless Digital Camera (Body Only),Sony Alpha A6000 Mirrorless Camera (Body Only)
574,0,SanDisk Extreme 64GB CompactFlash Memory Card,SanDisk Extreme PRO 16GB Compact Flash Memory Card
575,0,Canon DSLR EOS Rebel T6 Camera Kit with 18-55mm IS II Lens,Canon DSLR EOS Rebel T5i
576,0,Sony Tripod VCT-R100,Manfrotto MT190XPRO4 4 Section Aluminum Tripod Legs with Q90 Column (Black) Camera & Photo Accessories
577,0,GoPro Rechargeable Battery (for HERO4 Black/HERO4 Silver) GoPro Official Accessory,Two Halcyon 4200 mAH Lithium Ion Replacement Battery for Panasonic HC-V700M Full HD Camcorder and VW-VBK360 Camera & Photo Accessories
578,1,Canon VIXIA HF M500 Flash Memory Camcorder,Canon HFM-500
579,0,Canon DSLR 70D Body,Canon Digital 7D Body Only
580,0,Canon Zoom Grip for CN-E18-80mm Lens,Sigma 10-20mm f/3.5 EX-DC HSM Autofocus Zoom Lens For Canon Cameras
581,0,Canon EF 24-70mm f/2.8L USM Autofocus Lens,Canon EF 20mm f/2.8 USM Wide Angle Lens
582,0,WiFi-1 GB,GA-H170N WIFI LGA1150 Motherboard
583,1,GoPro Composite Cable,GoPro HERO3 Composite Cable
584,0,Fujifilm Mini Lab Supplies,Fujifilm Instax Mini 8 Instant Camera
585,1,1080p AHD Security Camera System,8 1080p PIR Cameras Infrared DVR Apps System
586,1,Samsung Mirrorless Digital Camera with 20-50mm F/3.5-5.6 ED II Lens (Black),Samsung Black Digital Camera
587,0,D-Link Wireless N Day & Night Pan/Tilt Cloud Camera DCS-5020L,D-Link Obrotowa kamera Dzień/Noc
588,0,SanDisk 64GB Ultra microSDXC Card,SanDisk Ultra SDXC UHS-I Class 10 128GB
589,1,Netgear Arlo HD Camera Set,Netgear VMS3230-100EUS IP Security Camera
590,1,Nilox Head Strap Mount F 60 Evo Evo,Nilox Head Strap Mount F 60 Evo Evo
591,0,Sony Alpha 6000 with 16-50mm Lens (Black) Digital Camera,Sony RMTDSLR2 Wireless Remote for Alpha & NEX (Black)
592,1,Earthwise Cordless Batteries,Earthwise Tow Behind Cordless Batteries
593,0,GoPro Camera Fixation Kit,Quick Release Camera Fixation Kit
594,1,Blade Mach 25 FPV Racer BNF Basic,Prophet Sport Plus 50W AC/DC Charger
595,1,Cameron Sino Battery for AEG 4932 BS12C2-US,Cameron Sino Charger for AEG L1215P L1215P-US
596,0,Cameron Sino Battery for AEG BWS12CBWS-US,CANON CB-2LX Battery Charger
597,0,Sony 30mm f/3.5 Macro Lens Silver,Canon EF-S 10-22mm Camera & Camcorder Lenses
598,1,Manfrotto Hydrostatic Ball Head With Rc4 Rapid Connect Plate,Manfrotto Hydrostatic Ball Head with RC4 Rapid Connect System
599,1,Garmin Rechargeable NiMH Battery for Alpha 50,Garmin Rechargeable NiMH Battery for GPSMAP 64s/Oregon 600 Series
600,0,Transcend Secure Digital SDXC Card Class 10 128GB,Transcend Secure Digital Card SDHC Class 10 8GB
601,0,Ksix Selfie Leds Flash,Ksix Selfie Extension
602,1,Aluratek Digital Photo Frame 8-inch Hi-Res With 512MB Built in Memory (Black) - Battery,Aluratek Digital Photo Frame 8-inch Hi-Res With 512MB Built in Memory (Black) - Charger
603,1,Paul Hewitt Miss Ocean Line Watch PH-M-R-P-33S Ladies Watches,M-Lok Tripod Adapter
604,0,D-Link Outdoor Full HD Vandal Resistant Mini Fixed Smoked Dome Network Camera DCS 6210BS,D Link Variable Focus WDR Day And Night High Definition Outdoor Dome Camera DCS 6314BS
605,0,Kodak Power Flash Single Use Camera,Fujifilm Instax Mini 8 Deal
606,0,GoPro Camera,Dual Battery Charger
607,1,16GB MicroSDHC UHS-I U3 Card,Kingston Digital 16GB MicroSDHC UHS-I U3 Action Card
608,0,Sony Alpha a6000 Mirrorless Camera with 16-50mm and 55-210mm Lenses Black,Alpha Kit
609,0,Canon EF Macro Lens - 100mm,Canon EF 70-300mm f/4-5.6L IS USM Autofocus Telephoto Zoom Lens
610,0,Hjc RPHA 11 Darter,Nilox Remote Control F60 Evo
611,1,Panasonic Lumix 12-35mm f2.8 G X VARIO II Lens,Panasonic Lumix GX Vario 12-35mm f/2.8 II Asph. Power OIS
612,0,Canon EF 50mm f/1.4 USM Lens,Canon EF 50mm f/1.8 II Lens
613,0,Manfrotto Camera Plate,Manfrotto MT190XPRO4 4 Section Aluminum Tripod Legs with Q90 Column (Black) Camera & Photo Accessories
614,0,Mydlink Home Monitor 360,D-Link Cloud HD Vision Camera Kit
615,0,SanDisk Ultra microSDHC 32GB Class 10,Transcend SDXC 128GB Class 10 Flash Memory Card
616,0,Manfrotto Video A Base Plate MVH500AH,Manfrotto 501PLONG Long Quick Release Plate
617,0,Gigastone 128GB SDXC UHS-I Class 10 Professional Series,SanDisk 64GB Extreme Pro SDXC Card UHS-I Class 10
618,0,Action outdoor Floating Hand Grip,Gopro Mic Stand
619,0,GoPro Chest Mount Harness GCHM30001 with Correa Para La Cabeza Strap and Bases Planas Y Curvas Tripod,"GoPro Hero3+ Kit de Accesorios con WiFi Remote, Lens Replacement, Surf Mounts, Antifog Inserts, Tapas Protectoras y Side Mount"
620,1,Sony Cyber-shot RX100 20.2-Megapixel Digital Camera Black,Sony DSC-RX100/B 20.2 MP Exmor CMOS Sensor Digital Camera with 3.6x Zoom
621,1,Manfrotto Tripod Head MHXPRO-3W,Manfrotto 3-Way Tripod Head MHXPRO-3W
622,0,Logitech Webcam C920-C HD 1080P 30FPS,Logitech HD Webcam C310-US Superwarehouse
623,0,Kupo 40 Black Hex Grip Arm with Big Handle,Canon EVF-DC1 Electronic Viewfinder
624,1,Panasonic Compact System Camera GX1Body 16 Megapixel No Lens,Panasonic Compact System Camera GX1Body 16 Megapixel No Lens
625,1,WinTech IP9506,WinTech IP9506
626,0,Canon EF 100mm f/2.8 Macro USM Lens,Canon EF-S 10-22mm USM Ultrasonic Motor Ultra-wide-angle zoom lens for APS-C sensor Single Lens Reflex cameras
627,0,Transcend 32GB Secure Digital High-Capacity SD Class 10 Memory Card,Transcend 128GB SDXC Class 10 Flash Memory Card
628,0,Manfrotto X-Pro 3-Way Camera Head,Manfrotto 055 3-Sections Aluminium Tripod
629,0,Sony A7RII Body,Canon EF 70-200mm f/4L USM Telephoto Zoom Lens
630,0,Oregon 548208 Chain Saw Accessories,Canon LP-E10 Rechargeable Battery
631,0,Paul Hewitt Miss Ocean Line Watch PH-M-R-P-33S Ladies Watches,Manfrotto 055 Series 67 3-Section Aluminum Tripod
632,1,"Arlo Security System - 2 Wire-Free HD Cameras, Indoor/Outdoor, Night Vision (VMS3230)-US Remote Home Monitoring Systems",Netgear Arlo Smart Home Security Kit
633,0,Canon DSLR EOS 70D Body D Good Used DSLRs,Canon DSLR EOS 5D Mark II Body Only
634,1,GoPro Side Mount - support system adhesive mount GoPro mount AHEDM-001 Digital Camera Accessories CDWG.com,GoPro Side Mount
635,0,SanDisk Extreme SDXC 128GB 90MB/s UHS-I U3/Class 10,Transcend 128GB SDXC Ultimate UHS-1 Memory Card Class 10
636,0,Panasonic Lumix DMC-FX55 (Silver),14.1 Megapixel Lumix Digital Camera DMC-FX700
637,0,Accu-Tech MVH500A Fluid Drag Video Head with MVT502AM Tripod and Carry Bag,Manfrotto 504HD/546BK Tripod System
638,0,Canon EF-S 10-22mm f/3.5-4.5 USM Lens,Canon EF 85mm f/1.8 USM Lens
639,0,Manfrotto Electronic Follow Focus with MVR911EJCN Handle,Canon BG-E21 Grip for Eos 6D Mark II
640,0,Manfrotto MK190XPRO4-BHQ2 KIT with ball head,Manfrotto MVH500AH 755CX3 Tripod Kit
641,0,Manfrotto Quick Release Plate,Manfrotto MB PL-3N1-26 Pro Light Bag
642,0,Canon Cámara SX510 Negra,Canon EOS Rebel T5i 18 Megapixel Digital SLR Camera with Lens - 55 mm
643,1,128GB SDXC UHS-I U3 Card,Transcend 128GB SDXC UHS-3 Memory Card
644,1,SanDisk 16GB Ultra CF,SanDisk Ultra CompactFlash 16GB up to 50 MB/s Read Write is lower Memory & Storage
645,0,Canon DSLR EOS 6D EF 24-105mm f4 L IS Kit,Canon Digital SLR EF 85mm F1.8 USM
646,0,SONY HDR-CX405B Full HD 30X,Sony HDR-CX110 HD Handycam Camcorder
647,0,Earthwise Cordless String Trimmer Batteries,Oregon Chain Saw Accessories
648,1,SanDisk 256 GB CF Extreme Pro 160MB/s,SanDisk Compact Flash Card 256GB
649,0,Canon DSLR EOS 80D Camera with 18-135mm IS USM Lens Kit,Canon EF-S Mount 18 mm 55 mm Canon 8114B002 Camera & Camcorder Lenses CDW.com
650,0,Canon EF-S 10-22mm f/3.5-4.5 USM Lens Camera,Canon EF 17-40mm f/4 L USM Lens Camera
651,1,16GB CF Compact Flash Card 50MB/s 133X,Transcend TS16GCF133 CIB 16GB 50p CF 50MB/s 133x Transcend Compact Flash Card with Clam Retail
652,0,Transcend SDHC Flash Memory Card 4GB Class 2,Kingston High Speed Class 3 SD Memory Card 128GB
653,0,Leica TPS 1000 GEB77 Battery,GoPro AHDBT-302 Rechargeable Battery for GoPro HERO3+ and HERO3
654,0,Panasonic Battery Pack VW-VBT190,Canon Bateria NB-5L IXUS 800 850
655,0,Panasonic LUMIX GH4 Professional 4K Mirrorless Interchangeable Lens Camera Body Only,Sony Alpha a6000 Mirrorless Digital Camera - Body only
656,0,Sigma EF-S Mount 24-70mm f/2.8 IF EX DG HSM Ultrasonic Motor Autofocus Lens for Canon EOS,Canon EF 20mm f/2.8 Ultrasonic Motor Wide Angle Lens
657,1,"Panasonic Lumix G X Vario Lens, 12-35mm, F2.8 ASPH., Professional Micro Four Thirds, POWER Optical I.S.",Panasonic Lumix G X Vario 12-35mm f/2.8 ASPH Power OIS (Micro Fourth Thirds Mount)
658,0,SanDisk CompactFlash Card (CF) Extreme PRO 64GB 160MB/s,SanDisk Extreme PRO 64GB up to 95MB/s UHS-I/U3 SDXC Flash Memory Card
659,0,Kingston Digital 16 GB Class 4 microSDHC Flash Card with SD Adapter,Transcend 16GB Class 10 SDHC Memory Card
660,0,Sony AS30V High Definition POV Action Video Camera,Veho VCC-004 MUVI Atom No Proof Glory Body Camera/Action Camcorder
661,0,"Canon LC-E6 Battery Charger for Canon EOS 5D Mark II, 7D & 60D Digital SLR",Canon EOS 60D
662,0,Sony Cyber-shot DSC-RX100 II Digital Camera,Sony Cyber-shot WX80
663,0,Panasonic Lumix G X Vario 12-35mm f2.8 ASPH Power OIS Micro Fourth Thirds Mount Panasonic Digital SLR Camera,Canon Telephoto EF 85mm f1.8 USM Autofocus Lens
664,0,GoPro Camera with Mounts Accessories ABSSC-001,GoPro Hero 6 Black
665,1,Sony Handycam HDR-CX405,SONY HDRCX405B FULL HD CAMERA
666,0,Funda Camera Canon DCC-850,Metabones Canon EF Lens to Sony E Mount T Speed Booster ULTRA 0.71x Metabones 0.71x
667,0,Sigma 8-16mm f/4.5-5.6 DC HSM Ultrasonic Motor Lens,Sigma 18-250mm f/3.5-6.3 DC OS HSM Autofocus Zoom Lens For Pentax Cameras
668,0,Fujifilm Instax Mini 25 Camera (White) uses Film,David Yurman Sterling & 14K Gold Noblesse Ring Sz 6.5
669,0,Transcend 32GB Compact Flash Card Memory & Storage,SanDisk Extreme 64GB Compact Flash Card
670,1,Canon EF 24-70mm f/2.8L II USM Lens,Canon EF 24-70mm f/2.8 L II USM Lens Camera Lenses
671,0,Canon CanoScan 9000F Mark II Document Scanner,Canon Digital SLR Camera Carrying Case
672,1,Panasonic LUMIX DMC-FZ70 16.1 MP Digital Camera with 60x Optical Image Stabilized Zoom and 3-Inch LCD (Black),"LUMIX DMC-FZ70 16.1 MP 60X Zoom Digital Camera - Black, Panasonic"
673,0,GoPro Camera HERO+ LCD HD Video Recording,7 in 1 Accessories Kit for GoPro Hero 4/3+/3/2/SJCAM and Xiaomi Yi
674,0,Sony Alpha ILCE6000L/S 24.3MP Mirrorless Digital Camera 4x 3.0 inch wide type TFT LCD (Silver),Sony - Alpha a6000 Mirrorless Camera with 16-50mm and 55-210mm Lenses Black
675,1,D-Link Outdoor HD PoE Day/Night Fixed Mini Bullet Cloud Camera DCS-7010L,D-Link Outdoor HD PoE Day/Night Fixed Mini Bullet Cloud Camera DCS-7010L
676,0,Canon Speedlite 600EX RT,Canon Speedlite 270EX II
677,1,Canon EF 70-200mm f/4L USM Single Lens Reflex Camera Lens,Canon EF 70-200mm F4 L USM Digital SLR Camera
678,0,GoPro Wrist Housing - Marine Case for Camcorder GoPro Camcorder AHDWH-301 Digital Camera Accessories,GoPro Side Mount
679,1,Sony HDR-CX405/B 9.2MP Video Recording Camcorder with 29.8mm Wide-Angle Carl Zeiss Zoom Lens (Black),Sony HDR-CX405B Full HD 30X Free Shipping and Pouch
680,1,GoPro Wrist Housing,GoPro Hero3 Wrist Housing
681,0,Toro Cordless Batteries,GoPro Dual Battery Charger
682,1,Sony Mirrorless a5100 16-50mm Lens Black,"Sony Alpha a5100 Mirrorless Digital Camera with 16-50mm Lens, Black"
683,0,Canon EF Macro Lens 3554B002,Canon EF 70-300mm f/4-5.6 L IS USM Zoom Lens
684,0,Canon EOS Rebel T5i with EF-S 18-135mm IS STM Lens and 32GB Deluxe Accessory Bundle-US DSLR Camera,Canon EOS 80D DSLR Camera with 18-135mm Lens Video Creator Kit
685,0,Eveready Battery 2032BP-4 3V Li Coin,Canon BP-828 - camcorder battery Li-Ion
686,0,GoPro Rechargeable Battery for HERO3 and HERO3+,GoPro Doble Battery Charger for Hero 3/ 3+
687,0,Fujifilm Digital Camera Miscellaneous Accessories,Aluratek 7 inch Digital Photo Frame
688,1,Transcend 10 x 8GB SDHC Class Flash Memory Card,Transcend Secure Digital Card SDHC Class 10 8GB
689,0,Sony E-mount 55-210mm F4.5-6.3 OSS Lens (Silver),Canon EF-S 18-55mm f/3.5-5.6 IS STM Lens
690,1,Umbro Classico 4 IN IN,Umbro Classico 4 IN IN
691,0,Manfrotto HDSLR Clamp-on Remote Control,Canon EVF-DC1 Electronic Viewfinder
692,0,D-Link DCS 5222L Wireless N Pan Tilt Zoom Camera,D-Link DCS 5020L Wireless N Day & Night Pan Tilt Cloud Camera
693,0,Sony Digital Camera (Black),Sony 20.1-megapixel mirrorless camera with 18-55mm zoom lens
694,0,Canon EF 40mm f/2.8 STM Pancake Lens,Lens Hood ES-52 Canon Lens
695,0,Manfrotto Pro Video Head MVH502AH Fluid,Manfrotto Pro Video Head 75mm (MVH502A)
696,0,Canon DSLR EOS 6D Camera with EF 24-105mm L IS USM Lens Kit,Canon DSLR EF 24-70mm f/2.8L USM Autofocus Lens
697,0,Panasonic Lithium-Ion Battery Pack (Black),Garmin Virb/Aera660 Lithium-lon battery pack
698,0,Manfrotto Carbon Fiber Tripod MT055CXPRO3,Le-Chasseur 055 - 3 sections aluminium Tripod
699,0,Aluratek 7 inch Digital Photo Frame,Canon LC-E6 Battery Charger
700,1,Transcend 16GB Compact Flash Card,Transcend TS16GCF1000 DFD 16GB 50p CF 1000x 160MB/s CompactFlash Card
701,0,Canon PowerShot SX540 HS Digital Camera 20.3 MP CMOS 4.3 mm-215 mm Display: 7.6 cm/3 TFT Black,Sony DSC-W800 20.1-Megapixel Digital Camera Black
702,1,Canon SLR Gadget Bag for EOS Cameras,Canon Gadget Bag (holds 1 camera and to 2 lenses)
703,1,Transcend 64GB SDXC Class 10 Flash Memory Card Up to 30MB/s (TS64GSDXC10E) Camera & Photo Accessories,Transcend 64GB SDXC Class 10 Flash Memory Card Up to 30MB/s (TS64GSDXC10E) Computer Accessories & Peripherals
704,1,Sony UHS-I Class10 40MB/s SF128U,Sony UHS-I Class10 40MB/s SF128U
705,0,Transcend 32GB SDHC UHS-1 Class 10 Secure Digital High Capacity Card,Transcend 128GB SDXC Class 10 Flash Memory Card
706,1,Leica GEB111 Battery Leica GEB211 Battery Leica GEB221 Station Total TPS 1000 GEB77,Leica GEB111 Battery Leica Rechargeable Ni-MH Battery for 400 GEB70 and 2000 GEB187
707,0,Sigma 70-300mm F4.0-5.6 DG APO Macro (Nikon) - Prijzen,Canon EF 70-300mm f/4-5.6L IS USM Telephoto Lens
708,0,Panasonic Battery for Panasonic Camcorders,Oregon leaf blower accessories
709,0,Honeywell Lettore 4850dr,D-Link DCS-6010L 2-Megapixel Panoramic Wireless Cloud Camera
710,0,Rubbermaid 1 gal. MixerMate Pitcher,David Yurman Sterling & 14K Gold Noblesse Ring
711,0,SanDisk Extreme 64GB Compact Flash Card,SanDisk Ultra 16 GB CompactFlash (CF) Card
712,0,Action outdoor Floating Hand Grip Bobber,Action outdoor 3 Way Grip Arm
713,1,Canon CB-2LX Battery Charger,Canon CB-2LX Battery Charger
714,0,Canon BG-E11 Battery Grip 5D MKIII,Canon EOS 5D Mark IV DSLR Camera (Body Only)
715,0,Canon EOS Rebel T5i with EF-S 18-135mm IS STM Lens and 32GB Deluxe Accessory Bundle-US DSLR Camera,Canon EOS 60D 18 MP CMOS Digital SLR Camera Body Only-US Interchangeable Lens Cameras
716,1,360 Degree Flash Shoe Holder Mount Bracket for Video Lights & Microphones,4 Way Flash Shoe Bracket/Umbrella Holder Light Stand Mount with Four Hot Mounts
717,0,Canon Camera DCC-850,Canon Timer TC-80 N 3 3
718,0,GoPro Dual Battery Charger,GoPro Hero System
719,1,D-Link Home Panoramic HD Camera DCS-8200LH,D-Link Home Panoramic HD Camera DCS-8200LH
720,1,Eyeon Pet Monitor HD 360,D Link DCS 855L P IP Security Camera
721,0,Manfrotto Video Camera Plate - 504PLONG,Manfrotto 502HD Pro Video Head w/ Flat Base MVH502AH
722,1,Canon CanoScan 9000F MKII Color Image Scanner,Canon CanoScan 9000F MKII Color Image Scanner
723,0,Panasonic Lumix FZ60 16 Megapixel Digital Camera,Panasonic Lumix 4 Megapixel Digital Camera
724,0,Olympus Stylus Tough TG-Tracker Action Camera,WD 240GB WD Green SATA 6Gb s M.2 2280 Internal Solid State Drive
725,0,Metabones Canon EF Lens to Sony E Mount T Speed Booster ULTRA 0.71x,Sony 35mm f/1.8 Prime Lens for Most NEX E-Mount Cameras
726,0,Sigma SLR 50mm F1.4 DG HSM Art,Sigma Digital SLR 4.5mm f/2.8 EX DC Circular Fisheye HSM
727,0,Sony Handycam HDR-CX210 High Definition Camcorder (Black),Sony Handycam HDR-CX580V High Definition Camcorder (Black)
728,0,SanDisk Ultra microSDXC 200GB 90MB/s UHS-I/Class 10,Transcend 32 GB Class 10 SDHC Flash Memory Card TS32GSDHC10E Camera Photo Accessories
729,0,D-Link Full HD Surveillance Starter Kit DNR16-4802-2,D-Link Cómara de Seguridad HD WiFi Visión Nocturna
730,0,D-Link Outdoor IP PoE HD Cloud Camera DCS-2310L,D-Link Wireless AC Mini-Bullet HD Day/Night Camera DCS-7000L
731,0,WinTech WTC-T201C,WinTech IP9506
732,0,GoPro Hero3 Silver Edition,GoPro HERO3+: Silver Edition
733,0,Lezyne 3-Way With 4/5 6mm CRV Hex Bits,Sigma 70-300mm f/4-5.6 DG OS Telephoto Zoom for Pentax AF Digital SLR Cameras
734,0,Canon DSLR EOS 80D Camera with 18-135mm IS USM Lens Kit,Canon DSLR EOS Rebel T5i Camera + 8GB Memory
735,0,Canon SLR Speedlite Transmitter,Nikon Digital SLR Battery
736,1,GoPro Wi-Fi Remote,GoPro Wi-fi Remote
737,1,Canon ST-E3-RT Speedlite Transmitter,Canon ST-E3-RT Speedlite Transmitter-US Remote Triggers
738,0,Sony Wireless remote for select Alpha digital cameras,Sony ILCE A3000 Mount Type
739,0,Transcend SDHC Class 10 UHS-I (Premium) Flash Memory Card 32 GB,32GB SDHC UHS-I Speed Class 3 Flash
740,0,D-Link DCS-5000L Pan Tilt Day and Night Camera,D-Link Rotating IP Wi-Fi Cloud Camera
741,0,Canon Professional Camcorder XF105 HD,Canon VIXIA HF R30 Flash Memory Camcorder
742,1,Olympus Mirrorless 40-150mm f/2.8 PRO Lens,Used Olympus Mirrorless 40-150mm f/2.8 PRO Lens
743,0,Manfrotto Telescopic Twin Leg System,Manfrotto 3-Way Head with Q2 Quick Release
744,0,D Link Cómara de videovigilancia DCS 5010L IP 360 WiFi en negro,D Link Wireless N Day Night Pan Tilt Cloud Camera DCS 5020L Wireless Camera
745,0,Garmin VIRB XE Action Camera,Garmin Li-Ion Battery Pack
746,0,Philips Tele Zoom Lens f PXG10 Product data Philips PXG10 camera lenses (LCA3001/00),Canon EOS 1300D 18MP +18-55 EF-S IS Ultrasonic Motor
747,1,Kodak Power Flash Single Use Camera Compact film camera 35mm Black Silver Yellow,Kodak Power Flash Single Use Camera Compact film camera 35mm Hitam Perak Kuning
748,0,Dunlop Play Smashinn,Action outdoor Red Filter Goalinn
749,0,Sigma 50mm F1.4 DG HSM Art (Nikon) - Prijzen,Nikon AF Nikkor 16mm f/2.8 Fisheye D
750,1,Canon LP-E17 - camera battery Li-Ion Canon Li-Ion 9967B002 Digital Camera Accessories,Canon LP-E17 Rechargeable Battery Pack
751,1,Canon PowerShot G7 X Mark II 20.1-Megapixel Digital Camera,Canon PowerShot G7 X Mark II Digital Camera
752,0,Kupo 40-Inch Extension Grip Arm with Big Handle - Silver,"Sony FDA-EV1MK Electronic Viewfinder for DSC-RX100M2,DSC-RX1R,DSC-HX50V,DSC-RX1"
753,0,Cameron Sino Battery for AEG 4932 BLL12C-US,Kingston Digital 16 GB Class 4 microSDHC Flash Card with SD Adapter
754,0,IP Camera Fixed Mini Dome Full HD,D-Link DCS-6045LKT IP Interior Color White Surveillance Camera
755,0,Panasonic Lumix DMC-LX100 4K Wi-Fi Digital Camera (Black) Micro Four Thirds / Full HD 60P Video Leica 24-75mm f/1.7-2.8 Lens,Panasonic Lumix DMC-GH4 4K Micro Four Thirds Digital Camera Body
756,1,D Link Cómara de videovigilancia DCS 5010L IP 360 WiFi en negro,Mydlink Home Monitor 360 PROFESSIONAL IP CAMERA FULL HD CLOUD WIRELESS
757,0,Canon 2400 SLR Gadget Bag for EOS Cameras,Case Logic SLRC-202 Medium SLR Camera Bag
758,0,Canon Camera & Camcorder Cases,Canon Deluxe Gadget Bag
759,0,GoPro Hero3 Rechargeable Battery,GoPro Recargable Battery for Hero 3
760,0,Sony 35mm f/1.8 Prime Lens for Most NEX E-Mount Cameras,Sony A7RII Body
761,0,Canon EF 70-200mm f/4L USM Telephoto Zoom Lens for EOS SLR Cameras,Canon EF 85mm f/1.8 USM Medium Telephoto Lens for Canon SLR Cameras
762,0,Hynix 3rd SM8G24F14-70-HP4N SIMM,Sigma 70-300mm F4-5.6 DG Macro Lens
763,1,Panasonic Lumix DMC-GX85 4K Wi-Fi Digital Camera & 12-32mm Lens (Black),Panasonic Mirrorless GX85 with G VARIO 12-32mm f/3.5-5.6 ASPH MEGA O.I.S Lens Black
764,0,Canon Timer TC-80 N 3 3,Canon EOS 6D Digital Camera Body Only
765,0,Canon EOS 80D DSLR Camera with 18-135mm Lens Kit,Canon EOS Rebel T5i 18 Megapixel Digital SLR Camera with 18-55 mm Lens
766,1,Sony 35mm f/1.8 Prime Lens for Most NEX E-Mount Cameras,Sony SEL35F18 35mm f/1.8 OSS Standard prime lens for APS-C sensor E-mount mirrorless cameras
767,1,Buff FC Barcelona Polar 15/16,Buff FC Barcelona Polar 15/16
768,0,GoPro Silver,Nilox Chest Mount
769,0,Kodak Power Flash Single Use Camera,VIGILANCE FULL HD OUTDOOR VANDAL PROOF POE DOME CAMERA
770,0,Canon EF 24-105mm f/4L IS USM Lens,Canon EF 85mm f/1.8 USM Lens
771,1,D-Link Full-HD-Kamera DCS-6210BS Dome,D-Link Outdoor Camera DCS-6210BS Smoked Dome
772,0,Sony Rechargeable Battery,GoPro Hero3+ Rechargeable Battery LN53806 - AHDBT-302
773,0,Canon imageFORMULA DR-F120 Sheetfed Scanner - 600 dpi Optical,Canon CanoScan 9000F Mark II - flatbed scanner desktop USB
774,0,NETGEAR Arlo Smart Home Add-On Indoor/Outdoor Wireless High-Definition Security Camera,Arlo Indoor/Outdoor Camera with Mountable Wall and Ceiling Installation
775,1,Nikon AF-S Nikkor 55-300mm f/4.5-5.6G ED VR DX Lens,Nikon AF-S NIKKOR 55-300mm f/4.5-5.6G ED VR Zoom Lens
776,1,GoPro Mic Stand Out,GoPro Mic Stand Out
777,0,8GB SDHC Class 10,64GB Transcend TS64GSDXC10 CVK SDXC Class 10 Secure Digital Extended Capacity Card
778,0,Logitech Photo Cameras Camera,Logitech C920 15MP 1920 x 1080pixels USB 2.0 Black webcam
779,0,Sony HXR-NX100,SONY DSCRX100
780,1,Lezyne 3-Way With 4/5 6mm CRV Hex Bits,Lezyne 3-Way With 4/5 6mm CRV Hex Bits
781,0,"Arlo Smart Home Security Camera System - 3 HD, 100% Wire-Free, Indoor/Outdoor Cameras with Night Vision",WIFI-900XTRP Wireless Video Surveillance Transmitter
782,0,SanDisk SDCFXS-064G-A46 Extreme120MB/s60MB/s Memory & Storage,SanDisk Extreme PRO 64GB up to 95MB/s UHS-I/U3 SDXC Flash Memory Card
783,0,WTC DSLR WTC-T201C,Canon EOS 6D(WG) Digital Camera (Body Only)
784,0,Sony FDA-EV1MK Electronic Viewfinder Kit Digital Camera Attachment and Accessories,Canon EVF-DC1 Electronic Viewfinder A Excellent Used Camera Accessories
785,0,1080p AHD Security Camera System,Netgear Arlo Wireless Portable Night Vision 2x HD Camera Security System
786,0,Camera IP Wi-fi hồng ngoại không dây WTC IP9506,D-Link DCS-5009L Wi-Fi Camera
787,0,Veho Mini HD Body Camera/Action Camcorder,Sony Spare Lens Protector for RX0
788,1,GoPro Battery BacPac,GoPro Battery BacPac
789,1,Sigma 8-16mm F4.5-5.6 DC HSM (Sony) - Prijzen,Sigma 8-16mm F4.5-5.6 DC HSM (Sony) - Reviews
790,0,MeFOTO Aluminum Roadtrip Travel Tripod/Monopod Kit - Orange Professional Video Accessories,Manfrotto MK190XPRO3-BHQ2 Aluminum 3 Section Tripod Kit w/ Ball Head
791,1,Canon DSLR EOS 80D Camera Body Only,Canon DSLR EOS 80D Camera Body Only
792,1,Nilox Chest Mount Harness,Nilox Chest Mount Harness
793,0,GoPro Auto Charger with Dual USB Ports for GoPro HERO,GoPro HERO3 Black Edition
794,0,D-Link HD PoE Mini Dome Cloud Camera DCS-6004L,D-Link DCS-2330L Network Surveillance Camera
