id,label,left_title,right_title
0,1,Transcend SDHC Flash Memory Card 4GB Class 2,Transcend TS4GSDHC BUB 4GB SDHC Secure Digital Class 2
1,0,Veho VCC-003 Muvi Pro Micro (Black),Chromo 216 LED CI-216 Dimmable Ultra High Power Panel Camcorder Video Digital SLR Camera Light for Canon Nikon Pentax Panasonic SONY Samsung and Olympus Cameras-US On-Camera Lights
2,0,Sony Wireless Remote for Alpha & NEX,Sony Alpha a6000 Mirrorless Digital Camera - Body only
3,0,Fujifilm X1D Digital Medium Format Mirrorless Camera Body,Panasonic Lumix DMC-FX75S 14.1 Megapixel Digital Camera
4,1,Action outdoor Suction Cup with Plate,Action outdoor Suction Cup with Plate
5,0,Uniden UDR444 Guardian 4.3-Inch Video Surveillance System with 2 Cameras,Security Camera System with 4 Dome Infrared Cameras
6,0,GoPro,Gopro
7,1,Tamron DSLR Nikon 18-270mm f/3.5-6.3 Di-II VC LD Asph Macro Lens,Tamron DSLR Nikon 18-270mm F/3.5-6.3 Di II VC PZD Mount
8,0,Panasonic Lumix G Vario 14-45mm f3.5-5.6 ASPH MEGA O.I.S Micro Four Thirds Mount,Sigma 8-16mm F4.5-5.6 DC HSM Ultra-Wide Zoom Lens
9,0,AXIS Clear Dome Camera,GoPro Head Strap + QuickClip
10,0,GoPro Accessories Kit for Hero 4/3+/3/2/SJCAM and Xiaomi Yi Camera,Canon Deluxe 200EG Backpack
11,0,SanDisk Ultra - flash memory card 16 GB CompactFlash SanDisk CompactFlash SDCFHS-016G-A46 Flash Memory Cards,32GB CF Compact Flash Card 50MB/s 133X
12,0,D-Link Home Panoramic HD Camera DCS-8200LH,D-Link Outdoor HD PoE Day/Night Cloud Camera DCS-2310L
13,1,Canon BG-E11 Battery Grip,"Canon BG-E11 Battery Grip (for 5D MKIII, 5DS, 5DSR)"
14,1,Foscam FI9901EP PoE 4MP Outdoor IP Camera,Foscam FI9901EP POE 4.0 Mpx P2P IP KAMERA
15,0,Nikon DSLR D5300 18-55mm VR Lens,Nikon DSLR D3200 AF-S DX NIKKOR 18-55mm 3.5-5.6G VR Lens
16,0,Nikon Speedlight Flashgun,NIKON SB-700 flash cobra Flash cobra
17,0,GoPro Hero 5 Action Camera Accessories Kit,Canon Deluxe Gadget Bag
18,0,Sony Mirrorless Camera,Sony 16-70mm f/4 Zoom Lens
19,0,Netgear Replaceable Black Silicone Skins,Mydlink Home Hd Monitor 360 Cam
20,0,GoPro Accessories Kit for GoPro Hero 4/3+/2/SJCAM and Xiaomi Yi Camera,GoPro Accessories Kit for GoPro Hero 5/4/3+/3/2/1 Session Accessory Bundle Set
21,0,Nikon AF 50mm f/1.8D,Nikon AF-S Nikkor 50mm f/1.8G Lens
22,0,"Hidden Camera System, 4 Covert PIR Security Cameras, Invisible IR, DVR System with Spy Cameras for Video Surveillance",MCOCEAN Accessories Set for GoPro Hero 4 / 3 Plus 2 and Camera (33 Items) Body Mounted Cameras | Video Gear Outlet
23,0,Avermedia Vision U50 Document Camera,Canon Deluxe Gadget Bag 100EG
24,0,Smart Home HD Starter Kit,PowerLine HD Day Night Cloud Camera Kit
25,1,Sony Electronic Viewfinder Kit Digital Camera Attachment and Accessories,Sony Electronic Viewfinder Kit Black US Accessories
26,0,"Panasonic Full-HD 3MOS SD Camcorder with Advanced O.I.S., 5.1 Surround Sound",Panasonic 12.1 Megapixel Digital Camera DMC-FS15K
27,0,GoPro Mic Stand,Dual Battery Charger
28,1,Canon Vixia HF G10 (Black),VIXIA HF G10 Canon
29,0,Chromo 216 LED CI-216 Dimmable Ultra High Power Panel Camcorder Video Digital SLR Camera Light for Canon Nikon Pentax Panasonic SONY Samsung and Olympus Cameras,Nikon D300S DSLR Camera Body Only
30,1,D-Link Wireless Camera DCS-1000w,D-Link Wireless Camera DCS-1000w
31,0,Canon DSLR Camera,Canon Camcorders
32,1,D-Link DCS-5020L Camera,D-Link DCS-5020L Cámara vigilancia inalámbrica diurna/nocturna en Red
33,0,Samsung SMART 20.3 Megapixel Digital Camera EV-NX300ZBATUS,Nikon D3200 Digital SLR Camera With AF-S DX NIKKOR 18-55mm 3.5-5.6G VR Lens
34,0,GoPro Wi-Fi Remote,GoPro Auto Charger with Dual USB Ports for GoPro HERO
35,0,Logitech BCC950 Conferencecam Full HD 1080p Motorized Pan w Remote Control USB Win7 XP MAC,Manfrotto Video Camera Plate - 504PLONG Manfrotto 504PLONG
36,0,SanDisk Secure Digital Card (SDXC) CLASS 4 64GB,Transcend 64GB SDXC Class 10 Flash Memory Card
37,1,SanDisk Extreme 64GB Compact Flash Card,SanDisk - Extreme 64GB CompactFlash (CF) Memory Card
38,0,Sony Alpha a6000 Mirrorless Camera with 16-50mm and 55-210mm Lenses Black,Samsung SMART 20.3 Megapixel Black Digital Camera EV-NX300ZBATUS
39,1,D-Link Full HD Wireless Day Night Network Camera DCS-2230L,Professional IP Camera Full HD Cloud Wireless
40,0,Canon Vixia HF G10 Black,Transcend 32 GB CompactFlash
41,0,GoPro HERO3 Black Edition,GoPro Composite Cable
42,0,Manfrotto Tripod Kit,Manfrotto 055 Series 67 3-Section Carbon Fiber Tripod
43,0,GoPro Wrist Support,GoPro Mic Stand
44,0,Manfrotto Tripod System,Manfrotto Carbon Fiber Tripod
45,0,GoPro HERO3+ Silver Edition,MCOCEAN Accessories Set for GoPro Hero 4 / 3 Plus 2 and Camera
46,0,Canon Electronic Viewfinder A - Excellent Used Camera Accessories,Canon BG-E11 5D MKIII
47,1,Nikon 18-105mm f/3.5-5.6G ED VR AF-S DX Nikkor Autofocus Lens,Nikon AF-S DX 18-105mm f/3.5-5.6G ED VR
48,0,NEEWER 160 LED CN-160 Dimmable Ultra High Power Panel Digital Camera / Camcorder Video Light,Veho Muvi HD10 Handfree Camcorder
49,1,Canon PowerShot SX540 HS,Canon PowerShot SX540 HS 20.3MP 1/2.3 CMOS 5184 x 3888 Juoda
50,0,Nikon AF-S Zoom-Nikkor 70-200mm f/2.8G ED VR II Lens,Nikon 10-24mm f/3.5-4.5G ED AF-S DX Zoom-Nikkor Lens
51,0,Canon Camera & Camcorder Chargers CDWG.com,GoPro AHBBP-301 Charger
52,1,Fujifilm Mini Lab Supplies,Fujifilm Photo
53,0,Panasonic 7-14mm f/4.0 Lumix G Vario ASPH Mirrorless,Canon EF-S 10-22mm USM Ultra-wide-angle zoom lens for APS-C sensor EOS SLR cameras
54,0,Kupo 40-Inch Extension Grip Arm with Big Handle - Silver,Aluratek 7 inch Digital Photo Frame
55,1,Canon Battery Grip for EOS 6D Mark II,Canon Battery Grip for EOS 6D Mark II
56,0,Leica Battery Pack,Zebra ZQ110 Mobile Receipt Printer
57,0,Canon DSLR EOS Rebel T5i,Canon EF-S 18-55mm f/3.5-5.6 IS STM Lens
58,0,Sony Handycam Camcorder (Silver),Sony Handycam with Exmor R CMOS sensor
59,1,Canon PowerShot SX60 HS Digital Cameras,PowerShot SX60 HS Canon
60,0,GoPro HERO3+ Silver Edition,MCOCEAN Accessories Set for GoPro Hero 4 / 3 Plus 2 and Camera
61,0,Shimano Deore M506 Front,GoPro Mic Stand
62,1,Suunto Spartan Ultra Titanium HR HR,Suunto Spartan Ultra Titanium HR HR
63,0,D-Link Wi-Fi Camera DCS-5009L,D-Link Outdoor Camera DCS-2310L
64,0,"DVR Home Surveillance System, IR Cameras","HD Hidden IR Camera System, 8 1080p PIR Cameras"
65,0,Camera Accessories,Sigma 70-300mm f/4-5.6 DG OS Telephoto Zoom for Pentax AF Digital SLR Cameras
66,0,MicroSD 16G,GoPro Hero3 Silver
67,0,GoPro HERO3 Black Edition Camcorder,GoPro AHDBT-302 Rechargeable Battery for GoPro HERO3+ and HERO3
68,0,Nilox Battery F 60 Evo Swiminn,Action outdoor Floating Hand Grip Bobber
69,0,GoPro Side Mount,Go Pro Frontal Support for Helmet - Camera Accessories in Barrabes.com
70,0,Sigma 10-20mm f/4-5.6 DC J Autofocus Lens for Pentax Digital SLR Cameras,Sigma 18-250mm f/3.5-6.3 DC OS HSM Autofocus Zoom Lens For Pentax Cameras
71,1,Fujifilm Instax Mini 8 Camera,Rubbermaid MixerMate Pitcher
72,0,Transcend 128GB SDXC Ultimate UHS-1 Memory Card,Kingston 128GB SDXC Flash Memory Card
73,0,Elite Screens Manual 84-inch 16:9 Pull Down Projection Screen,Kupo 40 Inch Hex Grip Arm with Big Handle - Black Lighting Accessories
74,0,Avenger A2030 Steel 40-Inch Detachable Base C-Stand with Grip Kit (Chrome),GoPro 3-Way Mount
75,0,Canon DSLR EOS Rebel T3 Camera with EF-S 18-55mm f/3.5-5.6 IS Lens,Canon DSLR EOS Rebel T5 Camera with EF-S 18-55mm IS II Lens
76,0,Distance Camera RS-60 E3,Canon Digital Gadget Bag 200DG Canon 200DG - 9320A003 Camera Accessories
77,0,Canon EF 40mm f/2.8 STM Lens,Canon EF-S 55-250mm Telephoto Zoom Lens
78,0,Transcend Ultimate - Flash Memory Card 16 GB CompactFlash Transcend CompactFlash TS16GCF1000,Transcend 128GB SDXC Class 10 UHS-1 Flash Memory Card
79,0,Canon EF 24-70mm f/4L IS USM Zoom Lens,Used Canon EF-S 18-55mm f/3.5-5.6 IS STM Lens L - Excellent
80,0,Sigma 10-20mm f/4-5.6 DC HSM for Canon,Sigma 10-20mm f/4-5.6 DC HSM for Canon
81,0,SanDisk 64GB Extreme Pro Secure Digital Extended Capacity (SDXC) Flash Card Model SDSDXPA-064G-A46,Transcend SDXC 64GB Class 10
82,0,Fujifilm X-T20 Body with XF 18-55mm Lens Kit (Silver),Canon EOS 77D DSLR Camera (Body Only) - Canon DSLR EOS 77D Camera with 18-55mm Lens
83,0,Sony Cyber-shot DSC-RX100 III 20.1-megapixel compact digital camera with Wi-Fi,Sony SEL 35mm f/1.8 OSS E-mount Lens
84,1,Canon Cámara SX510 Negra,Canon Power Shot SX510 HS Point-and-Shoot Camera
85,1,Canon Deluxe Gadget Bag 10EG (Holds 2 Cameras and 5 to 8 Lenses),Canon Gadget Bag 10EG Deluxe Camera & Camcorder Cases
86,1,Canon XF105 HD Professional Camcorder,Canon XF105 Professional Camcorder
87,1,Canon DSLR EOS 77D Camera Body Only,Canon EF-S 18-55 IS STM Kit
88,0,GoPro Composite Cable,GoPro Hero3+ Rechargeable Battery
89,0,Fujifilm Instax Mini 25 Camera (White) uses Film,Veho VCC-003 Muvi Pro Micro
90,0,Canon Printhead,Manfrotto MVH500AH Fluid Head
91,0,GoPro Jaws Flex Clamp Mount,GoPro Camera Tethers Miscellaneous Accessories
92,0,Red Filter,Wrist Support For GoPro And Sport Cameras
93,0,Action outdoor Floating Hand Grip,Gopro Mic Stand
94,0,Transcend 64GB CompactFlash Card,TARJETA SD 32GB SDHC CLASE 10
95,0,Transcend CompactFlash 16 GB Flash Memory Card,SanDisk Extreme Pro 16GB CF r160MB/s 1067x CompactFlash Card
96,0,Sony Cyber-shot RX100,Sony Cyber-shot DSC-WX80 (Black) 16.2-megapixel digital camera with 8X optical zoom and Wi-Fi
97,0,GoPro Camera-Sport,GoPro Rollbar Camera Mount
98,0,Sony NXCAM Professional Camcorder,Sony High Definition Handycam Camcorder
99,0,GoPro HERO5 Black 4K Action Camera,Vanguard Alta Pro 263AT Tripod
100,0,D-Link Full HD PoE Day/Night Network Camera DCS-2210L,Tradineur POWERLINE HD DAY/NIGHT CLOUD CAMERA
101,0,"10.1 Megapixel Digital Camera with Manual Focus & Zoom Rings, Silver DMC-FZ50S",12.1 Megapixel Digital Camera DMC-FX48S
102,0,Canon DSLR EOS 6D Camera Body EF 24-105mm L IS USM Lens,Canon EF 17-40mm f/4 L USM Lens
103,1,Sony Tripod VCT-R100,Sony VCTR100.AE Camera Tripod
104,0,Veho Muvi HD PRO 1080p Mini Camcorder,Panasonic Lumix DMC-GH4 4K Micro Four Thirds Digital Camera Body
105,1,Nikon DSLR Nikkor 50mm f/1.8G Lens Kit,Nikon AF-S Nikkor 50mm f/1.8G Lens
106,0,GoPro HERO4 BLACK Moto Bundle,GoPro HERO4 Rechargeable Battery
107,1,Gateway DSLR ML6000 6-Cell Li-Ion Battery SQU-412,Gateway DSLR MX6000 6-Cell Li-Ion Battery SQU-412
108,0,Nilox Remote Control F60 Evo,Buff FC Barcelona Polar 15/16
109,0,14.1 Megapixel Lumix Digital Camera DMC-FX75S,"8.1-Megapixel Digital Camera with 18x Optical Zoom, Silver , DMC-FZ18S"
110,0,D-Link IP HD Cloud Camera,D-Link Wireless AC Day/Night HD Mini Bullet Cloud Camera
111,0,Canon Cable USB 1.5m IFC-400PCU,Canon Camera Bag 2400 - case for camera Canon EOS 7507A004
112,0,Panasonic Lumix G Vario 14-45mm f3.5-5.6 ASPH Micro Four Thirds Mount,Panasonic Lumix G X Vario 12-35mm f2.8 ASPH Power OIS Micro Fourth Thirds Mount
113,0,Canon Camera Lens Adapter 4960999581033 Specs Canon Adapter camera lens adapters,Canon EF-S 18-55mm f/3.5-5.6 IS STM Lens
114,0,D-Link PTZ WiFi Camera,D-Link DCS-5000L/E Indoor Color Camera
115,0,Sony DV tape,Sony AS30V High Definition POV Action Video Camera
116,1,Panasonic Battery Pack VW-VBT190,Panasonic Lithium-Ion Battery Pack VW-VBT190 (Black)
117,0,Canon Digital Camera Accessories,Canon EOS 6D(N) Digital Camera
118,0,Canon EF-S 55-250mm f/4-5.6 IS STM Telephoto Zoom Lens,Canon EF-S 10-22mm f/3.5-4.5 USM Lens
119,0,GoPro Hero 4 Black with Batteries Dual Charger,GoPro Hero 6 Black
120,1,Leica GEB212 Battery,Leica GEB212 Battery
121,0,Veho VCC-004 MUVI Atom Body Camera/Action Camcorder Bundle,Veho VCC-005-MUVI-HD10 Mini HD Body Camera/Action Camcorder
122,0,Fujifilm Instant Camera,Camera Bag
123,0,Sony AS30V High Definition POV Action Video Camera,Sony HD Video Recording Handycam Camcorder
124,0,Sony Cyber-shot RX100 20.2-Megapixel Digital Camera,Sony Cyber-shot DSC-RX100 III 20.1-megapixel compact digital camera with Wi-Fi
125,0,Transcend CompactFlash TS32GCF133 Flash Memory Cards,Transcend 32GB SDHC Class 10 UHS-1 Flash Memory Card
126,0,Action Model 1080 DLP With Crystalio II,Sony HDR-CX260 High Definition Handycam Camcorder
127,1,Manfrotto Three-Section MT055XPRO3 Aluminum Tripod,Le-Chasseur 055 - 3 sections aluminium Tripod
128,0,Panasonic NE-1054 Inverter,Sony Cyber-shot RX100
129,1,Fujifilm Instax Mini 8 Camera,Fujifilm INSTAX Mini 8 Instant Film Camera
130,0,Mydlink PTZ Wireless IP Camera HD Day & Night,D-Link Outdoor PoE HD DCS-2310L Camera
131,0,GoPro Mount AHEDM-001 Digital Camera Accessories,GoPro Rechargeable Battery for GoPro HERO3+ and HERO3
132,0,GoPro Roll Bar Mount GoPro Mount - Camera De Sport,Fujifilm X100 Silver Edition
133,1,GoPro Hero3+ Silver Edition,GoPro HERO3+: Silver Edition -US GoPro | Come As You Arts-US
134,0,VEHO MUVI HD NPNG Special Edition Bundle,GoPro Hero 4 Black with Batteries and Dual Charger
135,0,Sony LCD Screen Protector for A7 or A7R Digital Camera Miscellaneous Accessories,6-Megapixel Digital Camera with 3x Optical Zoom and 2.5 Diagonal LCD Silver DMC-FX10S Panasonic
136,0,Canon EF 50mm f/1.8 II Lens,Used Canon EF-S 18-55mm f/3.5-5.6 IS STM Lens
137,0,Sony Alpha a6000 Mirrorless Digital Camera - Body only,Sony Alpha a6000 Mirrorless Camera with 16-50mm Retractable Lens
138,0,Kupo Kupole Extension 6.6FT (2.0m) Lighting Accessories,Kupo Hex Stud Female 3/8-16 to 1/4-20 Mount
139,0,Vanguard Alta Pro 263AT Tripod,Nikon EN-EL4A Rechargeable Battery
140,0,Umbro Classico 4,Hjc RPHA 11 Darter
141,1,Ksix Wrist Support For GoPro And Sport Cameras,Ksix Wrist Support For GoPro And Sport Cameras
142,1,Manfrotto 055 Series 67 4-Section Carbon Fiber Tripod,Manfrotto MT055CXPRO4 4-Section Carbon Fiber Tripod
143,0,Canon Canoscan 9000F Mark II,Canon EOS 5D Mark II
144,0,Canon EF 2x III Extender Battery Grip,Canon EF 20mm f/2.8 USM Wide Angle Lens
145,0,Canon CanoScan 9000F MKII Color Image Scanner,Canon 200DG Digital Camera Gadget Bag
146,0,Canon 24-105mm f/4L IS EF USM AF Lens,Canon EF 17-40mm F4L USM
147,0,MicroSDHC UHS-I U3 Card,MicroSD 10 Adapter
148,0,Kingston Digital 16GB MicroSDHC UHS-I Action Card,Kingston 32 GB SDHC UHS-I Flash Memory Cards
149,0,Sony Handycam HDR-CX110 HD Camcorder (Red),Sony Handycam HDR-CX190 High Definition Camcorder (Black)
150,1,Garmin VIRB XE Action Camera 010-01363-11,Garmin VIRB XE Action Camera 010-01363-11
151,0,Sony Handycam Camcorder with Built-in Projector 32GB Full HD HDR-PJ540 (Black) Accessory Bundle,Sony PAL/HDR-CX190 HD Camcorder
152,0,Canon EF 20mm f2.8 USM Digital SLR Camera,Sigma Zoom Super Wide Angle 10-20mm f/4-5.6 EX DC HSM Autofocus Lens for Canon Digital SLR Cameras
153,0,32GB microSDHC (Secure Digital High Capacity) Card,Transcend 32GB SDHC UHS-I Flash Memory Card
154,0,Canon PowerShot SD-800 Digital Camera Battery,Panasonic DMW-BCG10 Battery
155,0,Sigma Telephoto Zoom for Pentax AF Digital SLR Cameras,Sigma Autofocus Zoom Lens For Pentax Cameras
156,1,Kupo 40-Inch Extension Grip Arm with Big Handle - Silver,Kupo 40-Inch Extension Grip Arm with Big Handle - Silver
157,0,SanDisk Extreme PRO 64GB up to 95MB/s UHS-I/U3 SDXC Flash Memory Card,Transcend SDXC 64GB Class 10
158,0,Canon Rechargeable battery for select PowerShot digital cameras,Canon Camera & Camcorder Chargers
159,0,D-Link Wireless Camera DCS-1000w,D-Link DCS 6010L Wireless N 360° Home Network Camera
160,0,Canon 200DG Digital Camera Gadget Bag (Black),Aluratek 7 inch Digital Photo Frame
161,0,D-Link DCS-2132L Camera,D-Link DCS-5020L Day/Night Surveillance Wi-Fi Camera
162,0,Nikon AF-S NIKKOR 28-300mm f/3.5-5.6G ED VR,Canon EF 70-300mm f/4-5.6L IS USM Autofocus Telephoto Zoom Lens
163,1,Secure Digital SD HC Memory Card,Transcend 32GB Secure Digital High-Capacity (SD)(SDHC) Class 10 Memory Card
164,1,SONY Mirrorless ILCE6000LS,Sony Alpha ILCE6000L/S 24.3MP Mirrorless Digital Camera
165,0,Canon Battery Grip for EOS 70D,Canon LP-E10 Camera Battery for EOS 1100D
166,0,Canon XF100 HD Professional PAL Camcorder,Canon XF105 and Canon XF100 Professional Camcorders
167,0,Canon Remote Switch RS60 E3,Manfrotto Follow Focus Electronic
168,0,Manfrotto Video Tripod Aluminum Simple Carbon Fiber MVH500AH755CX3,Manfrotto 190 MK190XPRO3-BHQ2 Kit
169,0,D-Link Outdoor Camera DCS-6210BS,D-Link PowerLine Day/Night Kit DCS-6045LKT
170,0,Canon WD-H58 Wide-angle camcorder lens,Canon BP-828 Li-Ion Video Camcorder Batteries
171,0,Suunto Spartan Ultra Titanium HR,Nilox Remote Control F60 Evo
172,1,Gigaram SD-M32 BQH 32MB SD Secure Digital Card Bulk,SanDisk SDSDS-32-901 BQH 32MB SD Secure Digital Card Clam
173,0,Canon EF 70-200mm f/4L USM Lens,Canon EF 17-40mm f/4L USM Lens
174,0,GoPro ALCDB-401 LCD Touch BacPac,MCOCEAN Accessories Set for GoPro Hero 4 / 3 Plus 2 and Camera
175,0,Canon 580EX/ 580EX II Flash Speedlite Grid Light Modifier System,Chromo CI-216 Ultra High Power Panel Camcorder Video Digital SLR Camera Light
176,0,Garmin Virb/Aera660 Lithium-ion Battery Pack,Toro 88500 Cordless Batteries
177,0,Fujifilm Digital Camera (Silver) with 23mm f/2 Lens Kit,Panasonic Lumix DMC-GF5 Digital Camera with 14-42mm Lens Kit
178,1,Canon NB-5L,Canon NB-5L Rechargeable Lithium-ion Battery
179,1,SanDisk 64GB SDXC,SanDisk 64GB SDXC
180,0,Canon Electronic Viewfinder EVF-DC1,Canon BG-E11 Battery Grip for 5D MKIII
181,1,SONY ILCE6000LB,Sony Alpha a6000 Mirrorless Digital Camera with 16-50mm Power Zoom Lens-US
182,0,Kupo 40 Inch Hex Grip Arm with Big Handle - Black Lighting Accessories,Kupo Kupole Extension 6.6FT (2.0m) Black Lighting Accessories
183,0,Sony Cyber-shot RX100,Nikon SB-300 Speedlight
184,0,D-Link Wireless AC Day/Night HD Mini Bullet Cloud Camera,D-Link DCS-5020L Wireless AC Day/Night HD Mini Bullet Cloud Camera
185,0,GoPro Hero3 Silver,Nikon D5100 Digital SLR Camera With 18-55mm VR Lens
186,0,Canon DSLR 5D Mark III Body Only D - Good,Canon DSLR 70D Body D - Good
187,0,Lezyne 3-Way With 4/5 6mm CRV Hex Bits,Dunlop Play
188,0,D-Link HD Wireless Cloud Camera DCS-2132L,D-Link DCS 5222L Network Surveillance Camera
189,1,Canon DSLR EOS Rebel SL1 8575B003 Digital Camera,Canon DSLR EOS Rebel SL1 with 18-55mm STM Lens-US Digital Camera
190,0,Go Pro Tripod Adaptor,Go Pro Helmet Mount
191,0,SanDisk Extreme microSDHC 64Gb Type 10,Nilox Remote Control F60 Evo
192,0,Sony Alpha a3000 Mirrorless Camera with 18-55mm Zoom Lens,Canon EOS Rebel T3 Digital SLR Camera with EF-S 18-55mm f/3.5-5.6 IS Lens
193,0,Avenger A2030D Steel 40-Inch Detachable Base C-Stand with Grip Kit (Chrome),Kupo Hex Stud Female 3/8-16 to 1/4-20 1/4-20 KG001012
194,1,Canon 24-105mm f/4L IS EF USM AF Lens,Canon EF 24-105mm f/4L IS USM Lens
195,0,128GB SDXC UHS-I U3 Card,Transcend 128GB SDXC Class 10 Flash Memory Card
196,0,Panasonic LUMIX LX100 Integrated Leica DC Lens Camera with Advanced Controls,Panasonic Lumix Digital Camera DMC-FX75K
197,0,Nikon EDG 65mm Fieldscope with 16x-48x Zoom Eyepiece,Canon EOS Rebel T5 Digital SLR Camera Body with EF-S 18-55mm IS + EF 75-300mm f/4-5.6 III Polaroid Studio Series Lenses
198,0,Canon EF-S 18-55mm f/3.5-5.6 IS STM Lens,Canon EF 17-40mm f/4 L USM Lens
199,0,Canon Deluxe Gadget Bag 100EG-US Camera Cases,Canon EOS Rebel T5 DSLR Camera with 18-55mm and 75-300mm Lens Bundle 64GB Deluxe Accessory Kit-US
200,1,Canon Battery Charger,Canon Battery Charger
201,0,Action outdoor Dual Battery Charger,NetPower 6 6
202,0,SanDisk Extreme 32GB Compact Flash Card,SanDisk Extreme Pro 32 GB SDHC UHS-II
203,0,GoPro Protective Lens and Covers,GoPro Dual HERO System for HERO3+
204,0,Sony Mini DV Cassette Without Chip,SanDisk Ultra microSDXC 200GB
205,0,Manfrotto Hydrostatic Ball Head with Quick Plate,Manfrotto BeFree Tripod with Ball Head
206,1,Nikon AF 50mm f/1.8D,Nikon AF 50mm f/1.8D
207,1,Canon EF 50mm f/1.4 USM Standard Lens for Canon SLR Cameras,Canon 50mm Camera & Camcorder Lenses
208,0,GoPro Wi-Fi Remote,GoPro Composite Cable
209,0,Canon DSLR EOS 77D Camera Body Only,Canon DSLR EOS 80D Video Creator Kit EF S 18 135mm IS USM lens
210,0,Canon DSLR EF 100mm F2.8 MACRO USM Camera,Canon DSLR EF 70–300mm f/4–5.6L IS USM Telephoto Zoom Lens
211,1,Canon EF 50mm f/1.8 II,Sony Alpha a7S II Mirrorless Digital Camera
212,0,Veho VCC-004 MUVI Atom No Proof Glory Body Camera/Action Camcorder,Nikon D610 DSLR Camera (Body Only) + Accessory Bundle
213,0,Transcend 4GB Class 10 SDHC Card Camera & Photo Accessories,Transcend Premium Secure Digital SDXC Card Class 10 128GB
214,0,Sigma 12-24mm f/4.5-5.6 EX DG Aspherical HSM Wide Angle Autofocus Zoom for Nikon,Sigma 10-20mm f/3.5 HSM DC Canon
215,0,Earthwise CHL91302 Tow Behind Cordless Batteries,Canon CB-2LX BATTERY CHARGER
216,0,D-Link 2-Megapixel Panoramic Wireless Cloud Camera DCS-6010L,D-Link DCS-6915 IP Exterior Almohadilla Color blanco cámara de vigilancia PTZ WIRELESS N MYDLINK HD DAY & NIGHT
217,0,Manfrotto Video Long Rapid Connect Mounting Plate,Action Suction Cup with Plate
218,0,Manfrotto Carbon Fiber Tripod MT055CXPRO3,Manfrotto Complete Photo Tripod MK190XPRO4-BHQ2
219,1,Canon DSLR 5D Mark III Body Only D,Canon DSLR 5D Mark III Body Only D
220,0,SanDisk Extreme microSDHC 64Gb Type 10,HP MSA50 10-Bay 1U Enclosure
221,0,Sony Handycam HDR-CX405 High-definition camcorder,Sony PAL/HDR-CX260 High Definition Handycam Camcorder
222,0,Billingham Professional 335 Black Camera Bag,Canon 200DG Digital Camera Gadget Bag
223,1,Canon DSLR EOS Rebel T3 Camera with EF-S 18-55mm f/3.5-5.6 IS Lens,Canon DSLR EOS Rebel T3 Interchangeable Cameras with EF-S 18-55mm f/3.5-5.6 IS Lens
224,0,Panasonic Mirrorless Camera with G VARIO 12-32mm f/3.5-5.6 ASPH. MEGA O.I.S Lens,Panasonic Digital Camera Accessories For Panasonic Camera - DMC-FZ200K
225,1,Sony Cyber-shot DSC-WX350 digital camera,SONY WX350 COMPACT CAMERA WITH 20X OPTICAL ZOOM - DSC-WX350
226,0,Nikon AF-S Nikkor 50mm f/1.8G Lens,Nikon Telephoto AF Micro-Nikkor 105mm f/2.8G ED-IF AF-S VR Autofocus Lens
227,0,Nilox F60 Reloaded Full HD Wifi,Ksix Selfie Extension For GoPro And Sport Cameras
228,0,Canon 200EG Deluxe Digital SLR Camera Backpack Case,Canon 200DG Digital Camera Gadget Bag (Black)
229,0,Sony PAL/HDR-CX190 HD Camcorder,Sony PAL/HDR-CX260 High Definition Handycam Camcorder
230,0,Fujifilm Instax Mini 8 Camera,Panasonic DMC-FX48S Digital Camera
231,0,SanDisk Extreme Pro - flash memory card 32 GB SDHC UHS-II,Fujifilm SDHC Memory Card
232,0,Garmin Head Strap Mount,Garmin VIRB XE Action Camera - 010-01363-11 Garmin Ultra 30 010-01529-03
233,1,Canon Zoom Grip for COMPACT-SERVO Lens,Canon ZSG-C10 Zoom Grip for COMPACT-SERVO Lens 1715c002 on Markertek - America
234,0,Transcend SDXC Class 10 Flash Memory Card Up to 90MB/s (TS128GSDXC10U1),Transcend SDXC Class 10 Flash Memory Card Up to 30MB/s (TS64GSDXC10)
235,1,Nikon AF-S 105mm f/2.8 G VR Micro,Nikon Telephoto AF Micro-Nikkor 105mm f/2.8G ED-IF AF-S VR Autofocus Lens
236,0,Nikon AF-S DX 18-105mm f/3.5-5.6G ED VR,Sony E 50mm F1.8 OSS
237,0,Uniden UDR444A 4.3 LCD Wireless Video Surveillance System,MCOCEAN 7 in 1 Accessories Kit for GoPro Hero 4/ 3+/ 3/ 2/ SJCAM and Xiaomi Yi Camera Body Mounted Cameras
238,0,MeFOTO RoadTrip 61.6 Tripod Orange,Vanguard Alta Pro 263AT
239,0,Canon DSLR EOS 77D Camera Body Only,Canon EF-S 18-55mm f/3.5-5.6 IS STM Lens
240,0,SanDisk DSLR/HD Camcorder CF Compact Flash Memory Card 128GB LN65841 - SDCFXSB-128G-G46,Transcend Ultimate - flash memory card 128 GB CompactFlash
241,1,Oregon Chain Saw Accessories,Oregon Leaf Blower Accessories
242,0,D-Link Wi-Fi Camera DCS-5009L,D-Link HD Camera DCS-2330L
243,0,Prophet Sport Plus 50W AC/DC Charger,Sony AS30V High Definition POV Action Video Camera HDR-AS30V Body Mounted Cameras
244,0,Sony PXW-FS7 II,Sony A7SII Alpha Series Mirrorless Digital Camera Body
245,0,Manfrotto 3-Way Camera Head,GoPro Hero3+ Silver Edition Mount Strap
246,1,Action outdoor Red Filter,Action outdoor Red Filter
247,1,Canon EF-S 55-250mm f4.0-5.6 IS lens,Canon EF-S 55-250mm f/4-5.6 IS II Lens
248,0,Canon XF100 HD Professional Camcorder,Sony HXR-NX5U/N NXCAM Professional Camcorder
249,1,Panasonic NE-1054 Inverter,Sony SEL 55-210mm F4.5-6.3 OSS E-mount Lens
250,1,Sigma DSLR 4.5mm f/2.8 EX DC Circular Fisheye HSM (Sony Alpha) Camera,Sigma DSLR 4.5mm F2.8 EX DC Circular Fisheye HSM (Sony) Camera
251,0,Manfrotto PL Adapter,Manfrotto MB PL-3N1-26 Pro Light Bag
252,1,D-Link DCH-107KT Kit MyDLink Smart Home Security,D-Link DCH-107KT Kit MyDLink Smart Home Security PowerLine
253,0,Kupo 40-Inch Extension Grip Arm with Big Handle - Black,Kupo Hex Stud Female 3/8-16 to 1/4-20 1/4-20
254,0,Patriot 32GB SDHC Class 4 Secure Digital High Capacity,Toshiba 8GB SDHC Class 6 Secure Digital
255,1,GoPro HERO3 Black Edition Camcorder,GoPro HERO3 Black Edition Camera
256,0,Sigma 120-400mm f/4.5-5.6 DG APO O HSM Autofocus Zoom Lens for Sony,Sigma 18-250mm f/3.5-6.3 DC OS HSM Autofocus Zoom Lens For Pentax Cameras
257,0,Manfrotto Hydrostatic Ball Head With Rc4 Rapid Connect Plate,Manfrotto X-PRO 3-Way Tripod Head
258,1,Veho Muvi Micro Pro Camcorder,Veho VCC-003 Muvi Pro Micro Black
259,1,SanDisk 32GB SDHC Flash Memory Card (SDSDB-032G-B35) Camera & Photo Accessories,Transcend Secure Digital Card SDHC Class 4 32GB
260,1,Batteries Lithium 2032 Batteries,Energizer 2032-4pk Lithium Battery
261,0,Manfrotto Three-Section MT055XPRO3 Aluminum Tripod,Manfrotto BeFree Tripod with Ball Head
262,1,1080p AHD Video Surveillance System,1080p HD CCTV System
263,0,Canon Camera Battery Grip 9130B001,Canon Rechargeable Battery Pack LP-E17
264,0,Leica GEB77-us Teodoliti Battery,GoPro Hero Bateria
265,0,Canon PowerShot G1 X,Panasonic Lumix FZ100
266,0,16 Rods Octagon Softbox with Grid for Bowen or Alien Bee Monolight Strobe Studio,Canon PowerShot G7 X Mark II-US II
267,0,D-Link Outdoor HD Wireless Day/Night Cloud Camera DCS-2332L,D-Link Cloud Wireless N Panoramic/Inclination/Zoom Camera DCS-5222L
268,1,Sony NP-FM500H Micro USB Battery,Sony Rechargeable Battery
269,0,Action outdoor Suction Cup with Plate,Action outdoor Floating Hand Grip Bobber
270,0,Canon DSLR EOS 6D(N) Digital Camera (Body Only),Canon DSLR Gadget Bag for EOS Cameras
271,0,Largest HD Video Display,SanDisk Extreme SDXC 128GB
272,0,Garmin VIRB XE Action Camera,Garmin Li-Ion Battery Pack
