id,label,left_title,right_title
273,0,Garmin Rechargeable NiMH Battery for GPSMAP 64s/Oregon 600 Series GPS Batteries,Panasonic VW-VBK360 Li-Ion Battery Pack
274,1,Manfrotto Pro Light Camera Backpack 3N1-26 for DSLR/CSC/C100 DSLR/CSC/C100 MB PL-3N1-26,Manfrotto MB PL-3N1-26 Pro Light Rugzak Zwart
275,0,APC NetBotz Room Monitor 355 with 120 240V PoE Injector,Foscam FI9901EP POE 4.0 Mpx P2P IP KAMERA
276,0,D-Link Mini Dome Camera,D-Link Full Camera
277,0,Shimano Deore M506 Front Kit,Suunto Spartan Ultra Titanium
278,0,Canon DSLR EOS 70D Camera Body Only,Canon DSLR EOS 60D Body
279,0,"PNY Elite Performance 512GB SDXC Class 10 UHS-I, U3 Up to 95MB/sec Camera",TARJETA SD 32GB SDHC CLASE 10 300X
280,0,Canon DSLR EOS 6D Camera with 20.2MP Body Only,Canon DSLR EOS Rebel T3i Camera Body Only
281,1,Veho Muvi HD10 Handfree Camcorder,"Veho VCC-005-MUVI-HD10 Mini Handsfree Action Cam with Wireless Remote, 4GB Memory, and Helmet Mounting Bracket"
282,0,Nilox Remote Control F60 Evo,Dsk NetPower 6
283,1,GoPro Lens replacement kit Gopro alnrk301 oalnrk_301 Camera tether atbkt005 atbkt_005 GoPro de accesorios para el wifi remote awrmk-001,GoPro WiFi Remote Accessory Kit
284,1,SanDisk Extreme Pro - flash memory card 32 GB SDHC UHS-II,SanDisk Extreme Pro - flash memory card 32 GB SDHC UHS-II
285,1,Sony DT 30mm F2.8 SAM Macro Lens,Sony SAL30M28 - macro lens 30 mm
286,0,Nikon AF-S NIKKOR 28-300mm f/3.5-5.6G ED VR Zoom Lens,Nikon Nikkor AF-S 70-200mm f/2.8G IF-ED VR II Mount
287,0,Sony VCT R100 Camera Tripod,Manfrotto BeFree Tripod with Ball Head
288,0,SanDisk Extreme Pro 16GB Compact Flash Card,SanDisk Extreme Pro 32GB CompactFlash Memory Card
289,0,Canon EF 2x III Extender,Canon EF telephoto zoom lens - 70 mm 300 mm
290,1,SanDisk Extreme microSDHC 64Gb Type A1,SanDisk Extreme microSDHC 64Gb Type A1
291,1,Sigma 10-20mm f/4-5.6 DC AF Lens for Sony Alpha Digital SLR Cameras,Sigma 10-20mm f/4-5.6 DC Autofocus Lens for Sony Alpha Digital SLR Cameras
292,0,Fujifilm Memory Card 4GB Speed Class 10,Transcend Ultimate series 128 GB SDXC UHS-I Flash Memory Cards
293,0,Canon Li-Ion 8598B002 Video Camcorder Batteries,Canon Camera & Camcorder Chargers
294,1,Sony Alpha E-Mount FE 24-70mm f/2.8 GM Zoom Lens,Sony FE 24-70mm f/2.8 GM Standard zoom lens for E-mount mirrorless cameras
295,1,Sony Mirrorless a7RII Full-frame Interchangeable-Lens Camera,Sony Alpha a7RII Mirrorless Digital Camera
296,0,Sigma Circular Fisheye HSM (Nikon),Sigma 120-400mm f/4.5-5.6 DG OS HSM APO Autofocus Lens for Sony Alpha
297,0,D-Link DCS-5030L - Network Surveillance Camera,PowerLine HD Day Night Cloud Camera Kit
298,0,Sony Camera 20MP Sensor CMOS EXMOR,Fujifilm WCL-X100S Wide Conversion Lens (Silver) Fujifilm Digital SLR
299,0,D-Link Wireless AC Day/Night Camera with Colour Night Vision DCS-2136L,D-Link Outdoor HD Wireless Day/Night Cloud Camera DCS-2332L
300,0,Aluratek Digital Photo Frame,Olympus M.ZUIKO DIGITAL ED 40-150mm f/2.8 PRO Lens
301,0,Manfrotto Aluminum 3 Section Tripod Kit w/ Ball Head,Manfrotto Carbon Fiber Tripod MT055CXPRO3
302,1,Sigma 15mm f/2.8 EX DG Diagonal Fisheye Autofocus Lens,Sigma 15mm F2.8 EX DG Diagonal Fisheye
303,0,Bushnell Trophy Cam HD Wireless,D-Link Cámara IP Full HD Wireless
304,0,8GB SDHC Class 10,Transcend Ultimate series - flash memory card 128 GB SDXC UHS-I
305,0,"Giottos Aegis LCD Screen Protector for Nikon 1 V1, V2 & J1 Mirrorless Cameras",Canon EF 85mm f/1.8 USM Medium Telephoto Lens
306,1,D-Link 2-Megapixel Panoramic Wireless Cloud Camera DCS-6010L,D-Link Fisheye 360 ° mydlink Cloud Caméra DCS-6010L
307,0,Canon HFM-500 Videocamera,Canon Speedlite 600EX RT
308,0,"Panasonic 8.1-Megapixel Digital Camera with 2.5 LCD, iA Technology, Blue, DMC-FX33A","Panasonic 8.1-Megapixel Digital Camera with 3.0 LCD, iA Technology, Silver, DMC-FX55S"
309,0,Sony Cyber-shot RX10 II,Sigma 70-300mm f/4-5.6 APO DG Macro Autofocus Lens for Pentax
310,0,Action outdoor Suction Cup with Plate,GoPro Mic Stand
311,1,Ksix Selfie Leds Flash With 3.5 Mm Jack For Smartphones,Ksix Selfie Leds Flash With 3.5 Mm Jack For Smartphones
312,0,SanDisk Extreme Pro Compact Flash (CF) Memory Card 160MB/s UDMA 7 - 16GB,Transcend Ultimate - flash memory card 16 GB CompactFlash Transcend CompactFlash TS16GCF1000 Flash Memory Cards
313,0,Red Filter,Gopro Mic Stand
314,0,Leica GEB212 Battery,Garmin Chest Mount Harness
315,0,NEEWER 160 LED CN-160 Dimmable Ultra High Power Panel Digital Camera / Camcorder Video Light,Veho VCC-005-MUVI-HDPRO Mini HD Body Camera/Action Camcorder
316,0,Sony Compact Camera with 50x Optical Zoom - DSC-HX400V,Sony Compact Camera with 20x Optical Zoom - DSC-WX350 (B)
317,0,Nilox Battery F 60 Evo,GoPro Mic Stand
318,1,Manfrotto Aluminium 4 Section Tripod,Manfrotto Aluminum Tripod
319,0,Fujifilm Instax Mini 8 Camera with Bag,David Yurman Sterling Silver Ring
320,0,SanDisk 64GB Extreme Pro Secure Digital Extended Capacity Flash Card,Sandisk Extreme CompactFlash Memory Card
321,0,Panasonic Digital Camera DMC-LC40S,Panasonic Digital Camera DMC-FX75S
322,1,SanDisk Extreme Pro 160MB/sec Compact Flash Card 64GB,SanDisk SDCFXPS-064G-X46-NR Compact Flash Card
323,0,Arlo Security System - 2 Wire-Free HD Cameras,Security Camera System with 4 Dome Infrared Cameras
324,0,Logitech HD Webcam C310-US,Logitech B525 2MP 1280 x 720Pixel USB 2.0 Nero webcam
325,0,Canon DSLR DCC-850,Canon Wide-angle camcorder lens WD-H58
326,1,Canon EOS BG-E14 Battery Grip,Used Canon BG-E14 Battery Grip for EOS 70D
327,0,Canon EF-S 55-250mm f/4-5.6 IS II L,Canon EF 70-200mm f/2.8L IS II USM
328,1,Gigaram CRY 64GB CF (Compact Flash) Card Hi Speed 533+,Gigaram SDCFXS-064G DES 64GB 50p CF 800x 150MB/s CompactFlash Card
329,1,Canon Digital 7D Body Only,Canon EOS 7D DSLR Camera
330,0,Buff FC Barcelona Polar 15/16 Smashinn,Dunlop Play Smashinn
331,0,E-Flite Sukhoi SU-29MM Gen 2 BNF Basic Bind-N-Fly Bind-N-Fly Airplane,SanDisk 128GB Ultra UHS-I Class 10 SDXC Memory Card
332,1,Manfrotto 055 Series 67 3-Section Carbon Fiber Tripod,Manfrotto MT055CXPRO3 Carbon Fiber Tripod
333,0,Sony Handycam HD Camcorder,Sony PAL/HDR-CX190 HD CAMCORDER
334,0,Fujifilm SDHC Memory Card,Transcend SDXC Class 10
335,0,Sigma 4.5mm f/2.8 EX DC Circular Fisheye HSM for Sony Alpha Digital SLR Camera,Sigma 120-400mm f/4.5-5.6 DG OS HSM APO Autofocus Lens for Sony Alpha
336,0,Nikon AF-S Nikkor 55-300mm f/4.5-5.6G ED VR DX Lens,Nikon 10-24mm f/3.5-4.5G ED AF-S DX Zoom-Nikkor Lens
337,1,Canon EF 2x III Extender,Canon Extender III
338,0,WIFI 900X Wireless Video Surveillance Transmitter,2-Megapixel Panoramic Wireless Cloud Camera DCS-6010L
339,0,GoPro HERO3+ Black Edition,GoPro Hero3 Silver
340,0,Transcend 4GB Class 10 SDHC Card Camera & Photo Accessories,Fujifilm 4 GB SDHC Class 10 Flash Memory Card Camera & Photo Accessories
341,0,Carrying Bag for Sony Cyber-shot DSC-T200 Camera - White,"Sony Cyber-shot Digital Camera RX100 II, 20.2MP, Black"
342,0,Canon DSLR EF 70-200mm F4 L USM Camera,Canon DSLR EF 17-40mm f/4 L USM Lens
343,1,Manfrotto Video Head MVH502AH Camera & Photo Accessories,Manfrotto Pro Video Head w/ Flat Base MVH502AH
344,0,Canon LP-E17 Rechargeable Battery Pack,Canon BP-828 Li-Ion Video Camcorder Batteries
345,0,GoPro Battery Charger,Canon Battery Charger CG-800
346,0,Garmin Montana Lithium-Ion Battery Pack,Earthwise CHL91302 Cordless Batteries
347,0,"Panasonic 8.1-Megapixel Digital Camera with 3.0 LCD, iA Technology, Silver DMC-FX55S",Panasonic 14.1 Megapixel Lumix Digital Camera DMC-FX700
348,1,Jumelle CONQUEST HD 10 x 42 Zeiss Conquest Hd X Zeiss - Le-Chasseur,Jumelle Conquest Hd 10 X 42 Zeiss CONQUEST HD x Zeiss - Promo-Optique
349,0,Ubiquiti Networks UVC-G3-DOME IP Interior y exterior Bullet D-Link Home Panoramic HD Camera DCS-8200LH 1280 x 720 Pixels Black,Foscam FI9901EP PoE 4MP Outdoor IP Camera Foscam Vesternet
350,0,Nikon Speedlight Flashgun,Nikon AF-S Nikkor 50mm f/1.8G Lens
351,0,GoPro Auto Charger,GoPro Hero3+ Dual System
352,0,GoPro Accessories Kit for GoPro Hero 5 4 3+ 3 2 1 Session Accessory Bundle Set Action Camera,Kupo Hex Stud Female 3/8-16 to 1/4-20 1/4-20 KG001012
353,0,Panasonic GH4 Body,Canon EOS 60D
354,0,GoPro Hero 3 Plus Housing,Lezyne 3-Way With 4/5 6 mm CRV Hex Bits
355,0,Sony USB Stereo Turntable,SONY ILCE6000LB Single Lens Reflex
356,0,Canon EF 2x III Extender,Canon EF 17-40mm f/4L USM
357,0,Sony XDCAM Super 35 Camera System,Panasonic Lumix Vario 12-35mm f/2.8 II Asph Power OIS
358,0,Sony E-mount 16-70mm f/4 Mirrorless Camera Lens,Philips PXG10 Tele Zoom Lens
359,0,Canon EF-S 55-250mm f/4-5.6 IS II Lens,Sigma Zoom Telephoto 70-300mm f/4-5.6 DG Macro Autofocus Lens
360,0,Canon DSLR EOS Rebel T5 Camera with EF-S 18-55mm f/3.5-5.6 IS Lens Kit,Canon DSLR EOS SL1/100D Camera with EF-S 18-55mm f/3.5-5.6 IS STM Lens
361,0,D-Link Wireless N 360° Home Network Camera DCS-6010L,D-Link DCS 7010L HD Mini Bullet Outdoor Network Camera
362,0,Canon PowerShot G7 X Mark II 20.1-Megapixel Digital Camera,Samsung SMART 20.3 Megapixel Black Digital Camera
363,0,Manfrotto Video Head,Veho Muvi Pro Micro DV Body Camera
364,0,SanDisk DSLR/HD Camcorder CF Compact Flash Memory Card 128GB LN65841,SanDisk 128GB Ultra UHS-I Class 10 SDXC Memory Card
365,1,Sony DSC-W800 20.1-Megapixel Digital Camera,Sony DSCW800/B 20.1 MP Digital Camera
366,0,Nikon Coolpix S800c 16-megapixel digital camera with 10X optical zoom and Wi-Fi,Panasonic DMC-FZ18K 8.1-Megapixel Digital Camera with 18x Optical Zoom
367,1,Gossamer Gear Gorilla 40 Ultraleicht Rucksack,WiFi-1 GB WiFi-1
368,0,Canon EF 40mm f/2.8 STM Pancake Lens Hood,Canon EOS Rebel SL1
369,0,Avermedia Vision U50 Document Camera,Sony AS30V High Definition POV Action Video Camera
370,0,SanDisk 32GB Extreme Pro CompactFlash Memory Card,SanDisk 64GB CompactFlash Card Extreme Pro
371,1,Logitech Webcam 2MP 1280 x 720Pixel USB 2.0 Nero,Logitech Photo Cameras Camera
372,0,14.1 Megapixel Lumix Digital Camera DMC-FX75K,Lumix 4 Megapixel Digital Camera DMC-FZ15K
373,0,Panasonic Battery for select digital cameras,GoPro BacPac
374,0,Canon EF 100mm f/2.8 Macro USM Lens,Canon EF 70-300mm f/4-5.6L IS USM Autofocus Telephoto Zoom Lens
375,0,Canon BG-E21 Battery Grip (6D Mark II) Canon 6D Mark II - Pictureline,Canon EOS 5D Mark IV Body Canon EOS Body | Canon Online Store
376,0,Panasonic LUMIX DMC-FZ70 16.1 MP 60X Zoom Digital Camera - Black,Panasonic 12.1 Megapixel Digital Camera DMC-FS15K
377,0,"Canon BP-2L14 Lithium-Ion Battery Pack (7.4v, 1450mAh) - for Canon Camcorder Batteries",Canon DCC-850
378,0,Sony Alpha a6000 Mirrorless Digital Camera with 16-50mm Power Zoom Lens-US,Sony ILCE A3000 Mount Type
379,0,Canon DSLR EOS 80D Camera with 18-135mm IS USM Lens Kit,Canon BG-E14 Battery grip for use with the EOS 70D
380,1,Sony Mirrorless 18-55mm Lens,Sony Alpha a3000 Kit with 18-55mm zoom lens
381,0,SanDisk Ultra SDXC Memory Card Class 10 - UHS-I Fast 80MB/s 128GB,Lexar micro SDHC/SDXC 64Gb x10 Liquidation Card
382,0,Go Pro Mounts,GoPro Headstrap Mount
383,1,SanDisk 32GB microSDHC Ultra Class 10 UHS-1 Micro Secure Digital Card,SanDisk 32GB microSDHC UHS-I Card with Adapter
384,0,SanDisk Extreme microSDHC 64Gb Type A1,Red Filter Goalinn Action Outdoor
385,1,Canon Battery Grip BG-E21 for EOS 6D Mark II,Canon BG-E21 Battery Grip for Eos 6D Mark II
386,0,D-Link Cámara de Seguridad HD WiFi Visión Nocturna,D-Link Outdoor Camera
387,1,Canon LP-E10 Rechargeable Battery,Canon LP-E10 Rechargeable battery for select cameras
388,1,Kupo Kupole Extension 6.6FT (2.0m) Lighting Accessories,Kupo Kupole Extension 6.6' Black KD200911 Filmtools
389,1,Sony 4K HD Video Recording FDRAX33 Handycam Camcorder,Sony FDR AX33
390,1,GoPro HERO3 Silver Edition Camera,GoPro Hero3 Silver
391,1,Panasonic Battery,Panasonic DMW-BCG10PP Battery
392,1,Sigma 70-300mm f/4-5.6 APO Macro Autofocus Lens for Nikon AF-D,Sigma 70-300mm F4.0-5.6 DG APO Macro (Nikon)
393,1,SanDisk Extreme Pro 32GB CompactFlash (CF) Memory Card,SanDisk SDCFXPS-032G-A46 ExtremePro160MB/150MB Memory & Storage
394,0,Worlds Largest HD Video Display,128GB SDXC Class 10 Flash Memory Card
395,0,Sony Cyber-shot WX80 (Black),Panasonic DMC-FZ18K 8.1-Megapixel Digital Camera with 18x Optical Zoom
396,0,Sony Handycam HDR-CX190 High Definition Camcorder (Black),Sony Handycam HDR-CX580V High Definition Camcorder (Black)
397,0,SanDisk 64 GB CF Extreme Pro 160MB/s,SanDisk Extreme Compact Flash 128GB
398,0,Canon 5L Li-Ion Camera Battery,Canon PowerShot G1 X
399,0,Canon PowerShot SX540 HS Camera 20.3MP 1/2.3 CMOS 5184 x 3888 Black Specifications Canon Black Digital Cameras (1067C002 4549292056426),Canon SX510 Black @es Camera Alkosto Store Online@es
400,0,Aluratek Hi-Resolution Digital Photo Frame 8in Frame 8in,Panasonic Lumix DMC-FX55 Silver
401,1,Sony Wireless remote for select Alpha digital cameras,Sony Wireless Remote for Alpha & NEX
402,0,D-Link Wireless Camera,D-Link HD Camera
403,0,Sony Cyber-shot DSC-RX100 III 20.1-megapixel compact digital camera with Wi-Fi,Sony 35mm f/1.8 Prime Lens for Most NEX E-Mount Cameras
404,0,D-Link DCS-6045LKT IP Interior Camera,D-Link Cloud Wireless N Panoramic/Inclination/Zoom Camera
405,1,D-Link Wi-Fi Panoramic Camera DCS-5000L,D-Link Wi-Fi Pan Tilt Day Night Camera DCS-5000L
406,0,Canon Battery Charger CG-800 - 2590B002 Digital Camera Accessories,Canon BG-E16 Camera Battery Grip
407,0,GoPro Hero3+ Alfa Edition Lens Replacement Kit,GoPro Dual Battery Charger
408,1,Manfrotto Quick Release Plate 785PL,Manfrotto Quick Release Plate 785PL
409,0,Transcend 32GB Compact Flash Card,Transcend 4GB Class 10 SDHC Card
410,1,GoPro Jaws Flex Clamp Mount,GoPro Jaws Flexible Clamp Action Camera Mount
411,0,Logitech Webcam C930e (960-000972),Logitech HD Webcam C310-US Accessories
412,0,Sony Hand Strap,Sony FE 24-70mm f/2.8 GM Standard Zoom Lens
413,0,GoPro Jaws Flex Clamp Mount,GoPro Surfboard Mounts
414,0,Sigma Circular Fisheye HSM (Nikon) - Prices,Sigma Ultra-Wide Zoom Lens f/Sony/Minolta Digital SLR
415,0,Suunto Spartan Ultra Titanium HR,Nilox Remote Control F60 Evo
416,0,Garmin GPS receiver battery - NiMH x 1 Garmin 1010178 Rechargeable Batteries,GoPro Hero 3 Rechargeable Battery
417,0,SanDisk Extreme Pro Compact Flash Card 64GB,SanDisk Extreme Pro SDXC UHSI Card 64GB
418,0,Sigma 24-70mm F2.8 EX DG HSM (Canon),Sigma 4.5mm F2.8 EX DC Circular Fisheye HSM (Nikon)
419,0,Sony 16-50mm f/3.5-5.6 Retractable Zoom Lens for Most NEX E-Mount Cameras,Tamron AF 18-270mm F/3.5-6.3 Di II VC PZD (Nikon Mount) Tamron Mount
420,1,Billingham 335 Camera Bag,Billingham Professional 335 Black - Billingham Camera Bag
421,0,Arlo Wire-Free Security System with 3 HD Cameras Arlo Camera VMS3330-100NAS,Wireless Camera System 4 WIFI IP Cameras 8ch Network Video Recorder Camera System
422,0,Foscam FI9901EP POE 4.0 Mpx P2P Camera,Netgear VMS3230-100EUS IP security camera Full HD Outdoor Vandal-Proof Dome
423,0,GoPro Suction Cup Mount,GoPro Battery for Hero 3
424,0,Vigilance Full HD Surveillance Starter Kit DNR16-4802-2,Full HD PoE Day/Night Network Camera DCS-2210L
425,0,Sigma 4.5mm f/2.8 EX DC HSM Lens for Sony Alpha SLR Cameras,Sigma 120-400mm f/4.5-5.6 DG OS HSM APO Autofocus Lens for Sony Alpha
426,0,GoPro Thumb Screw Wrench,GoPro Rechargeable Battery for HERO4 Cameras
427,1,Nikon 16-35mm f/4G ED VR,Nikon AF-S Nikkor 16-35mm f/4G ED VR Wide Angle Zoom Lens
428,1,GoPro Support for Tube,GoPro Support for Tube
429,0,Fujifilm 60mm f/2.4 XF R Macro Lens,Sigma 4.5mm F2.8 EX DC Circular Fisheye HSM (Nikon) - Prijzen
430,0,Transcend 64GB SDXC Class 10 Flash Memory Card Digital Camera Accessories,Transcend 64GB Ultimate SD SDXC Class 10 Memory Card
431,0,Panasonic Battery Pack VW-VBT190,Canon LP-E17 Rechargeable Battery Pack
432,1,MicroSD 16G,MicroSD 16G
433,0,GoPro Wall Charger Kit,Single Battery Charging Cradle Zebra ZQ110 Mobile Receipt Printer
434,0,WiFi-1 GB,StarTech.com 1:1 Drive Duplicator and Eraser for 2.5in / 3.5in SATA Drives StarTech.com Drives - SATDUP11 Disk Cleaners
435,0,Nikon D7100 DSLR Camera Body Only,Fujifilm X-T2 Mirrorless Camera Body
436,0,GoPro HERO3+ Black Edition Camera,Grab Bag of Mounts Go Pro Grab Mounts
437,0,Canon DSLR EOS 6D Body,Nikon DSLR D610 Body Only
438,0,Ubiquiti Networks UVC-G3-DOME IP Interior y exterior Bullet Camera DCS-8200LH 1280 x 720 Pixels Black,Vigilance Full HD Outdoor PoE Mini Bullet Camera DCS-4703E Vigilance Camera
439,1,Sigma 12-24mm f/4.5-5.6 DG HSM Wide Angle Zoom Lens for Nikon,Sigma 12-24mm F4.5-5.6 EX DG ASPH HSM (Nikon) Digital SLR Camera
440,1,Sigma 120-400mm f/4.5-5.6 DG OS HSM APO Autofocus Lens for Sony Alpha,Sigma 120-400mm f/4.5-5.6 DG APO O HSM Autofocus Zoom Lens for Sony
441,0,Canon EF 24-70mm Camera & Camcorder Lenses,Canon EF-S 10-22mm Ultrasonic Motor Ultra-wide-angle zoom lens
442,0,Microtech EPC-HD811AR2,Ubiquiti Networks UVC-G3-DOME IP Interior y exterior Bullet D-Link Home Panoramic HD Camera DCS-8200LH
443,0,D-Link Full HD Outdoor Vandal Proof PoE Dome Camera DCS-4602EV Full,D-Link Full HD PoE Day/Night Network Camera DCS-2210L Full
444,1,Panasonic Lumix DMC-FX55 Silver,Panasonic Lumix DMC-FX55 Silver
445,0,Sandisk 128GB SDHC UHS-I Ultra Secure Digital,Transcend 64GB SDXC UHS-I Class 10 Premium
446,0,Nikon D5200 Kit 24.1-megapixel digital SLR camera with 18-55mm zoom lens,Nikon D3200 Digital SLR Camera With AF-S DX NIKKOR 18-55mm 3.5-5.6G VR Lens
447,0,SanDisk Extreme 120MB/sec 800x Compact Flash Card 128GB,128GB CF Compact Flash Card 160MB/s 1000X
448,0,Nikon Trophy Hunter XP 223,Nikon D300s SLR Digital Camera
449,0,"PNY Elite Performance 512GB SDXC Class 10 UHS-I, U3 Up to 95MB/sec",Transcend 32 GB Class 10 SDHC Flash Memory Card
450,0,M-Lok Tripod Adapter,Manfrotto 190 Aluminium 4 Section Tripod - Black
451,0,Olympus M.ZUIKO DIGITAL ED 40-150mm f/2.8 PRO Lens,Canon EF 75-300mm f/4-5.6 III Telephoto Lens
452,0,GoPro Hero 3 Plus Housing,NetPower 6
453,0,"Panasonic 8.1-Megapixel Digital Camera with 2.5 LCD, iA Technology, Brown DMC-FX33T","Panasonic 8.1-Megapixel Digital Camera with 18x Optical Zoom, Silver DMC-FZ18S"
454,0,Oregon 548208 Chain Saw Accessories,Canon NB-5L Rechargeable Battery
455,0,Canon Angle Finder C with adapters EC-C & ED-C,Canon EOS 7D DSLR Camera
456,0,D-Link DCS-4701E HD Outdoor PoE Mini Bullet Camera,D-Link DCS-2132L HD Camera
457,0,Kodak Pixpro Sp360 4k Action Camera,Nikon Nikkor Af-s 28-300mm F3.5-5.6g Ed Vr Digital Slr Camera
458,0,Nikon AF 50mm f/1.8D,Nikon AF Nikkor 16mm Fisheye D
459,0,Sony Cyber-shot DSC-RX100 II Digital Camera,Canon EOS 6D Kit with a 24-105mm f/4L lens
460,0,Sigma 70-300mm f/4-5.6 APO Macro Autofocus Lens for Canon EOS Cameras,Canon EF 70-300mm f/4-5.6L IS USM Autofocus Telephoto Zoom Lens
461,0,Transcend SDXC 128gb Class 3 Uhs-I,Transcend SDXC 64GB Class 10
462,0,Sony FE 24-70mm f/2.8 GM Standard zoom lens for E-mount mirrorless cameras,Sony A7RII Body
463,1,GoPro Wall Charger,GoPro Wall Charger with USB 1 Amp fast charge per port
464,0,Canon Battery Grip voor EOS 6D mark II,Canon EOS 5D Mark IV Digital SLR Camera Body Only
465,0,Manfrotto Aluminum Tripod,VANGUARD Aluminium Tripod
466,0,Creative Live Cam Connect HD,Bushnell 8MP Trophy Cam HD Wireless Bruin
467,0,Action outdoor 3 Way Grip,Nilox Remote Control F60 Evo
468,1,Bogen Manfrotto 501 Quick Release Plate Long,Manfrotto 501PLONG Long Quick Release Plate
469,0,Nilox Head Strap Mount F60 Evo Goalinn,Suunto Spartan Ultra Titanium HR
470,0,14.1 Megapixel Camera Panasonic DMC-FH20V,12.1 Megapixel Digital Camera Panasonic DMC-FX48S
471,1,Canon EF 50mm f/1.8 II Camera Lens,Canon EF 50mm f/1.8 II
472,1,D-Link DCS-2332L Security Camera HD WiFi Night Vision,D-Link DCS-2332L Outdoor Camera
473,0,Canon ST-E3-RT Speedlite Transmitter,Canon EF 2x III Extender
474,0,Sony Alpha a6000 Mirrorless Digital Camera with 16-50mm Power Zoom Lens,Sony Alpha A7 w/ FE 28-70mm f3.5-5.6 OSS (ILCE7K/B) Aden Camera
475,0,Creative Live Cam Connect HD,Logitech C310 HD 720p 5 Megapixel Webcam
476,0,Hjc RPHA 11 Darter,Nilox Battery F 60 Evo
477,0,Transcend 16GB CompactFlash Card,Transcend 128GB CompactFlash Memory Card
478,0,Bushnell Trophy Cam HD Wireless,D-Link AC Day/Night HD Mini Bullet Cloud Camera
479,0,Nilox Head Strap Mount F 60 Evo,Nilox Battery F 60 Evo
480,0,Canon PowerShot G1 X,Canon PowerShot A2300
481,1,Canon DSLR EOS 5D Mark II Camera Body,Canon DSLR EOS 5D Mark II Digital SLR Camera Body
482,0,D-Link Outdoor HD Wireless Camera,D-Link DCS-2136L Wireless Day/Night Camera with Colour Night Vision
483,1,Sony Compact Camera DSCRX100,Sony Cyber-shot RX100 Black
484,0,Transcend 128GB SDXC UHS-3 Memory Card,Transcend 64 GB Class 10 SDXC Memory Card
485,0,Canon Electronic Viewfinder EVF-DC1,Fujifilm Passport / ID Photo Digital Camera LCD Head and Shoulders Indicator Miscellaneous Accessories
486,0,Transcend Camcorder Accessory Kit,Canon EOS Rebel T5 with 18-55mm Lens
487,0,Gigaram SDCFXS-064G DES 64GB 50p CF 800x 150MB/s CompactFlash Card Sandisk Extreme,SanDisk Extreme 64GB Compact Flash Card
488,0,Sony Cyber-shot DSC-WX350 Digital Camera,Sony DSCW800 20.1 MP Digital Camera
489,0,Leica GEB111-us Teodoliti Battery Total Station,Canon BG-E21 Battery Grip voor EOS 6D mark II
490,0,Sigma Circular Fisheye HSM (Sony),Sigma 10-20mm f/3.5 HSM Canon DC
491,0,Aluratek 7 Digital Photo Frame Camera Accessories,Panasonic Lumix FZ200 12.1 Megapixel Digital Camera
492,0,Distance RC-6 Camera,Canon RS 60E3 - camera remote control Series
493,1,David Yurman Sterling & 14K Gold Noblesse Ring Sz 6.5,Fujifilm Instax Mini 8 Camera
494,0,Sony Alpha A7 (Body Only) Digital SLR Camera,Nikon D5100 Digital SLR Camera With 18-55mm VR Lens
495,1,D-Link Camera,D-Link Camera
496,1,GoPro Hero3+ Alcak-302 Suction Cup Mount AUCMT-302,GoPro Suction Cup Mount AUCMT-302
497,0,NetBotz Room Monitor 355,Arlo Smart Home Black UV Resistant Silicone Skins Pack for Wireless CCTV HD Security Camera
498,1,Canon DSLR EOS 5D Mark IV Camera Body Only,Canon EOS 5D Mark IV Body
499,1,Dsk NetPower 6 Motardinn,Dsk NetPower 6 Smashinn
500,0,Canon Wireless Remote Controller for Canon Digital SLR Cameras,Sony Wireless Remote for Alpha & NEX Cameras
501,0,Netgear Arlo VMA1000,Netgear Replaceable Black Silicone Skins
502,0,D-Link Wi-Fi Pan Tilt Day Night Camera DCS-5000L,D-Link Outdoor HD PoE Day/Night Fixed Mini Bullet Cloud Camera DCS-7010L
503,0,Wireless AC Day/Night Color Surveillance Camera,Cloud Wireless N Day/Night Security Camera
504,0,MicroSDHC UHS-I U3,Transcend Ultimate Micro Sec
505,0,Women's Metallic Classic Logo Disc Studs,32GB SDHC UHS-I SPEED CLASS 3 FLASH CARD
506,0,GoPro Hero3 Silver,Fujifilm X-T20 Body with XF 18-55mm Lens Kit (Silver)
507,0,Nikon D5100 Digital SLR Camera With 18-55mm VR Lens,Canon EOS Rebel SL1 Kit with 18-megapixel digital SLR camera and 18-55mm STM zoom lens
508,1,SanDisk Extreme Pro SDXC UHS-I 64GB,SanDisk Extreme Pro SDXC 95MB/sec UHSI Card 64GB UHS-I
509,0,Fujifilm Fujinon XF 60mm F2.4 R Macro,Fujifilm XF 55-200mm f/3.5-4.8 R LM OIS Lens
510,1,Angle Finder C (Includes ED-C & ED-D Adapters for All SLR Cameras),Canon Right Angle Finder C (Includes ED-C and ED-D Adapters for All SLR Camera Digital Camera Viewfinder Attachment Accessories | Unique Photo)
511,0,Canon EF 24-70mm f/2.8L II USM Lens,Canon EF 24-70mm f/2.8L II USM Lens
512,0,Nilox Remote Control F60 Evo,Dsk NetPower 6
513,1,NetBotz Room Monitor 355 with 120/240V PoE Injector,NetBotz Room Monitor 355 with 120/240V PoE Injector
514,1,Fujifilm Instax Mini 9 Polaroid Camera,Users Make Brands Take Magnet Adam Harvey
515,0,Sony AS30V High Definition POV Action Video Camera,GoPro HERO+ LCD HD Video Recording Camera
516,0,D-Link Outdoor Camera DCS-7010L,D-Link Wireless Camera DCS-5020L
517,0,Gateway MX6000 6-Cell Li-Ion Battery,Panasonic DMW-BCG10 Battery
518,0,Users Make Brands Take Magnet Adam Harvey,Fujifilm Instax Mini 8 Camera
519,1,Sony Cyber-shot Digital Camera RX100 II 20.2MP Black,Sony Cyber-shot DSC-RX100 II Large-sensor 20.2-megapixel compact digital camera with Wi-Fi
520,0,Transcend 32GB Secure Digital High-Capacity SD Class 10 Memory Card,Transcend 64GB SDXC Class 10 Flash Memory Card
521,1,Panasonic Lumix TS20 16.1 Megapixel Digital Camera DMC-TS20A,Panasonic Lumix TS20 Blue
522,0,GoPro Wi-Fi Remote,Camera IP Wi-fi hồng ngoại không dây WTC IP9506
523,0,Canon EF Macro Lens,Canon EF 70-200mm f/4L USM
524,1,SanDisk Ultra 200GB Micro SDXC Memory Card,Worlds Largest HD Video Display
525,0,Sony Compact Camera DSCRX100,Nikon SB-300 Speedlight Flashgun
526,0,Kupo Hex Stud with 3/8 Inch to 16 Feet and 1/4 -20 Feet Lighting Accessories,Westcott 36 Inch Rapid Box Octa XL with Profoto Speedring Lighting Accessories
527,1,DOLICA Aluminum Alloy Proline Tripod,Dolica AX680P104 68-Inch Proline Tripod and Pan Head
528,1,Canon EOS 1300D 18MP +18-55 EF-S IS,Canon EOS 1300D + EF-S 18-55 IS II SLR Camera Kit
529,0,Canon EOS 7D 18-megapixel digital SLR camera body with HD video mode,Canon EOS Rebel T5i 8595B005 Digital Cameras
530,1,D-Link Full HD Outdoor Mini Dome Camera DCS-4802E,D-Link Full HD Outdoor Mini Dome Camera DCS-4802E
531,0,D-Link PowerLine HD Day Night Cloud Camera Kit,D-Link DCS-855L/P IP security camera
532,1,Metabones Canon EF to E Mount T Speed Booster ULTRA 0.71x LN78442,Metabones Canon EF Lens to Sony E Mount T Speed Booster ULTRA 0.71x
533,0,Canon Angle Finder C with adapters EC-C & ED-C,Canon Digital 7D Body Only
534,0,Logitech B525 2MP 1280 x 720Pixel USB 2.0 Webcam,Logitech C615 HD Webcam
535,0,Panasonic Full HD Camcorder HDC-HS60K,Panasonic 12.1 Megapixel Digital Camera DMC-FS15K
536,0,Canon DSLR EOS 80D Camera with 18-135mm IS USM Lens Kit,Canon DSLR EOS Rebel T5i/700D Camera with EF-S 18-55mm f/3.5-5.6 IS STM Lens
537,1,Creative Live! Cam Connect HD,WEBCAM CREATIVE LIVE! CAM CONNECT HD
538,0,D-Link Full HD WDR Varifocal Day & Night Outdoor Smoked Dome Network Camera DCS-6314BS,D-Link HD Wireless N Day/Night Outdoor Cloud Camera DCS-2330L
539,0,Sawyer Dress,1080p AHD Security Camera System 4 HD Cameras DVR Remote View Apps System
540,0,Manfrotto Long Quick Release Plate,Canon ZSG-C10 Zoom Grip for COMPACT-SERVO Lens
