id,label,left_title,right_title
297,0,D-Link DCS-5030L Network Surveillance Camera,D-Link DCS-6045LKT Day/Night Cloud Camera Kit
298,0,Fujifilm WCL-X100S Wide Conversion Lens Silver,Canon EF 24-70mm f/4L IS USM Zoom Lens
299,0,D-Link DCS-2136L Wireless Vision Camera,D-Link DCS-2332L Outdoor Camera
300,0,Aluratek Digital Photo Frame,Olympus M.Zuiko Digital ED 40-150mm f/2.8 PRO Lens
301,0,Manfrotto Aluminum 3 Section Tripod Kit w/ Ball Head,Manfrotto Carbon Fiber Tripod MT055CXPRO3
302,1,Sigma 15mm f/2.8 EX DG Diagonal Fisheye Autofocus Lens for Pentax AF,Sigma 15mm F2.8 EX DG Diagonal Fisheye (Pentax)
303,0,Bushnell Wireless Bruin,D-Link DCS-2230L
304,0,8GB SDHC Class 10,Transcend Ultimate series - flash memory card 128 GB SDXC UHS-I
305,0,"Giottos Aegis LCD Screen Protector F Nikon 1 V1, V2, J1 Mirrorless Cameras SP83022 Misc Accessories",Canon EF 85mm f/1.8 USM Medium Telephoto Lens for SLR Cameras Canon Cameras Prices
306,1,D-Link DCS-6010L 2-Megapixel Panoramic Wireless Cloud Camera,D-Link DCS-6010L Caméra mydlink Cloud Fisheye 360°
307,0,Canon HFM-500,Canon Speedlite 600EX RT
308,0,"Panasonic Lumix DMC-FX33A 8.1MP Digital Camera with 2.5"" LCD and iA Technology (Blue)","Panasonic Lumix DMC-FX55S 8.1MP Digital Camera with 3.0"" LCD and iA Technology (Silver)"
309,0,Sony Cyber-shot RX10 II,Sigma 70-300mm f/4-5.6 APO DG Macro Autofocus Lens
310,0,Action Outdoor Suction Cup with Plate,GoPro Mic Stand
311,1,Ksix Selfie LED Flash With 3.5mm Jack For Smartphones,Ksix Selfie LED Flash With 3.5mm Jack For Smartphones
312,0,Sandisk Extreme Pro CF Memory Card 160MB/s UDMA 7 - 16GB,Transcend Ultimate CompactFlash Flash Memory Card 16 GB
313,0,Action Outdoor Red Filter,GoPro Mic Stand
314,0,,
315,0,NEEWER CN-160 LED Dimmable Ultra High Power Panel Digital Camera Light,Veho MUVI-HDPRO Mini HD Body Camera
316,0,Sony Compact Camera HX400V 50x Optical Zoom,Sony Compact Camera WX350 20x Optical Zoom
317,0,Nilox Battery F60 Evo,GoPro Mic Stand Out
318,1,Manfrotto Aluminum 4 Section Tripod MT190XPRO4,Manfrotto Aluminum Tripod MT190XPRO4
319,0,Fujifilm Instax Mini 8 Pink Camera with 3 Packs of Film and Bag,David Yurman Sterling & 14K Gold Noblesse Ring Size 6.5
320,0,Sandisk Extreme CompactFlash Memory Card - 64 GB,SanDisk 64GB Extreme Pro Secure Digital Extended Capacity (SDXC) Flash Card
321,0,Panasonic Lumix Digital Camera DMC-LC40S,Panasonic Lumix Digital Camera DMC-FX75S
322,1,SanDisk Extreme Pro 160MB/sec Compact Flash Card 64GB,SDCFXPS-064G-X46
323,0,Arlo Security System Wire-Free HD Camera Indoor/Outdoor Night Vision,Security Camera System Dome Infrared Internet DVR
324,0,Logitech HD Webcam C310-US Accessories,Logitech B525 2MP USB 2.0 Nero webcam
325,0,Canon DCC-850,Canon Wide-angle Camcorder Lens
326,1,Canon EOS BG-E14 Battery Grip 70D/80D,Used Canon BG-E14 Battery Grip for EOS 70D
327,0,Canon EF-S Mount 55-250mm f/4-5.6 IS II,Canon EF 70-200mm f/2.8L IS II USM
328,1,Gigaram CF 64GB,Sandisk Extreme SDCFXS-064G
329,1,Canon DSLR 7D Body Only,Used Canon EOS 7D 18MP DSLR Camera
330,0,Buff FC Barcelona Polar 15/16,Dunlop Play
331,0,E-Flite Sukhoi SU-29MM Gen 2 BNF Basic Bind-N-Fly Airplane,SanDisk 128GB Ultra UHS-I Class 10 SDXC Memory Card
332,1,Manfrotto Carbon Fiber Tripod 055 Series 67 3-Section,Manfrotto Carbon Fiber Tripod MT055CXPRO3
333,0,Sony Handycam HDR-CX110 HD Camcorder,Sony PAL/HDR-CX190 HD Camcorder
334,0,Fujifilm SDHC Memory Card 4GB Speed Class 10,Transcend SDXC Class 10 128GB
335,0,Sigma 4.5mm f/2.8 EX DC Circular Fisheye HSM (Sony Alpha),Sigma 120-400mm f/4.5-5.6 DG OS HSM APO Autofocus Lens for Sony Alpha
336,0,Nikon DX 55-300mm f/4.5-5.6G ED VR Lens,Nikon DX 10-24mm f/3.5-4.5G ED AF-S Zoom-Nikkor Lens
337,1,Canon EF 2x III Extender,Extender EF 2x III
338,0,WIFI 900XTRP Wireless Video Surveillance Transmitter,D-Link DCS-6010L 2-Megapixel Panoramic Wireless Cloud Camera
339,0,GoPro Hero3+ Black Edition,GoPro Hero3 Silver
340,0,Transcend 4GB Class 10 SDHC Card TS4GSDHC10 Camera Accessory,Fujifilm 4 GB SDHC Class 10 Flash Memory Card Camera Accessory
341,0,Sony Cyber-shot DSC-T200 Camera Carrying Bag - White,Sony Cyber-shot Digital Camera RX100 II 20MP Black
342,0,Canon EF 70-200mm F4 L USM Lens,Canon EF 17-40mm f/4L USM Lens
343,1,Manfrotto Video Head MVH502AH,Manfrotto Video Head MVH502AH
344,0,Canon LP-E17 Rechargeable Battery Pack,Canon BP-828 Li-Ion Video Camcorder Batteries
345,0,GoPro Battery Charger,Canon Battery Charger CG-800
346,0,Garmin Montana Lithium-Ion Battery Pack,Earthwise CHL91302 Cordless Batteries
347,0,Panasonic Lumix DMC-FX55S Digital Camera with 3.0 LCD and iA Technology,Panasonic Lumix DMC-FX700 Digital Camera
348,1,Jumelle Conquest HD 10x42 Zeiss,Jumelle Conquest HD 10 X 42 Zeiss
349,0,Ubiquiti Networks UVC-G3-DOME IP Interior Exterior Bullet Camera,Foscam FI9901EP PoE Outdoor IP Camera
350,0,Nikon Speedlight SB-300 Flash,Nikon AF-S Nikkor 50mm f/1.8G Lens
351,0,GoPro Auto Charger Pack,GoPro Dual Hero System
352,0,GoPro Hero5 4 3+ 3 2 1 Session Accessory Bundle Set,Kupo Hex Stud Female 3/8-16 to 1/4-20 1/4-20
353,0,Panasonic GH4 Body,Canon EOS 60D
354,0,GoPro Hero3 Plus,Lezyne Hex Bit Set
355,0,Sony USB Stereo Turntable Black,SONY ILCE6000LB Camera
356,0,Canon EF 2x III Extender Accessories,Canon EF 17-40mm f/4L USM Wide-Angle Zoom Lens
357,0,Sony FS7M2 XDCAM Super 35 Camera System,Panasonic Lumix GX Vario 12-35mm f/2.8 II Asph Power OIS
358,0,Sony E 16-70mm f/4 ZOOM LENS,Philips Tele Zoom Lens
359,0,Canon EF-S 55-250mm f/4-5.6 IS II,Sigma 70-300mm f/4-5.6 DG Macro
360,0,Canon DSLR EOS Rebel T5 Digital Camera EF-S 18-55mm f/3.5-5.6 IS Lens Kit,Canon DSLR SL1/100D Digital Camera EF-S 18-55mm f/3.5-5.6 STM Lens
361,0,D-Link DCS-6010L Wireless Camera,D-Link DCS 7010L HD Mini Bullet Outdoor Network Camera
362,0,Canon PowerShot G7 X Mark II 20.1-Megapixel Digital Camera,Samsung SMART 20.3 Megapixel Black Digital Camera
363,0,Manfrotto MVH502AH Bridging Technology Video Head,Veho Muvi Pro Micro DV Body Camera/Action Camcorder
364,0,SanDisk DSLR/HD Camcorder CF Compact Flash Memory Card 128GB,SanDisk 128GB Ultra UHS-I Class 10 SDXC Memory Card
365,1,Sony DSLR DSC-W800 20.1MP Digital Camera Black,Sony DSLR DSCW800/B 20.1MP Digital Camera (Black)
366,0,Nikon Coolpix S800c 16MP Digital Camera with 10x Optical Zoom and Wi-Fi,Panasonic Lumix DMC-FZ18K 8.1MP Digital Camera with 18x Optical Zoom
367,1,Gossamer Gear Gorilla 40 Ultralight Rucksack,WiFi-1™ GB WiFi-1™
368,0,Canon EF 40mm f/2.8 STM Pancake Lens Hood,Canon EOS Rebel SL1 Camera
369,0,Avermedia Visionu50 Document Camera,Sony Hdr-As30v Action Video Camera
370,0,SanDisk Extreme Pro CompactFlash Memory Card 32GB,SanDisk Extreme Pro CompactFlash Card 64GB
371,1,Logitech Webcam B525 2MP HD 720p USB 2.0,Logitech Photo Cameras Camera
372,0,Panasonic Lumix DMC-FX75K Digital Camera,Panasonic Lumix DMC-FZ15K Digital Camera
373,0,Panasonic DMW-BCG10PP Battery,GoPro Battery BacPac
374,0,Canon EF 100mm f/2.8 Macro USM Lens,Canon EF 70-300mm f/4-5.6L IS USM Telephoto Zoom Lens
375,0,Canon Battery Grip EF Mount 6D Mark II,Canon DSLR EOS 5D Mark IV Body
376,0,Panasonic Lumix DMC-FZ70 16.1 MP 60X Zoom Digital Camera - Black,Panasonic DMC-FS15K 12.1 Megapixel Digital Camera
377,0,"Canon BP-2L14 Lithium-Ion Battery Pack (7.4v, 1450mAh)",Canon DCC-850
378,0,Sony Alpha a6000 Mirrorless Digital Camera with 16-50mm Power Zoom Lens,Sony ILCE A3000 Body
379,0,Canon DSLR EOS 80D Body,Canon Battery Grip BG-E14
380,1,Sony Mirrorless Digital Camera A3000 with 18-55mm Lens,Sony Mirrorless Digital Camera Alpha a3000 Kit with 18-55mm Zoom Lens
381,0,Sandisk Ultra SDXC SD Memory Card Class 10 UHS-I Fast 80MB/s 128GB,Lexar MicroSDHC/SDXC 64GB
382,0,GoPro Grab Mounts,GoPro Headstrap Mount
383,1,SanDisk Ultra 32GB microSDHC UHS-I Card with Adapter,SanDisk Ultra 32GB microSDHC UHS-I Card with Adapter
384,0,Sandisk Extreme microSDHC 64Gb Type 10,Action outdoor Red Filter
385,1,Canon Battery Grip BG-E21 for EOS 6D Mark II,CANON Battery Grip BG-E21 for EOS 6D Mark II
386,0,D-Link DCS-2332L Security Camera HD WiFi Night Vision,Outdoor HD PoE Day/Night Mini Bullet Cloud Camera
387,1,Canon LP-E10 Battery,Canon LP-E10 Rechargeable battery
388,1,Kupo Kupole Extension 6.6FT Black Lighting Accessories,Kupo Kupole Extension 6.6' Black Filmtools
389,1,Sony FDRAX33 Handycam Camcorder,Sony FDR AX33
390,1,GoPro Hero3 Silver Edition Camera,GoPro Hero3 Silver Camera
391,1,Panasonic Battery DMW-BCG10,Panasonic DMW-BCG10PP Battery
392,1,Sigma 70-300mm f/4-5.6 APO Macro Autofocus Lens for Nikon AF-D,Sigma 70-300mm F4.0-5.6 DG APO Macro (Nikon)
393,1,SanDisk Extreme Pro 32GB CompactFlash (CF) Memory Card,SanDisk ExtremePro160MB/150MB Memory & Storage
394,0,Worlds Largest HD Video Display,Transcend 128GB SDXC Class 10 Flash Memory Card Up to 30MB/s
395,0,Sony Cyber-shot WX80 Black,Panasonic DMC-FZ18K Digital Camera 18x Optical Zoom
396,0,Sony Handycam HDR-CX190,Sony Handycam HDR-CX580V
397,0,SanDisk Extreme Compact Flash 64GB,SanDisk Extreme Compact Flash 128GB
398,0,Canon Li-Ion Battery 1135B001,Canon PowerShot G1 X
399,0,Canon PowerShot SX540 HS,CANON SX510 Negra
400,0,Aluratek Hi-Resolution Digital Photo Frame,Panasonic Lumix DMC-FX55 Silver
401,1,Sony Wireless Remote RMT-DSLR2,Sony Wireless Remote RMTDSLR2
402,0,Cloud 2-Megapixel Fisheye Wireless Camera,HD Wireless Cloud Camera
403,0,Sony Cyber-shot DSC-RX100 III 20.1MP Compact Digital Camera with Wi-Fi,Sony FE 35mm f/1.8 Prime Lens for NEX E-Mount Cameras
404,0,D-Link DCS-6045LKT IP Interior Camera,D-Link Cloud Wireless N Panoramic/ Tilt/ Zoom Caméra
405,1,D-Link DCS-5000L Wi-Fi Panoramic Day Night Camera,D-Link DCS-5000L Wi-Fi Pan Tilt Day Night Camera
406,0,Canon Battery Charger CG-800,Canon BG-E16 Camera Grip
407,0,Alfa 28cm Lens Replacement Kit Gopro Alnrk301 Oalnrk_301 Camera Tether Atbkt005 Atbkt_005 GoPro Accessory Awrmk-001 Antifog Inserts Ahdaf301 Jata Set Utensilios Cocina Ac7 Nylon 8 Piezas Kit Tapas Protectoras Hero 3+ Alcak-302 Accesorio Atswr-301 Side Mount Ahedm001 Oahedm_101 Recambio Bolsa Plástico R28x6,GoPro Dual Battery Charger
408,1,Manfrotto Quick Release Plate 785PL,Manfrotto Quick Release Plate 785PL
409,0,Transcend 32GB Compact Flash Card,Transcend 4GB Class 10 SDHC Card
410,1,GoPro Jaws Flex Clamp Mount,GoPro Jaws Flexible Clamp Action Camera Mount
411,0,Logitech C930e,Logitech HD Webcam C310
412,0,Sony Hand Strap STP-GB1AM,Sony FE 24-70mm f/2.8 GM Standard Zoom Lens
413,0,GoPro Jaws Flex Clamp Mount,GoPro Surfboard Mount
414,0,Sigma 4.5mm F2.8 EX DC Circular Fisheye HSM Nikon,Sigma 8-16mm F4.5-5.6 DC HSM Ultra-Wide Zoom Lens Sony/Minolta
415,0,Suunto Spartan Ultra Titanium,Nilox Remote Control F60
416,0,Garmin NiMH Battery,GoPro Hero3 Battery
417,0,SanDisk Extreme Pro 160MB/sec Compact Flash Card 64GB,SanDisk Extreme Pro SDXC 95MB/sec UHS-I Card 64GB
418,0,Sigma 24-70mm f/2.8 EX DG HSM (Canon),Sigma 4.5mm f/2.8 EX DC Circular Fisheye HSM (Nikon)
419,0,Sony E-Mount 16-50mm f/3.5-5.6 Retractable Zoom Lens,Tamron Di II VC PZD 18-270mm F/3.5-6.3 Nikon Mount
420,1,335 Camera Bag Black,Billingham Professional 335 Black
421,0,Arlo Wire-Free Security System with 3 HD Cameras,Wireless Camera System
422,0,Foscam FI9901EP IP Camera 4MP P2P,Netgear VMS3230 POE Dome Camera
423,0,GoPro Suction Cup Mount AUCMT-302,GoPro Battery Recargable
424,0,Vigilance Full HD Surveillance Starter Kit,D-Link DCS-2210L Full HD PoE Day/Night Network Camera
425,0,Sigma 4.5mm f/2.8 EX DC HSM Lens for Sony Alpha SLR Cameras,Sigma 120-400mm f/4.5-5.6 DG OS HSM APO Autofocus Lens for Sony Alpha
426,0,GoPro Thumb Screw Wrench ATSWR-301,GoPro Rechargeable Battery AHDBT-401
427,1,Nikon AF-S 16-35mm f/4G ED VR,Nikon AF-S Nikkor 16-35mm f/4G ED VR
428,1,GoPro Support Tube,GoPro Support Tube
429,0,Fujifilm 60mm f/2.4 XF R Macro Lens,Sigma 4.5mm F2.8 EX DC Circular Fisheye HSM Nikon
430,0,Transcend 64GB SDXC Class 10 Flash Memory Card Up to 30MB/s,Transcend Ultimate SD SDXC Class 10 Memory Card TS64GSDXC10
431,0,Panasonic VW-VBT190 Battery Pack,Canon LP-E17 Rechargeable Battery
432,1,MicroSD 16G,MicroSD 16G
433,0,GoPro Wall Charger Kit,Zebra ZQ110 Mobile Receipt Printer
434,0,WiFi-1™ GB WiFi-1™,StarTech.com 1:1 Drive Duplicator and Eraser for 2.5in / 3.5in SATA Drives
435,0,Nikon DSLR D7100 Body Only,Fujifilm Mirrorless X-T2 Body Only
436,0,GoPro Hero3+ Black Edition Camera,Grab Bag of Mounts Go Pro Grab Mounts
437,0,Canon DSLR EOS 6D Body,Nikon DSLR D610 Body
438,0,Ubiquiti Networks UVC-G3-DOME IP Interior Exterior Bullet Camera,Vigilance Full HD Outdoor PoE Mini Bullet Camera
439,1,Sigma 12-24mm f/4.5-5.6 EX DG Aspherical HSM Wide Angle Autofocus Zoom for Nikon,Sigma 12-24mm F4.5-5.6 EX DG ASPH HSM (Nikon)
440,1,Sigma 120-400mm f/4.5-5.6 DG OS HSM APO Autofocus Lens for Sony Alpha,Sigma 120-400mm f/4.5-5.6 DG APO O HSM Autofocus Zoom Lens for Sony
441,0,Canon EF 24-70mm Zoom Lens,Canon EF-S Mount 10-22mm USM Ultra-wide-angle zoom lens
442,0,Microtech EPC-HD811AR2,Ubiquiti Networks UVC-G3-DOME IP Bullet Camera
443,0,D-Link DCS-4602EV Full HD Outdoor Vandal Proof PoE Dome Camera,D-Link DCS-2210L Full HD PoE Day/Night Network Camera
444,1,Panasonic Lumix DMC-FX55 Silver,Panasonic Lumix DMC-FX55 Silver
445,0,Sandisk 128GB 9p SDHC 40MB/s 266x Class 10 UHS-I Ultra Secure Digital High Capac,Transcend 64GB SDXC UHS-I Class 10 300X Premium Adapter
446,0,Nikon DSLR D5200 Kit with 18-55mm,Nikon DSLR D3200 with AF-S DX NIKKOR 18-55mm VR
447,0,SanDisk Extreme 120MB/sec 800x Compact Flash Card 128GB,128GB CF Compact Flash Card 160MB/s 1000X
448,0,Savage 19676 11 Trophy Hunter XP 223 Nikon,Nikon D300s SLR Digital Camera Body Only
449,0,"PNY Elite Performance 512GB SDXC Class 10 UHS-I, U3 Up to 95MB/sec",Transcend 32 GB Class 10 SDHC Flash Memory Card
450,0,M-Lok Tripod Adapter,Manfrotto Aluminium 4 Section Tripod Black MT190XPRO4
451,0,Olympus M.ZUIKO DIGITAL ED 40-150mm f/2.8 PRO Lens,Canon EF 75-300mm f/4-56 III Telephoto Lens
452,0,10bar Hero 3 Plus Housing,DSK NetPower 6
453,0,Panasonic Digital Camera 8.1MP DMC-FX33T Brown,Panasonic Digital Camera 8.1MP DMC-FZ18S Silver
454,0,Oregon 548208 Chain Saw Accessories,Canon NB-5L Rechargeable Battery
455,0,Canon Angle Finder C with adapters EC-C & ED-C,Canon EOS 7D DSLR Camera
456,0,D-Link DCS-4701E HD Outdoor PoE Mini Bullet Camera,HD Wireless Cloud Camera
457,0,Kodak PIXPRO SP360 4K Action Camera,Nikkor AF-S 28-300mm f/3.5-5.6G ED VR Lens
458,0,Nikon AF 50mm f/1.8D,Nikon AF Nikkor 16mm f/2.8 Fisheye D
459,0,Sony Cyber-shot DSC-RX100 II Digital Camera,Canon EOS 6D Kit with 24-105mm f/4L lens
460,0,Sigma 70-300mm f/4-5.6 APO Macro Autofocus Lens for Canon EOS Cameras,Canon EF 70-300mm f/4-5.6L IS USM Telephoto Zoom Lens
461,0,Transcend 128GB SDXC Class 3 UHS-I U3,Transcend SDXC 64GB Class 10
462,0,Sony FE 24-70mm f/2.8 GM Standard zoom lens,Sony A7RII Body
463,1,GoPro Wall Charger,GoPro Wall Charger
464,0,Canon BG-E21 Battery Grip for EOS 6D Mark II,Canon DSLR EOS 5D Mark IV
465,0,Manfrotto Aluminum Tripod MT190XPRO4,Vanguard Alta Pro 263AT Aluminum Tripod
466,0,Creative Live! Cam Connect HD,Bushnell Trophy Cam HD Wireless Bruin
467,0,Action Outdoor 3 Way Grip Arm,Nilox Remote Control F60 Evo
468,1,Bogen Manfrotto 501 Quick Release Plate Long Long 501PLONG,Manfrotto 501PLONG Long Quick Release Plate
469,0,Nilox Head Strap Mount F 60 Evo,Suunto Spartan Ultra Titanium
470,0,Panasonic DMC-FH20V 14.1 Megapixel Camera,Panasonic DMC-FX48S Digital Camera
471,1,Canon EF 50mm f/1.8 II,EF 50mm f/1.8 II Canon EF
472,1,D-Link DCS-2332L Camera Security HD WiFi Night Vision,Outdoor HD Wireless Day/Night Cloud Camera
473,0,Canon ST-E3-RT Speedlite Transmitter,Canon EF 2x III Extender
474,0,Sony Alpha a6000 Mirrorless Digital Camera with 16-50mm Power Zoom Lens,Sony Alpha A7 Mirrorless Digital Camera with FE 28-70mm f3.5-5.6 OSS
475,0,Creative Live! Cam Connect HD,Logitech C310 HD 720p 5 Megapixel Webcam
476,0,Hjc RPHA 11 Darter,Nilox Battery F60 Evo
477,0,Transcend TS16GCF400 16GB 50p CF 60MB/s 400x CompactFlash Card,Transcend TS128GCF1000 128GB 1000x CompactFlash Memory Card
478,0,Bushnell Trophy Cam HD Wireless Brown,D-Link Cloud Camera
479,0,Nilox Head Strap Mount F 60 Evo,Nilox Battery F 60 Evo
480,0,Canon PowerShot G1 X,Canon PowerShot A2300
481,1,Canon DSLR EOS 5D Mark II Body Only,Canon DSLR EOS 5D Mark II Body
482,0,D-Link DCS-2136L Wireless Day/Night Camera with Colour Night Vision,D-Link DCS-2136L Wireless Day/Night Camera with Colour Night Vision
483,1,Sony Compact RX100,Sony Cyber-shot RX100
484,0,Transcend 128GB SDXC UHS-3 Memory Card,Transcend SDXC 64GB Class 10
485,0,Canon Electronic Viewfinder EVF-DC1,Fujifilm Passport ID Photo Digital Camera
486,0,Transcend TS-DBK1 Accessory Kit,Canon DSLR EOS Rebel T5 with 18-55mm Lens
487,0,Sandisk Extreme 64GB CompactFlash Card,SanDisk Extreme 64GB CF
488,0,Sony Cyber-shot DSC-WX350 Digital Camera,Sony DSLR DSCW800/B 20MP Digital Camera
489,0,Battery For Leica GEB111-us,Canon Battery Grip EOS 6D
490,0,Sigma 4.5mm F2.8 EX DC Circular Fisheye HSM (Sony),Sigma 10-20mm f/3.5 HSM Canon DC
491,0,Aluratek Frame ADPF07SF,Panasonic Lumix FZ200
492,0,DISPARADOR AUTOMATICO A DISTANCIA RC-6 CÁMARAS,Canon RS 60E3 Remote Control
493,1,David Yurman Sterling & 14K Gold Noblesse Ring Sz 6.5,Fujifilm Instax Mini 8 Camera
494,0,Sony Alpha A7 Body Only,Nikon D5100 Digital SLR Camera With 18-55mm VR Lens
495,1,D-Link España PTZ WiFi Camera,D-Link France HD Panoramic Camera
496,1,"GoPro Accessory Kit with WiFi Remote, Lens Replacement ALNRK301, Camera Tether ATBKT005, Antifog Inserts AHDAF301, Jata Set Utensilios Cocina AC7 Nylon 8 Piezas, Tapa Protectoras HERO3+ ALCAK-302, Suction Cup Mount AUCMT-302, Recambio Bolsa Plástico R28x6",GoPro Suction Cup Mount AUCMT-302
497,0,Netbotz Room Monitor 355,Arlo Smart Home Silicone Skins Pack for Wireless CCTV HD Security Camera
498,1,Canon DSLR EOS 5D Mark IV Body,Canon DSLR EOS 5D Mark IV Body
499,1,Dsk NetPower 6,Dsk NetPower 6
500,0,Canon RC-6 Wireless Remote Controller,Sony RMTDSLR2 Wireless Remote
501,0,Netgear Arlo VMA1000 Wi-Fi Camera,"Netgear Replaceable Black Silicone Skins, Black, 3-Pack (VMA1200B-10000S)"
502,0,D-Link DCS-5000L WiFi Pan Tilt Day Night Camera,D-Link España DCS-7010L Outdoor HD PoE Day/Night Fixed Mini Bullet Cloud Camera
503,0,D-Link Wireless Day/Night Camera,D-Link Cloud Wireless N Camera
504,0,16GB MicroSDHC UHS-I U3 Card Adapter,Transcend 8GB MicroSDHC UHS-I U1 Ultimate
505,0,Women's Metallic Classic Logo Disc Studs,32GB SDHC UHS-I Speed Class 3 Flash Flash
506,0,GoPro Hero3 Silver,Fujifilm X-T20 Body with XF 18-55mm Lens Kit (Silver)
507,0,Nikon DSLR D5100 With 18-55mm VR Lens,Canon Rebel SL1 Kit Compact Digital SLR Camera With Hybrid Autofocus And 18-55mm STM Zoom Lens
508,1,SanDisk Extreme Pro SDXC 95MB/sec UHS-I Card 64GB,SanDisk Extreme Pro SDXC 95MB/sec UHS-I Card 64GB
509,0,Fujifilm XF 60mm F2.4 R Macro,Fujifilm XF 55-200mm f/3.5-4.8 R LM OIS
510,1,Angle Finder C (Includes ED-C & ED-D Adapters for All SLR Cameras),Canon Right Angle Finder C (Includes ED-C and ED-D Adapters for All SLR Camera Digital Camera Viewfinder Attachment Accessories
511,0,Canon EF 24-70mm f/2.8L II USM Lens,CANON 24-70MM F/2.8 L II USM
512,0,Nilox Remote Control F60 Evo,Dsk NetPower 6
513,1,APC NetBotz Room Monitor 355 with 120V PoE Injector,NETBOTZ ROOM MONITOR 355 WITH 120/240V PoE
514,1,Fujifilm Instax Mini 9 Polaroid Camera Ice Blue,Adam Harvey Users Make Brands Take Magnet
515,0,Sony Action Video Camera HDR-AS30V,GoPro Hero+ LCD
516,0,D-Link Outdoor Mini Bullet Cloud Camera DCS-7010L,D-Link Wireless Pan/Tilt Cloud Camera DCS-5020L
517,0,Gateway MX6000 6-Cell Li-Ion Battery,Panasonic DMW-BCG10 Battery
518,0,Adam Harvey Take Magnet,Fujifilm Instax Mini 8 Camera
519,1,Sony Cyber-shot Digital Camera RX100 II 20.2MP Black,Sony Cyber-shot DSC-RX100 II Large-sensor 20.2-megapixel compact digital camera
520,0,Transcend 32GB SDHC Class 10 Memory Card,Transcend 64GB SDXC Class 10 Flash Memory Card
521,1,Panasonic Lumix TS20,Panasonic Lumix TS20
522,0,GoPro Wi-Fi Remote,Camera IP Wi-fi Hồng Ngoại Không Dây WTC IP9506
523,0,Canon EF Macro Lens 100mm,Canon EF 70-200mm f/4L USM Telephoto Zoom Lens
524,1,SanDisk Ultra 200GB Micro SDXC Memory Card,Worlds Largest HD Video Display
525,0,Sony Cyber-shot DSC-RX100,Nikon SB-300 Speedlight
526,0,Kupo Hex Stud with 3/8 Inch to 16 Feet and 1/4 -20 Feet Lighting Accessories,Westcott 36 Inch Rapid Box Octa XL with Profoto Speedring Lighting Accessories
527,1,Dolica Aluminum Alloy Proline Tripod,Dolica AX680P104 68-Inch Proline Tripod
528,1,Canon DSLR EOS 1300D 18MP EF-S 18-55 IS,Canon DSLR EOS 1300D Kit EF-S 18-55 IS II
529,0,Canon DSLR EOS 7D Body Only,Canon DSLR Rebel T5i
530,1,D-Link DCS-4802E Full HD Outdoor Mini Dome Camera,D-Link DCS-4802E Full HD Outdoor Mini Dome Camera
531,0,D-Link DCS-6045L PowerLine Day/Night Camera Kit,D-Link DCS-855L/IP Color Indoor Security Camera
532,1,Metabones Canon EF to Sony E Mount Speed Booster ULTRA 0.71x,Metabones Canon EF Lens to Sony E Mount Speed Booster ULTRA 0.71x
533,0,Canon Angle Finder C with adapters EC-C & ED-C,Canon Digital 7D Body Only
534,0,Logitech B525 2MP HD Webcam,Logitech C615 HD Webcam
535,0,Panasonic Full HD Camcorder HDC-HS60K,Panasonic Digital Camera DMC-FS15K
536,0,Canon DSLR EOS 80D Camera with 18-135mm IS USM Lens,Canon DSLR Rebel T5i/700D Camera with EF-S 18-55mm f/3.5-5.6 IS STM Lens
537,1,Creative Live! Cam Connect HD,Webcam Creative Live! Cam Connect HD
538,0,D-Link DCS-6314BS Full HD WDR Varifocal Day & Night Outdoor Smoked Dome Camera,D-Link DCS-2330L HD Wireless N Day/Night Outdoor Cloud Camera
539,0,Sawyer Dress,"1080p AHD Security Camera System, 4 HD Cameras, DVR, Remote View Apps System"
540,0,Manfrotto 501PLONG Long Quick Release Plate,Canon ZSG-C10 Zoom Grip for COMPACT-SERVO Lens
541,0,Accu-Tech MVH500A Fluid Drag Video Head with MVT502AM Tripod and Carry Bag,Manfrotto MVH500AH 755CX3 Lightweight Fluid Video System with Carbon Fiber Legs and Bag
542,0,Panasonic Lumix DMC-FZ200 Digital Camera,Panasonic Lumix DMC-FZ200 12.1-megapixel digital camera
543,0,IP Camera Wireless AC HD Color Night,D-Link Cloud Camera 7100L
544,1,Ubiquiti Networks UVC-G3-DOME IP Interior Exterior Bullet Camera,UniFi Video Camera G3 Dome 1080p Indoor Outdoor IP
545,0,Logitech HD Webcam C310,Webcam Logitech C310
546,0,Kingston Digital 16GB Class 4 microSDHC Flash Card with SD Adapter,Transcend 32GB Class 10 SDHC Flash Memory Card
547,1,Veho MUVI HD NPNG Special Edition Bundle,Veho VCC-005-MUVI-NPNG MUVI HD Mini Handsfree ActionCam
548,1,Elevator Security Camera Infrared CCTV Corner Mount Wide Angle Lens,SE-D300M1 Wireless Surveillance Outdoor 4 Camera
549,1,GoPro Hero4 Black Moto Camera Kit,GoPro Hero Session
550,0,Avenger A2030DKIT Steel 40-Inch Detachable Base C-Stand with Grip Kit (Chrome),ViewSonic VFD820-50 8-Inch Digital Photo Frame
551,1,Sony Handycam HDR-CX110 HD Camcorder Black,Sony Handycam HDR-CX110 HD Camcorder Blue
552,0,Canon Battery Charger CB-2LC,GoPro Dual Battery Charger for Hero3/3+
553,0,GoPro Extended Battery Pack 4000mAh,GoPro Dual Battery Charger USB
554,0,Sony HXR-NX100,GoPro Side Mount
555,0,GoPro HERO6 Black Edition Camera,GoPro HERO3 Black Edition Camera
556,0,Manfrotto Pro Single Carbon Fibre Kit 100 - 509HD,Manfrotto Pro Video Head 75mm MVH502A
557,0,Fujifilm Instax Mini 8 Instant Film Camera Yellow,Covert PIR Camera System 16 1080p HD Cameras DVR Remote Mobile Apps
558,1,Kupo 40-Inch Extension Grip Arm with Big Handle - Black,Kupo 40-Inch Extension Grip Arm with Big Handle - Black
559,0,SDCFXPS-256G-X46,SanDisk Extreme Pro 32GB SDHC UHS-II
560,0,Canon RS 60E3 Remote Control,Canon Deluxe Backpack 200EG
561,0,GoPro Dual Battery Charger for GoPro HERO3+,GoPro Dual Battery Charger + (for HERO4 Black/HERO4 Silver)
562,1,D-Link DCS-4602EV HD Dome Camera,D-Link DCS-942L Full HD Outdoor Vandal-Proof PoE Dome
563,0,Sigma 15mm f/2.8 EX DG Diagonal Fisheye (Pentax),Sigma 70-300mm f/4-5.6 APO Macro Autofocus Lens for Nikon
564,1,D-Link DCS-5009L Wi-Fi Pan & Tilt Day/Night Camera,D-Link DCS-5009L Wi-Fi Pan & Tilt Day/Night Camera
565,0,GoPro Wi-Fi Remote Charging Cable,Manfrotto HDSLR Clamp-On Remote Control
566,0,Canon BG-E21 Battery Grip EF-Mount,Canon DSLR EOS 5D Mark IV Camera with 24-105mm f/4L IS II USM Lens
567,0,Canon DSLR EOS Rebel T5 Body EF-S 18-55mm IS EF 75-300mm f/4-5.6 III,Used Canon EF 75-300mm f/4-5.6 III Telephoto Lens
568,1,Hjc RPHA 11 Darter Helmet,Hjc RPHA 11 Darter Helmet
569,0,Transcend 128GB SDXC Class 10 Flash Memory Card Up to 30MB/s (TS128GSDXC10),"Transcend 128GB SDXC Ultimate UHS-1 Memory Card, Class 10 Card 10"
570,0,Sandisk 32GB Extreme Plus microSDHC Card,Transcend 8GB Class 10 SDHC Card
571,0,Panasonic DMW-BCG10 Rechargeable Lithium-Ion Battery,GoPro Battery BacPac for Hero 4/3/3+
572,0,GoPro Protective Lens + Covers for GoPro Hero3+,GoPro Hero3+ Rechargeable Battery
573,0,Sony Alpha a7RII Mirrorless Digital Camera Body Only,Sony Alpha A6000 Mirrorless Camera Body Only
574,0,SanDisk Extreme 64GB CompactFlash Memory Card,SanDisk Extreme PRO 16GB Compact Flash Memory Card
575,0,Canon DSLR EOS Rebel T6 Camera Kit with 18-55mm IS II Lens,Canon DSLR EOS Rebel T5i
576,0,Sony Tripod VCT-R100,Manfrotto MT190XPRO4 4 Section Aluminum Tripod Legs with Q90 Column
577,0,GoPro Rechargeable Battery (for HERO4 Black/HERO4 Silver),Two Halcyon 4200 mAH Lithium Ion Replacement Battery for Panasonic HC-V700M
578,1,Canon VIXIA HF M500 Flash Memory Camcorder,CANON HFM 500 Video Camera
579,0,,
580,0,Canon ZSG-C10 Zoom Grip for CN-E18-80mm Lens,Sigma 10-20mm f/3.5 EX-DC HSM Autofocus Zoom Lens For Canon Cameras
581,0,Canon EF 24-70mm f/2.8L USM Autofocus Lens,Canon EF 20mm f/2.8 USM Wide Angle Lens
582,0,WiFi-1™ GB WiFi-1™,GA-H170N-WIFI LGA1150 Motherboard
583,1,GoPro Composite Cable,GoPro HERO3 Composite Cable
584,0,Fujifilm Crystal Archive Type II Lustre (Roll) Mini Lab Supplies,Fujifilm Instax Mini 8 Instant Camera
585,1,Security Camera System 4 HD Cameras DVR Apps,Hidden IR Camera System 8 1080p PIR Infrared DVR Apps
