id,label,left_title,right_title
586,1,Samsung Mirrorless NX300 20-50mm F/3.5-5.6 ED II Lens Black,Samsung Digital Camera SMART 20.3MP EV-NX300ZBAT
587,0,D-Link DCS-5020L Wireless Camera,D-Link IP Wi-Fi Cloud Pan/Tilt Camera
588,0,Sandisk Ultra 64GB microSDXC Card,Sandisk Ultra SDXC UHS-I Class 10 128GB
589,1,Netgear Arlo HD camera set with base station and 2 cameras,Netgear VMS3230-100EUS IP security camera Interior exterior Bala Color blanco camera de vigilancia POE dome
590,1,Nilox Head Strap Mount F 60 Evo,Nilox Head Strap Mount F 60 Evo
591,0,Sony Alpha 6000 with 16-50mm Lens,Sony RMTDSLR2 Wireless Remote
592,1,Earthwise CHL91302 Cordless Batteries,Earthwise CHL91302 Tow Behind Cordless Batteries
593,0,Dragonnes Camera Kit Fixation GoPro,Fixation Ventouse Quick Release Kit de Fixation Camera Quick Release GoPro
594,1,Blade Mach 25 FPV Racer BNF Basic,Prophet Sport Plus 50W AC/DC Charger
595,1,Cameron Sino Replacement battery for AEG 4932 BS12C2-US,Cameron Sino Replacement battery for AEG L1215P L1215P-US
596,0,Cameron Sino Replacement Battery For Aeg 954932 Bws12cbws-us,Canon Battery Charger Cb-2lx
597,0,Sony Macro 30mm f/3.5,Canon EF-S Mount 10-22mm
598,1,Manfrotto Hydrostatic Ball Head With RC4 Rapid Connect Plate,Manfrotto Hydrostatic Ball Head with RC4 Rapid Connect System
599,1,Garmin Rechargeable NiMH Battery for Alpha 50,Garmin Rechargeable NiMH Battery for GPSMAP 64s/Oregon 600 Series
600,0,Transcend Premium Secure Digital SDXC Card Class 10 128GB,Transcend Secure Digital Card SDHC Class 10 8GB
601,0,Ksix Selfie LED Flash with 3.5mm Jack for Smartphones,Ksix Selfie Extension for GoPro and Sport Cameras
602,1,Aluratek ADMPF108F 8-inch Hi-Res Digital Photo Frame With 512MB Built in Memory (Black),Aluratek ADMPF108F 8-inch Hi-Res Digital Photo Frame With 512MB Built in Memory (Black)
603,1,Paul Hewitt Miss Ocean Line Watch PH-M-R-P-33S Ladies Watches,M Lok Tripod Adapter
604,0,D-Link Outdoor DCS-6210BS Mini Fixed Dome Camera,D-Link Outdoor DCS-6314BS Varifocal Day/Night Dome Camera
605,0,Kodak Single Use Camera Compact film camera 35 mm,Fujifilm Instax Mini 8 Black Camera
606,0,Ksix Wrist Support For GoPro,Action outdoor Dual Battery Charger
607,1,16GB MicroSDHC UHS-I U3 Card Adapter,Kingston Digital 16GB MicroSDHC UHS-I U3 Action Card
608,0,Sony Alpha a6000 Mirrorless Camera with 16-50mm and 55-210mm Lenses,Alpha a6000 Mirrorless Camera Kit
609,0,Canon EF Macro Lens 100mm,Canon EF 70-300mm f/4-5.6L IS USM Autofocus Telephoto Zoom Lens
610,0,Hjc RPHA 11 Darter,Nilox Remote Control F60 Evo
611,1,Panasonic Lumix 12-35mm f2.8 G X VARIO II Lens,Panasonic Lumix GX Vario 12-35mm f/2.8 II Aspherical Power OIS
612,0,Canon EF 50mm f/1.4 USM Lens,Canon EF 50mm f/1.8 II Lens
613,0,Manfrotto 501PL Camera Plate,Manfrotto MT190XPRO4 Aluminum Tripod
614,0,Mydlink Home Monitor 360 Full HD 360 PoE Dome Camera,D-Link DCS-6045LKT PowerLine Day/Night Camera Kit
615,0,SanDisk Ultra UHS-I microSDHC 32GB Class 10,Transcend 128GB SDXC Class 10 Flash Memory Card
616,0,Manfrotto MVH500AH Video Base Plate,Manfrotto 501PLONG Long Quick Release Plate
617,0,Gigastone SDXC 128GB 90MB/s UHS-I U1 Class 10,Sandisk Extreme Pro SDXC 64GB 95MB/s UHS-I U3
618,0,GoPro Hand Grip Bobber,GoPro Mic Stand
619,0,Garmin Adjustable Arm Mount Kit,GoPro WiFi Remote Accessory Kit
620,1,Sony Cyber-shot RX100 20.2MP Digital Camera,Sony DSC-RX100/B 20.2 MP Exmor CMOS Sensor Digital Camera
621,1,Manfrotto X-PRO 3-Way Head,Manfrotto X-PRO 3-Way Tripod Head
622,0,Logitech Webcam C920-C HD 1080P 30FPS,Logitech HD Webcam C310-US
623,0,Kupo Hex Grip Arm with Big Handle,Canon EVF-DC1 Electronic Viewfinder
624,1,Panasonic Lumix GX1 Body 16MP Compact System Camera (No Lens),Panasonic Lumix GX1 Body 16MP Compact System Camera (Silver)
625,1,WinTech IP9506 Wi-Fi Infrared Camera,WinTech IP9506 Wi-Fi Infrared Camera
626,0,Canon EF 100mm f/2.8 Macro USM Lens,Canon EF-S Mount 10-22mm Ultrasonic Motor Ultra-wide-angle zoom lens for APS-C sensor Single Lens Reflex cameras
627,0,Transcend 32GB SDHC Class 10 Memory Card,Transcend 128GB SDXC Class 10 Flash Memory Card
628,0,Manfrotto X-PRO 3-Way Camera Head Black MHXPRO-3W,Tripod Aluminium Le-Chasseur
629,0,Sony ILCE-A7RM2 Body,Canon EF 70-200mm f/4L USM Telephoto Zoom Lens
630,0,Oregon 548208 Chain Saw Accessories,Canon LP-E10 Rechargeable Battery
631,0,Paul Hewitt Miss Ocean Line Watch PH-M-R-P-33S Ladies Watch,Manfrotto 055 Series 67 Aluminum Tripod
632,1,Arlo Security System Wire-Free HD Camera Indoor/Outdoor Night Vision,Netgear Arlo Smart Home Security Kit
633,0,,
634,1,GoPro Side Mount AHEDM-001,Soporte Lateral GoPro Side Mount
635,0,SanDisk Extreme SDXC 128GB 90MB/s UHS-I U3/Class 10,Transcend Ultimate UHS-1 Class 10 128GB
636,0,Panasonic Lumix DMC-FX55 Silver,14.1 Megapixel Lumix Digital Camera DMC-FX700
637,0,Accu-Tech MVH500A Fluid Drag Video Head with MVT502AM Tripod and Carry Bag,Manfrotto 504HD/546BK Tripod System
638,0,Canon EF-S Mount 10-22mm f/3.5-4.5 Ultrasonic Motor Lens,Canon EF 85mm f/1.8 Ultrasonic Motor Lens
639,0,Manfrotto Follow Focus Electronic Remote with Handle MVR911EJCN,Canon Grip BG-E21 for EOS 6D Mark II
640,0,Manfrotto MK190XPRO4-BHQ2 Kit with ball head,Manfrotto MVH500AH Tripod Kit
641,0,Manfrotto Quick Release Plate 785PL,Manfrotto MB PL-3N1-26 Pro Light Bag Black
642,0,Canon SX510 Black,Canon DSLR EOS Rebel T5i 18MP Digital SLR Camera with Lens
643,1,Transcend 128GB SDXC UHS-I U3 Card,Transcend 128GB SDXC UHS-III Memory Card
644,1,Sandisk 16GB Ultra CF,SanDisk Ultra CompactFlash 16GB
645,0,Canon DSLR EOS 6D with EF 24-105mm f4L IS Kit,Canon EF 85mm F1.8 USM
646,0,Sony HDR-CX405B Full HD Video Camera 30x Optical Zoom,Sony HDR-CX110 HD Handycam Camcorder
647,0,Earthwise CHL91302 Cordless Batteries,Oregon 548208 Chain Saw Accessories
648,1,SanDisk Extreme Pro 160MB/s CF Card 256GB,SanDisk Extreme Pro 160MB/sec Compact Flash Card 256GB
649,0,Canon DSLR EOS 80D Camera with 18-135mm IS USM Lens,Canon EF-S Mount Zoom Lens 18-55mm
650,0,Canon EF-S Mount 10-22mm f/3.5-4.5 Ultrasonic Motor Lens,Canon EF 17-40mm f/4 L Ultrasonic Motor Lens
651,1,16GB CF Compact Flash Card 50MB/s 133X,Transcend TS16GCF133 CIB 16GB 50p CF 50MB/s 133x Transcend Compact Flash Card with Clam Retail
652,0,"Transcend NAND SDHC Flash Memory Card (4GB, Class 2 Speed Rating)",Kingston High Speed Class 3 SD Memory Card 128GB SDXC
653,0,Leica TPS 1000 Battery,GoPro AHDBT-302 Rechargeable Battery
654,0,Panasonic Battery Pack VW-VBT190,Canon Battery NB-5L
655,0,Panasonic Lumix GH4 Professional 4K Mirrorless Interchangeable Lens Camera Body Only,Sony Alpha a6000 Mirrorless Digital Camera
656,0,Sigma 24-70mm f/2.8 IF EX DG HSM Autofocus Lens for Canon EOS,Canon EF 20mm f/2.8 USM Wide Angle Lens
657,1,Panasonic Lumix G X Vario 12-35mm f2.8 ASPH Power OIS Micro Four Thirds,Panasonic Lumix G X Vario 12-35mm f2.8 ASPH Power OIS Micro Four Thirds
658,0,SanDisk CompactFlash Card (CF) Extreme PRO 64GB 160MB/s,SanDisk Extreme PRO 64GB up to 95MB/s UHS-I/U3 SDXC Flash Memory Card
659,0,Kingston Digital 16GB Class 4 microSDHC Flash Card with SD Adapter,Transcend 16GB Class 10 SDHC Memory Card
660,0,Sony Action Video Camera HDR-AS30V Body Mounted,Veho MUVI Atom No Proof Glory Body Camera
661,0,"Canon LC-E6 Battery Charger for Canon EOS 5D Mark II, 7D & 60D Digital SLR",Canon DSLR EOS 60D Body
662,0,Sony Cyber-shot DSC-RX100 II Digital Camera,Sony Cyber-shot WX80
663,0,Panasonic Lumix G X Vario 12-35mm f2.8 ASPH Power OIS Micro Fourth Thirds Mount,Canon EF 85mm f/1.8 USM Autofocus Lens
664,0,GoPro Casey Case for Camera + Mounts Accessories,GoPro Hero6 Black
665,1,Sony Handycam HDR-CX405,Sony Handycam HDRCX405
666,0,Canon DCC-850,Metabones Canon EF to Sony E Mount Speed Booster ULTRA 0.71x
667,0,Sigma 8-16mm f/4.5-5.6 DC HSM Ultra-Wide Zoom Lens,Sigma 18-250mm f/3.5-6.3 DC OS HSM Autofocus Zoom Lens
668,0,Fujifilm Instax Mini 25 Camera White,David Yurman Sterling & Gold Noblesse Ring Sz 6.5
669,0,Transcend 32GB Compact Flash Card,SanDisk Extreme 64GB Compact Flash Card
670,1,Canon EF 24-70mm f/2.8L II USM Lens,Canon EF 24-70mm f/2.8 L II USM Lens
671,0,Canon CanoScan 9000F Mark II,Canon Gadget Bag 2400
672,1,Panasonic Lumix DMC-FZ70 16.1 MP Digital Camera with 60x Optical Image Stabilized Zoom,Panasonic Lumix DMC-FZ70 16.1 MP Digital Camera with 60x Optical Image Stabilized Zoom
673,0,GoPro Hero+ LCD HD Video Recording Camera Body,MCOCEAN 7 in 1 Accessories Kit for GoPro Hero
674,0,Sony Alpha ILCE6000L/S 24.3MP Mirrorless Digital Camera 4x 3.0 inch wide type TFT LCD (Silver),Sony Alpha a6000 Mirrorless Camera with 16-50mm and 55-210mm Lenses
675,1,D-Link DCS-7010L Outdoor Camera,D-Link DCS-7010L Outdoor Camera
676,0,Canon Speedlite 600EX RT,Canon Speedlite 270EX II
677,1,Canon EF 70-200mm f/4L USM Telephoto Zoom Lens,Canon EF 70-200mm F4 L USM Telephoto Zoom Lens
678,0,GoPro Wrist Housing Marine Case,GoPro Side Mount
679,1,Sony HDR-CX405/B 9.2MP Video Recording Camcorder with 29.8mm Wide-Angle Carl Zeiss Zoom Lens (Black),Sony HDR-CX405B Videocamera Full HD 30x
680,1,GoPro Hero3 Wrist Housing,GoPro Hero3 Wrist Housing
681,0,Toro 88500 Cordless Batteries,GoPro Dual Battery Charger
682,1,Sony Alpha a5100 Mirrorless Camera with 16-50mm Retractable Lens,Sony Alpha a5100 Mirrorless Digital Camera with 16-50mm Lens
683,0,Canon EF Macro Lens,Canon EF 70-300mm f/4-5.6 L IS USM Zoom Lens
684,0,Canon DSLR EOS Rebel T5i EF-S 18-135mm IS STM Lens Accessory Bundle,Canon DSLR EOS 80D Camera 18-135mm Lens Video Creator Kit
685,0,Eveready Battery 2032BP-4 3V Li Coin,Canon BP-828 Li-Ion Video Camcorder Batteries
686,0,GoPro Rechargeable Battery for HERO3 and HERO3+,GoPro Dual Battery Charger for Hero 3/3+
687,0,Fujifilm Passport ID Photo Digital Camera LCD Head and Shoulders Indicator Miscellaneous Accessories,Aluratek 7 inch Digital Photo Frame
688,1,Transcend TS8GSDHC10 10 Pack SDHC Class Flash Memory Card,Transcend Secure Digital Card SDHC Class 10 8GB
689,0,Sony E-mount 55-210mm f/4.5-6.3 OSS Lens Silver,Canon EF-S Mount 18-55mm f/3.5-5.6 IS STM Lens
690,1,Umbro Classico 4 IN,Umbro Classico 4 IN
691,0,Manfrotto MVR911ECCN HDSLR Clamp-on Remote Control Black,Canon EVF-DC1 Electronic Viewfinder
692,0,D-Link DCS-5222L Cloud Wireless Panoramic/Tilt/Zoom Camera,D-Link DCS-5020L Wireless N Day & Night Pan/Tilt Cloud Camera
693,0,Sony Cyber-shot DSC-W800/B 20.1 MP Digital Camera (Black),Sony Alpha a3000 Mirrorless Camera with 18-55mm Zoom Lens Kit
694,0,Canon EF 40mm f/2.8 STM Pancake Lens,Lens Hood ES-52 Canon ES-52
695,0,,
696,0,Canon DSLR EOS 6D EF 24-105mm f/4L IS USM Digital Camera Kit,Canon Zoom Wide Angle-Telephoto EF 24-70mm f/2.8L USM Autofocus Lens
697,0,Panasonic VW-VBT190 Lithium-Ion Battery Pack (Black),Garmin Virb/Aera660 Lithium-ion battery pack
698,0,Manfrotto Carbon Fiber Tripod MT055CXPRO3,Trépied 055 Aluminium
699,0,Aluratek Digital Photo Frame,Canon LC-E6 Battery Charger
700,1,Transcend 16GB CompactFlash Card,Transcend TS16GCF1000 DFD 16GB 50p CF 1000x 160MB/s CompactFlash Card
701,0,Canon PowerShot SX540 HS Digital Camera 20.3 MP CMOS 4.3 mm-215 mm Display: 7.6 cm/3 TFT Black,Sony DSC-W800 20.1-Megapixel Digital Camera Black
702,1,Canon Gadget Bag 2400,Canon DSLR Gadget Bag 2400
703,1,Transcend 64GB SDXC Class 10 Flash Memory Card Up to 30MB/s (TS64GSDXC10E) Camera Accessory,Transcend 64GB SDXC Class 10 Flash Memory Card Up to 30MB/s (TS64GSDXC10E) Computer Accessory
704,1,Sony 128Gb UHS-I Class10 40MB/s SF128U,Sony 128Gb UHS-I Class10 40MB/s SF128U
705,0,Transcend 32GB SDHC Class 10 Secure Digital High Capacity Card,Transcend 128GB SDXC Class 10 Flash Memory Card
706,1,Leica GEB111 Battery,Batteria per Leica GEB111
707,0,Sigma 70-300mm F4.0-5.6 DG APO Macro Nikon,Canon EF 70-300mm f/4-5.6L IS USM Telephoto Lens
708,0,Panasonic VW-VBK360 Battery,Oregon 548208 Leaf Blower Accessories
709,0,,
710,0,Rubbermaid MixerMate 1 Gal Pitcher,David Yurman Sterling & Gold Noblesse Ring Sz 6.5
711,0,SanDisk Extreme 64GB Compact Flash Card,SanDisk Ultra 16 GB CompactFlash Card
712,0,Action Outdoor Floating Hand Grip Bobber,Action Outdoor 3 Way Grip Arm
713,1,Canon Battery CB-2LX Charger,Canon CB-2LX Battery Charger
714,0,Canon BG-E11 Battery Grip,Canon EOS 5D Mark IV DSLR Camera Body
715,0,Canon DSLR EOS Rebel T5i EF-S 18-135mm IS STM Lens Kit,Canon DSLR EOS 60D Body
716,1,Flash Shoe Mount Bracket,Flash Shoe Bracket
717,0,Canon DCC-850,Canon Timer TC-80 N
718,0,GoPro Dual Battery Charger + (for HERO4 Black/HERO4 Silver) (GoPro Official Accessory),GoPro Dual Hero System voor HD Hero3+
719,1,D-Link DCS-8200LH Panoramic HD Camera,D-Link DCS-8200LH Panoramic HD Camera
720,1,Eyeon Pet Monitor HD 360,D-Link DCS-855L/P IP Security Camera
721,0,Manfrotto 504PLONG Video Camera Plate,Manfrotto MVH502AH Pro Video Head
722,1,Canon CanoScan 9000F MKII Color Image Scanner,Canon CanoScan 900F MKII Color Image Scanner
723,0,Panasonic Lumix FZ60 16MP Digital Camera,Panasonic Lumix DMC-FZ15K 4MP Digital Camera
724,0,Olympus Tough TG-Tracker Action Camera (Green),WD 240GB WD Green SATA 6Gb s M.2 2280 Internal Solid State Drive
725,0,Metabones Canon EF Lens to Sony E Mount T Speed Booster ULTRA 0.71x,Sony NEX E-Mount 35mm f/1.8 Prime Lens
726,0,Sigma 50mm F1.4 DG HSM Art (Nikon),Sigma 4.5mm f/2.8 EX DC Circular Fisheye HSM (Sony Alpha)
727,0,Sony Handycam HDR-CX210,Sony Handycam HDR-CX580V
728,0,SanDisk Ultra microSDXC 200GB 90MB/s UHS-I/Class 10,Transcend 32GB Class 10 SDHC Flash Memory Card
729,0,Vigilance Full HD Surveillance Starter Kit,D-Link DCS-2332L Cámara de Seguridad
730,0,D-Link DCS-2310L HD Cloud Camera,D-Link DCS-7000L WirelessAC Mini-Bullet HD Day/Night
731,0,WinTech WTC-T201C Camera,WinTech IP9506 Wi-Fi IR Outdoor Camera
732,0,GoPro Hero3 Silver,GoPro HERO3+ Silver Edition
733,0,Lezyne 3-Way Hex Bit Set,Sigma 70-300mm f/4-5.6 DG OS Telephoto Zoom Lens
734,0,Canon DSLR EOS 80D Camera with 18-135mm Lens Video Creator Kit,Canon DSLR Rebel T5i
735,0,Canon Speedlite Transmitter ST-E3-RT,Nikon Battery EN-EL4A
736,1,GoPro Wi-Fi Remote,GoPro Wi-Fi Remote
737,1,Canon ST-E3-RT Speedlite Transmitter,Canon ST-E3-RT Speedlite Transmitter
738,0,,
739,0,Transcend SDHC Class 10 UHS-I Premium Flash Memory Card 32GB,32GB SDHC UHS-I Speed Class 3 Flash
740,0,D-Link Pan Tilt Day & Night Camera,D-Link IP Wi-Fi Cloud Rotatable Camera
741,0,Canon XF105 HD Professional Camcorder,Canon VIXIA HF R30 Flash Memory Camcorder
742,1,Olympus M.ZUIKO DIGITAL ED 40-150mm f/2.8 PRO Lens,Used Olympus M.Zuiko Digital ED 40-150mm f/2.8 PRO Lens
743,0,Manfrotto MVK500AM Telescopic Twin Leg System,Manfrotto MHXPRO-3W 3-Way Head w/ Q2 Quick Release
744,0,D-Link DCS-5010L IP 360º WiFi Camera,D-Link DCS-5020L Wireless Pan/Tilt Cloud Camera
745,0,Garmin Action Camera VIRB XE,Garmin Li-Ion Battery Pack
746,0,Philips Tele Zoom Lens f PXG10,Canon EOS 1300D 18MP +18-55 EF-S IS
747,1,Kodak Power Flash Single Use Camera Compact film camera 35 мм,Kodak Power Flash Single Use Camera Compact film camera 35 mm
748,0,Dunlop Play Smashinn,Action outdoor Red Filter Goalinn
749,0,Sigma 50mm F1.4 DG HSM Art Nikon,Nikon AF Nikkor 16mm f/2.8 Fisheye D
750,1,Canon LP-E17 Battery,Canon LP-E17 Rechargeable Battery
751,1,Canon PowerShot G7 X Mark II 20.1-Megapixel Digital Camera,Canon PowerShot G7 X Mark II Digital Camera
752,0,Kupo 40-Inch Extension Grip Arm with Big Handle - Silver,"Sony Electronic Viewfinder for DSC-RX100M2,DSC-RX1R,DSC-HX50V,DSC-RX1"
753,0,Cameron Sino Replacement Battery for AEG 4932 BLL12C-US,Kingston Digital 16 GB Class 4 microSDHC Flash Card with SD Adapter
754,0,IP Camera Fixed Mini Dome Full HD,D-Link DCS-6045LKT IP Interior Camera
755,0,Panasonic Lumix DMC-LX100 4K Wi-Fi Digital Camera Micro Four Thirds / Full HD 60P Video Leica 24-75mm f/1.7-2.8 Lens,Panasonic Lumix DMC-GH4 4K Micro Four Thirds Digital Camera Body
756,1,D-Link DCS-5010L IP 360º WiFi Camera,Mydlink Home Monitor 360 Professional IP Camera
757,0,Canon EOS Camera Gadget Bag,Case Logic Medium SLR Camera Bag
758,0,Canon Backpack,Canon Deluxe Gadget Bag
759,0,GoPro AHDBT-401 Rechargeable Battery,GoPro Hero3+ Battery
760,0,Sony E-Mount 35mm f/1.8 Prime Lens,Sony ILCE-A7RM2 Body
761,0,Canon EF 70-200mm f/4L USM Telephoto Zoom Lens,Canon EF 85mm f/1.8 USM Medium Telephoto Lens
762,0,Hynix 3rd SM8G24F14-70-HP4N ABT 8MB 72p 70ns 24c 1x4 Parity FPM SIMM C2066A,Sigma 70-300mm F4-5.6 DG Macro Nikon
763,1,Panasonic Lumix GX85 Mirrorless Camera with 12-32mm Lens Black,Panasonic Lumix GX85 Mirrorless Camera with 12-32mm Lens Black
764,0,Canon Timer TC-80N,Canon EOS 6DN Digital Camera Body
765,0,Canon DSLR EOS 80D Camera with 18-135mm Lens Video Creator Kit,Canon DSLR Rebel T5i 18 Megapixel Camera with 55 mm Lens
766,1,Sony E 35mm f/1.8,Sony SEL35F18 35mm f/1.8
767,1,Buff FC Barcelona Polar 15/16,Buff FC Barcelona Polar 15/16
768,0,Knog Lights Qudos Action Video Light for GoPro Silver,Nilox Chest Mount Harness Foolish
769,0,Kodak Single Use Camera Compact film camera 35mm,D-Link Full HD Outdoor Vandal-Proof Poe Dome Wireless Camera
770,0,Canon EF 24-105mm f/4L IS USM Lens,Canon EF 85mm f/1.8 USM Lens
771,1,D-Link DCS-6210BS Full HD Dome Camera,D-Link DCS-6210BS Outdoor Mini Fixed Smoked Dome Camera
772,0,Sony Rechargeable Battery,GoPro Hero3+ Rechargeable Battery
773,0,Canon ImageFormula DR-F120 Sheetfed Scanner,Canon CanoScan 9000F Mark II Flatbed Scanner
774,0,NETGEAR Arlo Smart Home Add-On Indoor/Outdoor Wireless High-Definition Security Camera White/Black,Arlo Support Tilt/Pan Ceiling/Mount Internal/External Camera
775,1,Nikon AF-S Nikkor 55-300mm f/4.5-5.6G ED VR DX Lens,Nikon AF-S NIKKOR 55-300mm f/4.5-5.6G ED VR Zoom Lens
776,1,GoPro Mic Stand Out,GoPro Mic Stand Out
777,0,8GB SDHC Class 10,Transcend TS64GSDXC10 CVK 64GB SDXC Class 10
778,0,Logitech Photo Camera,Logitech C920 15MP Webcam
779,0,Sony HXR-NX100,Sony DSC-RX100
780,1,Lezyne 3-Way Hex Bit Set with 4/5/6mm CRV Hex Bits,Lezyne 3-Way Hex Bit Set with 4/5/6mm CRV Hex Bits
781,0,"Arlo Smart Home Security Camera System - 3 HD, Wire-Free, Indoor/Outdoor Cameras with Night Vision",WIFI-900XTRP Wireless Video Surveillance Transmitter
782,0,SanDisk Extreme 120MB/s 64GB Memory Card,SanDisk Extreme PRO 64GB UHS-I/U3 SDXC Flash Memory Card
783,0,Camera surveillance WTC-T201C,Canon DSLR EOS 6D Body Only
784,0,Sony Electronic Viewfinder Kit,Canon EVF-DC1 Electronic Viewfinder
785,0,"1080p AHD Security Camera System, 4 HD Cameras, DVR, Remote View Apps",Netgear Arlo Wireless Portable Night Vision 2x HD Camera Security System
786,0,Camera IP Wi-fi Hồng ngoại không dây WTC IP9506,Wi-Fi Pan & Tilt Day/Night Camera DCS-5009L
787,0,Veho Mini HD Body Camera/Action Camcorder,Sony VF-SPR1 Spare Lens Protector
788,1,GoPro Battery BacPac,GoPro Battery BacPac
789,1,Sigma 8-16mm f/4.5-5.6 DC HSM (Sony),Sigma 8-16mm f/4.5-5.6 DC HSM (Sony) Review
790,0,MeFOTO Aluminum Roadtrip Travel Tripod/Monopod Kit Orange,Manfrotto MK190XPRO3-BHQ2 Aluminum 3 Section Tripod Kit w Ball Head
791,1,Canon DSLR EOS 80D Body Only,Canon DSLR EOS 80D Body
792,1,Nilox Chest Mount Harness,Nilox Chest Mount Harness
793,0,GoPro Auto Charger with Dual USB Ports,GoPro HERO3 Black Edition
794,0,D-Link DCS-6004L Mini Dome Cloud Camera,D-Link DCS-2330L Network Surveillance Camera
795,0,SanDisk Extreme SDXC Card 90MB/s V30 UHS-I U3 - 128GB,PNY Elite Performance Flash Memory Card 512 GB SDXC UHS-I
796,0,Canon EF 24-70mm f/2.8L II USM Standard Zoom Lens,Canon EF 70-200mm f/4L USM Telephoto Zoom Lens
797,1,GoPro The Tool Thumb Screw Wrench Bottle Opener,GoPro The Tool Thumb Screw Wrench Bottle Opener
798,0,Panasonic Lumix 12-35mm f/2.8 G X Vario II Lens,Sigma 24-70mm f/2.8 IF EX DG HSM Autofocus Lens for Canon
799,0,Transcend 32GB 300x UHS-1 Class 10 SDHC Memory Card,Transcend Secure Digital Card SDHC Class 10 4GB
800,1,WTC-D102H Camera,WTC-D102H Camera
801,0,Transcend 8GB Class 10 SDHC Card TS8GSDHC10 Camera Accessory,Transcend 128GB SDXC UHS-1 Memory Card TS128GSDXC10U1
802,0,Manfrotto Quick Release Plate 785PL,Manfrotto Hydrostatic Ball Head With Rc4 Rapid Connect Plate
803,0,MicroSD 16GB Memory Card for Camera,Nikon DSLR D610 Body
804,0,Canon RC-6 Wireless Remote Controller,Canon LC-E6 Battery Charger
805,0,Sony Handycam HDR-CX110 HD,Sony Handycam HDR-CX260V
806,1,Manfrotto HDSLR Clamp-on Remote Control,Manfrotto MVR911ECCN HDSLR Clamp-on Remote Control
807,0,Sony Wireless Remote RMTDSLR2,Sony Alpha A7 FE 28-70mm
808,1,Canon EVF-DC1 Electronic Viewfinder,Used Canon EVF-DC1 Electronic Viewfinder
809,1,Sandisk Ultra 64GB microSDXC Card r30MB/s w12MB/s Class 10,Sandisk Ultra 64GB microSDXC Card r80MB/s w20MB/s Class 10 UHS-I
810,1,D-Link DCS-5020L Wireless IP Camera HD Day & Night,D-Link DCS-5222L Cloud IP Camera
811,0,Canon DSLR EOS 5D Mark IV Body Only,Canon DSLR EOS 5D Mark II Body
812,0,Tamron AF 18-270mm F/3.5-6.3 Di II VC PZD Nikon Mount,Samsung SMART 20.3 Megapixel Black Digital Camera
813,1,Sony Handycam HDR-CX190,Sony PAL/HDR-CX190
814,0,GoPro Composite Cable,Canon EF-S Focusing Screen Precision Matte
815,0,Canon Deluxe Gadget Bag 10EG (Holds 2 Cameras and 5 to 8 Lenses),Canon DSLR EOS 60D Body
816,1,Canon Battery Charger CG-800,Canon Battery Charger CG-800
817,0,D-Link DCS-2132L HD Camera,D-Link DCS-6004L HD Camera
818,0,Canon Battery Grip EF 70D,Canon DSLR EOS 6D Body
819,1,Canon Backpack,Canon Deluxe Backpack
820,1,Pelican 0945 Compact Flash Memory Card Case,Pelican 0945 Memory Card Case
821,0,Canon DSLR EOS 6D Body Only,Canon DSLR EOS 80D Camera with 18-135mm IS USM Lens
822,0,GoPro Protective Lens and Covers,GoPro Hero3+ Rechargeable Battery
823,1,Nikon Speedlight SB-300,Nikon SB-300 Speedlight Flashgun
824,1,GoPro Casey Case for GoPro HERO Cameras,GOPRO Casey
825,0,Manfrotto Pro Video Head 75mm MVH502A,Manfrotto MB PL-3N1-26 Pro Light Bag Black
826,0,D-Link Wireless Camera DCS-1000w,D-Link Home Panoramic HD Camera DCS-8200LH
827,0,SanDisk Extreme Pro 64GB CompactFlash Card,SanDisk Extreme 32GB CompactFlash Memory Card
828,0,Panasonic Lumix G Vario 7-14mm f/4 ASPH,Panasonic Lumix G X Vario 12-35mm F2.8 ASPH
829,0,Buff FC Barcelona Polar 15/16,Action outdoor Dual Battery Charger
830,0,Panasonic BB-HCM581A-W PoE MPEG-4 Network Camera,Panasonic DMC-FH20V 14.1 Megapixel Camera
831,0,Logitech Photo Cameras Camera,Logitech BCC-950 Video Camera
832,0,Manfrotto MK190XPRO3-BHQ2 Tripod Kit,Manfrotto Hydrostatic Ball Head with RC4 Rapid Connect System
833,0,Foscam FI9901EP PoE 4MP Outdoor IP Camera,Sony HX400V Compact Camera With 50x Optical Zoom
834,0,Canon DSLR EOS Rebel T6 Camera Kit with 18-55mm IS II Lens,Canon DSLR EOS Rebel SL1
835,1,Canon GL2 Package 2,Canon GL2 Package 3
836,0,Canon EF-S 55-250mm f/4-5.6 IS II,Canon EF-S 10-22mm USM Ultra-wide-angle zoom lens
837,0,Umbro Classico 4 IN,Hjc RPHA 11 Darter
838,0,,
839,1,Gigastone 128GB Class 10 UHS-I U1 Prime SDXC Memory Card Up to 45MB/s Compatible with Canon EOS Rebel T5 T5i T6 T6i 80D 6D SL1 Nikon D3300 D5500 D5600 D7200 D750 Sony Pentax Kodak Olympus Panasonic Camera & Photo Accessories,Gigastone GS-SDXCU1128G-R 128GB 9p SDXC 45MB/s UHS-I U1 Class 10 Professional Series Secure Digi
840,0,Sony Compact Camera HX400V 50x Optical Zoom,Sony Digital Camera DSC-W800 Black
841,0,Sigma 10-20mm f/3.5 EX-DC HSM Autofocus Zoom Lens For Canon Cameras,Sigma 120-400mm F4.5-5.6 APO DG HSM (Sony)
842,1,Kingston SDHC/SDXC 32GB UHS-I U3 Class 3 Flash Memory Card,Kingston SDHC 32GB UHS-I Flash Memory Card
843,0,,
844,0,Nikon DSLR D3100 with 18-55mm and 55-200mm NIKKOR VR Lenses,Nikon DSLR D3200 with AF-S DX NIKKOR 18-55mm VR Lens
845,0,Canon EF 75-300mm f/4-56 III Telephoto Lens,Nikon AF-S Nikkor 55-300mm f/4.5-5.6G ED VR DX Lens
846,1,GoPro Hero4 Accessory Set (33 Items),GoPro Hero4 Accessory Set (33 Items)
847,0,Canon EF-S Mount 18-55mm f/3.5-5.6 IS STM Lens,Canon DSLR EOS Rebel SL1
848,1,Veho Mini HD Body Camera,Veho Muvi HD PRO 1080p Action Camcorder
849,1,Nilox Remote Control F60 Evo,Nilox Remote Control F60 Evo
850,0,Veho Mini Camcorder HD PRO 1080p,Veho MUVI Atom Action Camcorder
851,0,Battery Rechargeable NiMH For Alpha 50,Canon Battery Charger CG-800
852,1,Panasonic Lumix DMC-FX700 14.1MP Digital Camera,Panasonic Lumix DMC-FX700S 14.1MP Digital Camera
853,0,SDCFXPS-256G-X46,SanDisk ExtremePro160MB/150MB
854,0,PROFESSIONAL IP CAMERA FULL HD CLOUD WIRELESS,D-Link DCS-5020L Wireless Day/Night Network Camera
855,0,Canon FS200 Flash Memory Camcorder,Sony HDR-CX110 HD Handycam Camcorder
856,0,Fujifilm Instax Mini 8 Pink Camera with 3 Packs of Film and Bag,Yellow Fujifilm Instax Mini 8 Camera
857,0,"Patriot LX Series 128GB High Speed Micro SDXC Class 10 UHS-I Transfer Speeds For Action Cameras, Phones, Tablets, and PCs",Sandisk Extreme Pro 64GB (95MB/s)
858,0,Manfrotto Tripod 4 Sections Aluminium MK190XPRO4-BHQ2,Vanguard Alta Pro 263AT
859,0,Hidden Camera System 4 Covert PIR Security Cameras Invisible IR DVR System Spy Cameras Video Surveillance,Arlo Smart Home Security Camera System Wire-Free Indoor Outdoor Cameras Night Vision NETGEAR
860,0,Kupo Extension Grip Arm with Big Handle,Kupo Hex Stud Female 3/8-16 to 1/4-20 1/4-20
861,0,Transcend 64GB SDXC/SDHC Class 10 UHS-1 Flash Memory Card Up to 90MB/s 600x,Transcend Ultimate - flash memory card 8 GB microSDHC UHS-I
862,0,Blade FPV Inductrix 200 Bind-N-Fly Drone with Camera,SanDisk SDSDUNC-128G-GN6IN CYU 128GB 9p SDXC r80MB/s 533x Class 10 UHS-1 U1 SanDisk Ultra Secure Dig
863,1,Fujifilm X-E2S Mirrorless Digital Camera Body Only - Silver,Fujifilm X-E2S Mirrorless Body Silver
864,0,Metabones Canon EF Lens to Sony E Mount T Speed Booster ULTRA 0.71x,Canon ES-52 Lens Hood for EF 40mm f/2.8 STM Pancake
865,0,Canon CanoScan 9000F Mark II Flatbed Scanner A4 Black Silver,Canon BG-E21 Battery Grip (6D Mark II)
866,1,Canon EF-S 55-250mm f/4-5.6 IS STM Telephoto Zoom Lens,Canon EF-S 55-250mm f/4-5.6 IS STM Telephoto Zoom Lens
867,0,SanDisk Extreme Pro 160MB/s 32GB CompactFlash Card,Sandisk 64GB Extreme Pro Compact Flash Card
868,0,SanDisk 64GB Class 4 SDXC Flash Memory Card,SanDisk Extreme PRO 64GB up to 95MB/s UHS-I/U3 SDXC Flash Memory Card
869,0,Fujifilm Instax Instant Film,Fujifilm FP-3000B Black and White Film
