id,label,left_title,right_title
0,1,Transcend SDHC Secure Digital Class 2 Flash Memory Card (4GB),Transcend TS4GSDHC BUB 4GB SDHC Secure Digital Class 2 Retail
1,0,Veho Muvi Pro Micro Black,Chromo CI-216 LED Ultra High Power Panel
2,0,Sony RMTDSLR2 Wireless Remote,Sony Alpha a6000 Mirrorless Digital Camera
3,0,Hasselblad X1D Digital Medium Format Mirrorless Camera Body,Panasonic Lumix DMC-FX75S 14.1 Megapixel Digital Camera
4,1,Action Outdoor Suction Cup with Plate,Action Outdoor Suction Cup with Plate
5,0,Uniden UDR444 Guardian 4.3-Inch Video Surveillance System with 2 Cameras,"Security Camera System, 4 Dome Infrared Cameras, Internet DVR, iDVR System"
6,0,GoPro Head Strap QuickClip,Frontal Camera Mount Kit
7,1,Tamron AF 18-270mm f/3.5-6.3 Di-II VC LD Asph. (IF) Macro Lens for Nikon Digital SLR Cameras,Tamron AF 18-270mm F/3.5-6.3 Di II VC PZD (Nikon Mount)
8,0,Panasonic Lumix G Vario 14-45mm f3.5-5.6 ASPH. MEGA O.I.S Micro Four Thirds Mount,Sigma 8-16mm F4.5-5.6 DC HSM Ultra-Wide Zoom Lens
9,0,AXIS Clear Dome Camera Dome Bubble AXIS Bubble - 5800-481,GoPro Head Strap Plus QuickClip
10,0,MCOCEAN 7 in 1 Accessories Kit for GoPro Hero 4/3+/3/2/SJCAM/Xiaomi Yi Camera,Canon Deluxe Back Pack 200EG
11,0,SanDisk Ultra 16GB CompactFlash,32GB CF Compact Flash Card
12,0,D-Link DCS-8200LH Panoramic HD Camera,D-Link DCS-2310L Outdoor Day/Night Cloud Camera
13,1,Canon BG-E11 Battery Grip,Canon BG-E11 Battery Grip
14,1,Foscam FI9901EP PoE 4MP Outdoor IP Camera,IP KAMERA IP Foscam FI9901EP POE 4.0 Mpx P2P
15,0,Nikon DSLR D5300 with 18-55mm VR Lens,Nikon DSLR D3200 with AF-S DX NIKKOR 18-55mm VR Lens
16,0,Nikon SB-300 Speedlight Flashgun,Nikon SB-700 Flash
17,0,GoPro Hero5 4 3+ 3 2 1 Session Accessory Bundle Set,Canon Deluxe Gadget Bag
18,0,Sony HXR-NX100,Sony SEL1670Z 16-70mm f/4
19,0,"Netgear Replaceable Black Silicone Skins, Black, 3-Pack",Mydlink Home HD Monitor 360 Cam
20,0,MCOCEAN 7 in 1 Accessories Kit for GoPro Hero 4/3+/3/2/SJCAM/Xiaomi Yi Camera,Soft Digits Accessory Bundle Set Action Camera SJ4000/SJ5000/SJ6000/Xiaomi Yi
21,0,Nikon AF 50mm f/1.8D,Nikon AF-S Nikkor 50mm f/1.8G
22,0,Hidden Camera System 4 Covert PIR Security Cameras Invisible IR DVR Spy Cameras Video Surveillance,MCOCEAN Accessories Set GoPro Hero 4/3 Plus 2 Body Mounted Cameras Video Gear Outlet
23,0,Avermedia Vision U50 Document Camera,Canon Deluxe Gadget Bag 100EG (Holds 1-2 Cameras and 3-4 Lenses)
24,0,D-Link DCH-100KT Smart Home HD Starter Kit,D-Link DCS-6045L PowerLine Day/Night Cloud Camera
25,1,Sony Electronic Viewfinder Kit,Sony FDA-EV1MK Electronic Viewfinder Kit
26,0,"Panasonic HDC-SD100 Full-HD 3MOS SD Camcorder with Advanced O.I.S., 5.1 Surround Sound",Panasonic DMC-FS15K Digital Camera
27,0,GoPro Mic Stand,Action Outdoor Dual Battery Charger
28,1,Canon Vixia HF G10,VIXIA HF G10 Canon
29,0,Chromo CI-216 Dimmable Ultra High Power Panel Camcorder Video Digital SLR Camera Light,Nikon DSLR D300S
30,1,D-Link DCS-1000w Wireless Camera,D-Link DCS-1000w Wireless Camera
31,0,Canon Speedlite 270EX II,Canon XF105
32,1,D-Link DCS-5020L WiFi Panoramic Camera,D-Link DCS-5020L Wireless Day/Night Surveillance Camera
33,0,Samsung Smart 20.3 Megapixel Digital Camera EV-NX300Z,Nikon DSLR D3200 With AF-S DX Nikkor 18-55mm VR Lens
34,0,GoPro Wi-Fi Remote,GoPro Auto Charger
35,0,Logitech BCC950 Conferencecam Full HD 1080p Motorized Pan w/ Remote Control USB,Manfrotto Video Camera Plate - 504PLONG
36,0,SanDisk Secure Digital Card SDXC CLASS 4 64GB,Transcend 64GB SDXC Class 10 Flash Memory Card Up to 30MB/s
37,1,SanDisk Extreme 64GB Compact Flash Card,SanDisk Extreme 64GB CompactFlash Memory Card
38,0,Sony Alpha a6000 Mirrorless Camera 16-50mm Lens 55-210mm Lens,Samsung SMART 20.3 Megapixel Digital Camera
39,1,D-Link DCS-2230L Full HD Wireless Day Night Network Camera,PROFESSIONAL IP CAMERA FULL HD CLOUD WIRELESS
40,0,Canon Vixia HF G10,Transcend CompactFlash TS32GCF133
41,0,GoPro HERO3 Black Edition,GoPro Composite Cable
42,0,Manfrotto 190 MK190XPRO3-BHQ2 Kit,Manfrotto 055 Series 67 Carbon Fiber Tripod
43,0,Ksix Wrist Support For GoPro,GoPro Mic Stand
44,0,Manfrotto 504HD/546BK Tripod System,Manfrotto Carbon Fiber Tripod MT055CXPRO3
45,0,GoPro Hero3+ Silver Edition,MCOCEAN Accessories Set for GoPro Hero 4 / 3 Plus 2
46,0,Canon EVF-DC1 Electronic Viewfinder,Canon BG-E11 Battery Grip
47,1,Nikon AF-S DX 18-105mm f/3.5-5.6G ED VR,Nikon AF-S DX 18-105mm f/3.5-5.6G ED VR
48,0,NEEWER CN-160 LED Dimmable Ultra High Power Panel Digital Camera Light,Veho Muvi HD10 Handfree Camcorder
49,1,Canon PowerShot SX540 HS,Canon PowerShot SX540 HS
50,0,Nikon AF-S Zoom-Nikkor 70-200mm f/2.8G ED VR II Lens,Nikon DX 10-24mm f/3.5-4.5G ED AF-S Zoom-Nikkor Lens
51,0,Canon Battery Charger,GoPro Dual Battery Charger
52,1,Fujifilm Crystal Archive Type II Lustre Paper 4 In. x 610 Ft. (Roll),Fujifilm Crystal Archive Type II Lustre Paper 4 In. x 610 Ft. (Roll)
53,0,Panasonic Lumix G Vario 7-14mm f/4.0 ASPH.,Canon EF-S Mount 10-22mm Ultrasonic Motor Ultra-wide-angle zoom lens
54,0,Kupo 40-Inch Extension Grip Arm with Big Handle - Silver,Aluratek Digital Photo Frame
55,1,Canon BG-E21 Battery Grip for EOS 6D Mark II,Canon BG-E21 Battery Grip for EOS 6D Mark II
56,0,Leica GEB121 Battery,Zebra ZQ110 Battery Charger
57,0,Canon DSLR EOS Rebel T5i,Canon EF-S Mount 18-55mm f/3.5-5.6 IS STM Lens
58,0,Sony Handycam CX210 High Definition Camcorder Silver Edition,Sony Handycam HDRCX405 with Exmor R CMOS Sensor
59,1,Canon PowerShot SX60 HS,PowerShot SX60 HS
60,0,GoPro Hero3+ Silver Edition,MCOCEAN Accessories Set for GoPro Hero 4 / 3 Plus 2
61,0,Shimano Deore M506 Front Kit,GoPro Mic Stand
62,1,Suunto Spartan Ultra Titanium HR,Suunto Spartan Ultra Titanium HR
63,0,D-Link DCS-5009L Wi-Fi Pan & Tilt Day/Night Camera,D-Link DCS-2310L Outdoor HD PoE Day/Night Cloud Camera
64,0,DVR Home Surveillance System IR Cameras Infrared iPhone Blackberry Android,HD Hidden IR Camera System 8 1080p PIR Cameras Infrared DVR Apps
65,0,Camera & Camcorder Accessories,Sigma 70-300mm f/4-5.6 DG OS Telephoto Zoom for Pentax AF Digital SLR Cameras
66,0,MicroSD 16GB,GoPro Hero3 Silver
67,0,GoPro HERO3 Black Edition,GoPro AHDBT-302 Rechargeable Battery
68,0,Nilox Battery F60 Evo,Action Outdoor Floating Hand Grip Bobber
69,0,GoPro Side Mount,GoPro Helmet Front Mount
70,0,Sigma 10-20mm f/4-5.6 EX DC J Autofocus Lens for Pentax Digital SLR Cameras,Sigma 18-250mm f/3.5-6.3 DC OS HSM Autofocus Zoom Lens For Pentax Cameras
71,1,Fujifilm Instax Mini 8 Camera,Rubbermaid MixerMate Pitcher
72,0,Transcend 128GB SDXC UHS-I Memory Card,Kingston 128GB SDXC Flash Memory Card
73,0,Elite Screens Manual 84-inch 16:9 Pull Down Projection Screen with 30-inch Drop,Kupo 40 Inch Hex Grip Arm with Big Handle Black Lighting Accessory
74,0,Avenger A2030DKIT Steel 40-Inch Detachable Base C-Stand with Grip Kit (Chrome),GoPro 3-Way Mount
75,0,Canon DSLR EOS Rebel T3 with EF-S 18-55mm f/3.5-5.6 IS Lens,Canon DSLR EOS Rebel T5 with EF-S 18-55mm IS II Lens Kit
76,0,DISPARADOR A DISTANCIA CÁMARAS RS-60 E3,Canon Digital Gadget Bag 200DG
77,0,Canon EF 40mm f/2.8 STM Lens,Canon EF-S Mount Telephoto Zoom Lens
78,0,Transcend CompactFlash TS16GCF1000 Flash Memory Card,Transcend SDXC TS128GSDXC10U1 Flash Memory Card
79,0,Canon EF 24-70mm f/4L IS Ultrasonic Motor Zoom Lens,Used Canon EF-S Mount 18-55mm f/3.5-5.6 IS STM Lens
80,0,Sigma 10-20mm f3.5 HSM Canon DC,Sigma 10-20mm f4-5.6 EX DC HSM FOR CANON
81,0,SanDisk 64GB Extreme Pro Secure Digital Extended Capacity (SDXC) Flash Card Model SDSDXPA-064G-A46 Camera & Photo Accessories,Transcend SDXC 64GB Class 10
82,0,Fujifilm X-T20 Body with XF 18-55mm Lens Kit (Silver),Canon EOS 77D DSLR Camera
83,0,Sony Cyber-shot DSC-RX100 III 20.1-megapixel compact digital camera with Wi-Fi,Sony SEL35F18 35mm f/1.8 OSS E-mount
84,1,Canon SX510 Negra,Canon Power Shot SX510 HS
85,1,Canon Gadget Bag 10EG Deluxe,Canon Gadget Bag 10EG Deluxe
86,1,Canon XF105 HD Professional Camcorder,Canon XF105 Professional Camcorder
87,1,Canon DSLR EOS 77D Body Only,Canon Rebel T7i EF-S 18-55 IS STM Kit
88,0,GoPro Composite Cable,GoPro Hero3+ Rechargeable Battery
89,0,Fujifilm Instax Mini 25 Camera White,Veho Muvi Pro Micro Black
90,0,Canon PF-03 Printhead Series,Manfrotto MVH500AH Fluid Head Flat Base
91,0,GoPro Jaws Flex Clamp Mount,GoPro Camera Tether
92,0,Action Outdoor Red Filter,Ksix Wrist Support For GoPro
93,0,Action Outdoor Floating Hand Grip Bobber,GoPro Mic Stand Out
94,0,Transcend TS64GCF1000 DFF 64GB 50p CF 1000x 160MB/s CompactFlash Card,SD 32GB SDHC Class 10 300X 300X
95,0,Transcend CompactFlash TS16GCF133 Flash Memory Card,SanDisk Extreme Pro CF 16GB
96,0,Sony Cyber-shot RX100 DSC-RX100,Sony Cyber-shot WX80 Digital Camera
97,0,GoPro Harnais GoPro Harnais,GoPro Rollbar Camera Mount
98,0,Sony NXCAM Professional Camcorder,Sony Handycam Camcorder
99,0,GoPro Hero5 Black 4K Action Camera,Vanguard Alta Pro 263AT Tripod
100,0,D-Link DCS-2210L Full HD PoE Day/Night Network Camera,Tradineur POWERLINE HD DAY/NIGHT CLOUD CAMERA
101,0,Panasonic Digital SLR DMC-FZ50S 10.1MP Silver with Manual Focus & Zoom Rings,Panasonic Digital Camera DMC-FX48S 12.1MP
102,0,Canon DSLR EOS 6D Body EF 24-105mm L IS USM Lens,Canon Lens EF 17-40mm f/4L USM
103,1,Sony Tripod VCT-R100,Sony VCT R100 Camera Tripod
104,0,Veho Muvi HD PRO 1080p Mini Camcorder,Panasonic Lumix DMC-GH4 Micro Four Thirds Digital Camera Body
105,1,Nikkor AF-S 50mm f1.8G,Nikon AF-S Nikkor 50mm f/1.8G
106,0,GoPro HERO4 BLACK Moto Bundle,GoPro HERO4 Rechargeable Battery
107,1,Gateway ML6000 6-Cell Li-Ion Battery,Gateway MX6000 6-Cell Li-Ion Battery
108,0,Nilox Remote Control F60 Evo,Buff FC Barcelona Polar 15/16
109,0,Panasonic Lumix DMC-FX75S Digital Camera,Panasonic Lumix DMC-FZ18S Digital Camera
110,0,,
111,0,Canon Cable USB 1.5m,Canon Gadget Bag 2400 Camera Case
112,0,Panasonic Lumix G Vario 14-45mm f3.5-5.6 ASPH MEGA O.I.S Micro Four Thirds Mount,Panasonic Lumix G X Vario 12-35mm f2.8 ASPH Power OIS Micro Four Thirds Mount
113,0,Canon Body Cover RF-3 Camera Lens Adapter,Canon EF-S 18-55mm f/3.5-5.6 IS STM Lens
114,0,,
115,0,Sony PDV-184N DV tape,Sony AS30V High Definition POV Action Video Camera
116,1,Panasonic VW-VBT190 Battery Pack,Panasonic VW-VBT190 Lithium-Ion Battery Pack
117,0,Canon LC-E6 Battery Charger,Canon EOS 6D(N) Digital Camera
118,0,Canon EF-S 55-250mm f/4-5.6 IS STM Telephoto Zoom Lens,Canon EF-S 10-22mm f/3.5-4.5 USM Lens
119,0,GoPro Hero4 Black,GoPro Hero6 Black
120,1,Leica GEB212 Battery,Batteria per Leica GEB212
121,0,Veho MUVI Atom Body Camera/Action Camcorder Bundle,Veho MUVI-HD10 Mini HD Body Camera/Action Camcorder
122,0,Fujifilm FP-3000B Instant Black and White Film,Camera Bag (Black with Black Trim)
123,0,Sony Action Video Camera HDR-AS30V Body,Sony HD Video Recording HDRCX405 Handycam
124,0,Sony Cyber-shot RX100 20.2MP Digital Camera,Sony Cyber-shot DSC-RX100 III 20.1MP Compact Digital Camera
125,0,Transcend CompactFlash TS32GCF133,Transcend SDHC Class 10 UHS-1 Flash Memory Card TS32GSDU1
126,0,Action Model 1080-US Action! Model Three 1080 DLP With Crystalio II,Sony PAL/HDR-CX260 High Definition Handycam Camcorder
127,1,Manfrotto Three Section MT055XPRO3 Aluminum Tripod,Tripod 055 Sections Aluminium
128,0,Panasonic NE-1054 Microonda,Sony Cyber-shot RX100
129,1,Fujifilm Instax Mini 8 Pink Camera with 3 Packs of Film and Bag,Fujifilm INSTAX Mini 8 Instant Film Camera (Pink)
130,0,IP Camera PTZ Wireless MYDlink HD Day & Night,Mydlink Cloud Outdoor PoE HD DCS-2310L
131,0,GoPro Side Mount Support System Adhesive Mount,GoPro AHDBT-302 Rechargeable Battery
132,0,GoPro Roll Bar Mount,Fujifilm X100 Silver
133,1,GoPro Hero3+ Silver Edition,GoPro HERO3+ Silver Edition
134,0,Veho Muvi HD NPNG Special Edition Bundle,GoPro Hero 4 Black
135,0,Sony LCD Screen Protector for A7/A7R,Panasonic DMC-FX10S Digital Camera with 3x Optical Zoom
136,0,Canon EF 50mm f/1.8 II Lens,Canon EF-S Mount 18-55mm f/3.5-5.6 IS STM Lens
137,0,Sony Mirrorless Alpha a6000 Body,Sony Mirrorless Alpha a6000 16-50mm Retractable Lens
138,0,Kupo Kupole Extension 6.6FT Black Lighting Accessories,Kupo Hex Stud Female 3/8-16 to 1/4-20 1/4-20 KG001012
139,0,Vanguard Alta Pro 263AT Tripod,Nikon EN-EL4A Rechargeable Battery
140,0,Umbro Classico 4,Hjc RPHA 11 Darter
141,1,Ksix Wrist Support For GoPro And Sport Cameras,Ksix Wrist Support For GoPro And Sport Cameras
142,1,Manfrotto 055 Series 67 Carbon Fiber Tripod,Manfrotto MT055CXPRO4 Carbon Fiber Tripod
143,0,Canon Canoscan 9000F Mark II,Canon EOS 5D Mark II
144,0,Canon EF 2x III Extender Accessories,Canon EF 20mm f/2.8 USM Wide Angle Lens
145,0,Canon CanoScan 9000F MKII Color Image Scanner,Canon 200DG Digital Camera Gadget Bag
146,0,Canon EF 24-105mm f/4L IS USM,Canon Digital SLR Camera
147,0,16GB MicroSDHC UHS-I U3 Card Adapter,8GB MicroSD 10 Adapt 600X
148,0,Kingston MicroSDHC 16GB UHS-I U3 Action Card with SD Adapter,Kingston SDHC 32GB UHS-I Flash Memory Card
149,0,Sony Handycam HDR-CX110 HD Camcorder (Red),Sony Handycam HDR-CX190 High Definition Camcorder (Black)
150,1,Garmin Action VIRB XE 010-01363-11 Video Camcorder,Garmin Ultra 30 010-01529-03
151,0,Sony Handycam HDR-PJ540 Full HD Camcorder with Built-in Projector (Black) Accessory Bundle,Sony PAL/HDR-CX190 HD Camcorder
152,0,Canon EF 20mm f/2.8 USM,Sigma Zoom Super Wide Angle 10-20mm f/4-5.6 EX DC HSM Autofocus Lens for Canon
153,0,32GB microSDHC Class 10,Transcend SDHC UHS-I Flash Memory Card
154,0,Canon NB-5L Rechargeable Lithium-ion Battery,Panasonic DMW-BCG10 Battery
155,0,Sigma 70-300mm f/4-5.6 DG OS Telephoto Zoom Lens,Sigma 18-250mm f/3.5-6.3 DC OS HSM Autofocus Zoom Lens
156,1,"Kupo 40-Inch Extension Grip Arm with Big Handle - Silver, KG203412","Kupo 40-Inch Extension Grip Arm with Big Handle - Silver, KG203412"
157,0,SanDisk Extreme PRO 64GB up to 95MB/s UHS-I/U3 SDXC Flash Memory Card,Transcend SDXC 64GB Class 10
158,0,Canon NB-5L Battery,Canon CB-2LC Battery Charger
159,0,D-Link DCS-1000W Wireless Camera,D-Link DCS 6010L Wireless N 360° Home Network Camera
160,0,Canon Digital Camera Gadget Bag (Black),Aluratek 7 inch Digital Photo Frame
161,0,D-Link DCS-2132L Camera Cloud,D-Link DCS-5020L Day/Night Camera
162,0,Nikon AF-S Nikkor 28-300mm f/3.5-5.6G ED VR Lens,Canon EF 70-300mm f/4-5.6L IS USM Autofocus Telephoto Zoom Lens
163,1,SDHC Secure Digital Memory Card,Transcend 32GB SDHC Class 10 Memory Card
164,1,Sony Alpha ILCE6000L,Sony Alpha ILCE6000L
165,0,Canon BG-E14 Battery Grip for EOS 70D,Battery Canon LP-E10 Camera EOS 1100D
166,0,Canon XF100 HD Professional PAL Camcorder,Canon XF105 US Canon XF105 and XF100 Professional Camcorders
167,0,Canon Remote Switch RS60 E3,Manfrotto Follow Focus Electronic with Handle
168,0,Manfrotto Aluminium Video Tripod MVH500AH755CX3,Manfrotto 190 MK190XPRO3-BHQ2 Kit
169,0,D-Link Outdoor Full HD Vandal-Resistant Mini Fixed Smoked Dome Camera,D-Link PowerLine HD Day Night Cloud Camera Kit
170,0,Canon Wide-angle camcorder lens,Canon Li-Ion 8598B002 Video Camcorder Batteries
171,0,Suunto Spartan Ultra Titanium,Nilox Remote Control F60 Evo
172,1,Gigaram SD-M32 BQH 32MB SD Secure Digital Card,SanDisk SDSDS-32-901 BQH 32MB SD Secure Digital Card
173,0,Canon EF 70-200mm f/4L IS USM Zoom Lens,Canon EF 17-40mm f/4L USM Lens
174,0,GoPro LCD Touch BacPac,MCOCEAN Accessories Set for GoPro Hero 4 / 3 Plus 2
175,0,Canon 580EX/580EX II Flash Speedlite Grid,Chromo CI-216 LED Camera Light
176,0,Garmin Virb/Aera660 Lithium-ion Battery Pack,Toro 88500 Cordless Batteries
177,0,Fujifilm X100S Digital Camera Silver,Panasonic Lumix DMC-GF5 Digital Camera with 14-42mm Lens Kit Black
178,1,Battery Canon NB-5L,Canon Battery 1135B001 NB-5L
179,1,Sandisk 64GB SDXC,SanDisk SDSDB-064G-B35 CVJ 64GB UHS-1 Secure Digital Extended Capacity Card
180,0,Canon Electronic Viewfinder EVF-DC1,Canon Battery Grip BG-E11
181,1,Sony Alpha ILCE6000,Sony Alpha a6000 Mirrorless Digital Camera with 16-50mm Power Zoom Lens
182,0,Kupo Hex Grip Arm with Big Handle Black,Kupo Kupole Extension 6.6FT Black
183,0,,
184,0,D-Link Wireless AC Day/Night HD Mini Bullet Cloud Camera,D-Link DCS-5020L Wireless Day/Night Network Camera
185,0,GoPro Hero3 Silver,Nikon DSLR D5100 With 18-55mm VR Lens
186,0,Canon DSLR 5D Mark III Body Only,Canon DSLR 70D Body
187,0,Lezyne 3-Way Hex Bit Set,Dunlop Smash Play
188,0,D-Link DCS-2132L HD Camera,D-Link DCS 5222L Network Surveillance Camera
189,1,Canon DSLR EOS SL1,Canon DSLR EOS Rebel SL1 18-55mm STM Lens Kit
190,0,GoPro Tripod Adapter,GoPro Helmet Mount
191,0,Sandisk Extreme microSDHC 64Gb Type 10,Nilox Remote Control F60 Evo
192,0,Sony Alpha a3000 Mirrorless Camera with 18-55mm Zoom Lens Kit,Canon DSLR EOS Rebel T3 Digital SLR Camera with EF-S Mount 18-55mm f/3.5-5.6 IS Lens
193,0,Avenger A2030DKIT Steel 40-Inch Detachable Base C-Stand with Grip Kit (Chrome),Kupo Hex Stud Female 3/8-16 to 1/4-20 1/4-20
194,1,Canon EF 24-105mm f/4L IS USM Lens Used,Canon EF 24-105mm f/4L IS USM Lens Used
195,0,Transcend 128GB SDXC Class 10 Flash Memory Card Up to 30MB/s,128GB SDXC UHS-I U3 CARD
196,0,Panasonic Lumix LX100 Integrated Leica DC Lens Camera with Advanced Controls DMC-LX100K,Panasonic Lumix Digital Camera DMC-FX75K
197,0,Nikon EDG 65mm Fieldscope with 16x-48x Zoom Eyepiece,Canon DSLR EOS Rebel T5 Body EF-S 18-55mm IS Lens EF 75-300mm III Lenses Bag Accessories
198,0,Canon EF-S Mount 18-55mm f/3.5-5.6 IS STM Lens,Canon EF 17-40mm f/4 L USM Lens
199,0,Canon Deluxe Gadget Bag 100EG-US Camera Cases,Canon DSLR EOS Rebel T5 with 18-55mm and 75-300mm Lens Bundle 64GB Deluxe Accessory Kit
200,1,Canon Battery Charger CB-2LC,Canon Battery Charger CB-2LC
201,0,Action Outdoor Dual Battery Charger,DSK NetPower 6
202,0,SanDisk Extreme 32GB Compact Flash Card,SanDisk Extreme Pro SDHC UHS-II
203,0,GoPro Protective Lens and Covers,GoPro Dual HERO System
204,0,Sony Mini DV Cassette,SanDisk Ultra microSDXC 200GB
205,0,Manfrotto Hydrostatic Ball Head with RC4/410PL Quick Plate,Manfrotto BeFree Tripod with Ball Head
206,1,Nikon AF 50mm f/1.8D,Nikon AF 50mm f/1.8D
207,1,Canon EF 50mm f/1.4 USM Standard Lens,Canon EF 50mm f/1.4 USM Standard Lens
208,0,GoPro Wi-Fi Remote,GoPro Composite Cable
209,0,Canon DSLR EOS 77D Body,Canon DSLR EOS 80D Video Creator Kit EF-S 18-135mm IS USM Lens
210,0,Canon EF 100mm f/2.8 Macro USM,Canon EF 70–300mm f/4–5.6L IS USM Telephoto Zoom Lens
211,1,Canon EF 50mm f/1.8 II,Sony Alpha a7S II Mirrorless Digital Camera
212,0,Veho MUVI Atom Body Camera/Action Camcorder Bundle,Nikon DSLR D610 Body Only
213,0,Transcend 4GB Class 10 SDHC Card TS4GSDHC10 Camera Accessory,Transcend Premium Secure Digital SDXC Card Class 10 128GB
214,0,Sigma 12-24mm f/4.5-5.6 EX DG Aspherical HSM Wide Angle Autofocus Zoom for Nikon,Sigma 10-20mm f/3.5 HSM Canon
215,0,Earthwise CHL91302 Tow Behind Cordless Batteries,Canon CB-2LX BATTERY CHARGER
216,0,D-Link DCS-6010L 2-Megapixel Panoramic Wireless Cloud Camera,D-Link DCS-6915 IP Exterior PTZ Wireless HD Day & Night Camera
217,0,Manfrotto 501PLONG Video Long Rapid Connect Mounting Plate,Action Outdoor Suction Cup with Plate
218,0,Manfrotto Carbon Fiber Tripod MT055CXPRO3,Manfrotto Aluminum Tripod MK190XPRO4
219,1,Canon DSLR 5D Mark III Body Only D,Canon DSLR 5D Mark III Body Only D
220,0,Sandisk Extreme microSDHC 64Gb Type 10,HP MSA50 10-Bay 1U Enclosure
221,0,Sony Handycam HDR-CX405,Sony PAL/HDR-CX260
222,0,Billingham Professional 335 Black Camera Bag,Canon Digital Rebel XSi DSLR Camera Gadget Bag
223,1,Canon DSLR EOS Rebel T3 Digital SLR Camera with EF-S Mount 18-55mm f/3.5-5.6 IS Lens,Canon DSLR EOS Rebel T3 Digital SLR Camera with EF-S Mount 18-55mm f/3.5-5.6 IS Lens
224,0,Panasonic Lumix GX85 Mirrorless Camera with 12-32mm f/3.5-5.6 ASPH MEGA O.I.S Lens Black,Panasonic Lumix FZ200 Digital Camera Accessories
225,1,Sony Cyber-shot DSC-WX350 Digital Camera,Sony Cyber-shot WX350 Compact Camera
226,0,Nikon AF-S Nikkor 50mm f/1.8G Lens,Nikon Telephoto AF Micro-Nikkor 105mm f/2.8G ED-IF AF-S VR Autofocus Lens
227,0,Nilox F60 Reloaded Full HD Wifi,Ksix Selfie Extension For GoPro
228,0,Canon Digital SLR Camera Backpack Case,Canon Digital Camera Gadget Bag
229,0,Sony PAL/HDR-CX190 HD Camcorder,Sony PAL/HDR-CX260 High Definition Handycam Camcorder
230,0,Fujifilm Instax Mini 8 Camera,Panasonic DMC-FX48S Digital Camera
231,0,SanDisk Extreme Pro SDHC UHS-II 32GB,Fujifilm SDHC Memory Card 4GB
232,0,Garmin Head Strap Mount,Garmin VIRB XE Action Camera
233,1,Canon ZSG-C10 Zoom Grip for COMPACT-SERVO Lens,Canon ZSG-C10 Zoom Grip for COMPACT-SERVO Lens
234,0,Transcend 128GB SDXC Class 10 UHS-1 Flash Memory Card Up to 90MB/s (TS128GSDXC10U1) Camera & Photo Accessories,Transcend 64GB SDXC Class 10 Flash Memory Card Up to 30MB/s (TS64GSDXC10) Memory Cards
235,1,Nikon AF-S 105mm f/2.8G VR Micro,Nikon Telephoto AF Micro-Nikkor 105mm f/2.8G ED-IF AF-S VR Autofocus Lens
236,0,Nikon AF-S DX 18-105mm f/3.5-5.6G ED VR,Sony FE 50mm F1.8 OSS
237,0,UNIDEN UDR444A 4.3 LCD Wireless Video Surveillance System,MCOCEAN 7 in 1 Accessories Kit for GoPro Hero
238,0,MeFOTO RoadTrip 61.6 Tripod Orange,Vanguard Alta Pro 263AT
239,0,Canon DSLR EOS 77D Body,Canon EF-S Mount 18-55mm f/3.5-5.6 IS STM
240,0,SanDisk DSLR/HD Camcorder CF CompactFlash Memory Card 128GB,Transcend Ultimate - flash memory card 128 GB CompactFlash
241,1,Oregon 548208 Chain Saw Accessories,Oregon 548208 Leaf Blower Accessories
242,0,D-Link DCS-5009L Wi-Fi Pan & Tilt Day/Night Camera,D-Link DCS-2330L HD Wireless N Day/Night Outdoor Cloud Camera
243,0,Prophet Sport Plus 50W AC/DC Charger,Sony AS30V High Definition POV Action Video Camera
244,0,Sony FS7 II Black,Sony Alpha Series Mirrorless Digital Camera Body
245,0,Manfrotto MVH500AH Video Base Plate,Manfrotto X-PRO 3-Way Camera Head
246,1,Action Outdoor Red Filter,Action Outdoor Red Filter
247,1,Canon EF-S 55-250mm f4.0-5.6 IS,Used Canon EF-S 55-250mm f/4-5.6 IS II
248,0,Canon XF100 HD Professional Camcorder,Sony HXR-NX5U/N NXCAM Professional Camcorder
249,1,Panasonic NE-1054 Microonda,Sony SEL 55-210mm F4.5-6.3 OSS E-mount Lens (Silver)
250,1,Sigma 4.5mm f/2.8 EX DC Circular Fisheye HSM (Sony),Sigma 4.5mm F2.8 EX DC Circular Fisheye HSM (Sony)
251,0,Manfrotto PL Adapter,Manfrotto Pro Light Bag Black
252,1,D-Link DCH-107KT Kit MyDLink Smart Home Security,D-Link DHP-W310AV PowerLine
253,0,Kupo Extension Grip Arm with Big Handle,Kupo Hex Stud Female 1/4-20 to 3/8-16
254,0,Patriot PSF32GSDHC4 32GB 9p SDHC Class 4 Secure Digital High Capacity,Toshiba SD-K08G2B8 8GB 9p SDHC Secure Digital
255,1,GoPro Hero3 Black Edition,GoPro Hero3 Black Edition
256,0,Sigma 120-400mm f/4.5-5.6 DG APO HSM Autofocus Zoom Lens for Sony,Sigma 18-250mm f/3.5-6.3 DC OS HSM Autofocus Zoom Lens For Pentax
257,0,Manfrotto Hydrostatic Ball Head With Rc4 Rapid Connect Plate 410Pl,Manfrotto X-Pro 3-Way Tripod Head
258,1,Veho Micro Pro Camcorder,Veho VCC-003 Muvi Pro Micro
259,1,SanDisk 32GB SDHC Flash Memory Card (SDSDB-032G-B35),Transcend Secure Digital Card SDHC Class 4 32GB
260,1,Batteries Lithium 2032,Energizer 2032 Lithium Battery
261,0,Manfrotto Three Section MT055XPRO3 Aluminum Tripod,Manfrotto BeFree Tripod with Ball Head
262,1,"1080p AHD Video Surveillance System, 4 Indoor HD Security Cameras, DVR System","1080p HD CCTV System, 180 Degree Fish-eye Security Cameras, DVR, Apps System"
263,0,Canon Battery Grip BG-E16,Canon LP-E17 Rechargeable Battery
264,0,Battery Leica GEB77-us,GoPro Battery BacPac
265,0,Canon PowerShot G1 X,Panasonic Lumix FZ100
266,0,16 Rods Octagon Softbox with Grid for Bowen or Alien Bee Monolight Strobe Studio,Canon PowerShot G7 X Mark II-US
267,0,D-Link Outdoor HD Wireless Day/Night Cloud Camera DCS-2332L,D-Link Wireless Panoramic/ Tilt/ Zoom Cloud Camera DCS-5222L
268,1,Sony Battery Charger,Sony Rechargeable Battery
269,0,Action Outdoor Suction Cup with Plate,Action Outdoor Floating Hand Grip Bobber
270,0,Canon Gadget Bag for EOS Cameras,Canon EOS 6D(N) Digital Camera
271,0,Largest HD Video Display,SanDisk Extreme SDXC 128GB 90MB/s UHS-I U3/Class 10
272,0,Garmin Action Camera VIRB XE,Garmin Li-Ion Battery Pack
273,0,Garmin Rechargeable NiMH Battery for GPSMAP 64s/Oregon 600 Series GPS Batteries,Panasonic VW-VBK360 Li-Ion Battery Pack
274,1,,
275,0,APC NetBotz Room Monitor 355 with 120V PoE Injector,Foscam FI9901EP IP Camera
276,0,D-Link Mini Dome Camera DCS-6004L,D-Link Full HD Outdoor Smoked Dome Network Camera DCS-6314BS
277,0,Shimano Deore M506 Front Kit,Suunto Spartan Ultra Titanium
278,0,Canon DSLR EOS 70D Body Only,Canon DSLR EOS 60D Body
279,0,"PNY Elite Performance 512GB SDXC Class 10 UHS-I, U3 Up to 95MB/sec",TARJETA SD 32GB SDHC CLASE 10 300X
280,0,Canon DSLR EOS 6D Body Only,Canon DSLR Rebel T3i Body
281,1,Veho Muvi HD10 Handfree Camcorder,Veho MUVI-HD10 Mini Handsfree Action Cam with Wireless Remote and Helmet Mount
282,0,Nilox Remote Control F60 Evo,Dsk NetPower 6
283,1,GoPro Accessory Kit - AWRMK-001,GoPro WiFi Remote Accessory Kit
284,1,SanDisk Extreme Pro Flash Memory Card 32 GB SDHC UHS-II,SanDisk Extreme Pro Flash Memory Card 32 GB SDHC UHS-II
285,1,Sony DT 30mm F2.8 SAM Macro Lens,Sony SAL30M28 Macro Lens
286,0,Nikon AF-S NIKKOR 28-300mm f/3.5-5.6G ED VR Zoom Lens,Nikkor AF-S 70-200mm f/2.8G IF-ED VR II Camera
287,0,Sony VCT R100 Camera Tripod,Manfrotto BeFree Tripod with Ball Head
288,0,SanDisk Extreme Pro 160MB/sec Compact Flash Card 16GB,SanDisk Extreme Pro 32GB CompactFlash (CF) Memory Card
289,0,Canon EF 2x III Extender,Canon EF Telephoto Zoom Lens 70 mm 300 mm
290,1,Sandisk Extreme microSDHC 64Gb Type 10,Sandisk Extreme microSDHC 64Gb Type 10
291,1,Sigma 10-20mm f/4-5.6 EX DC AF Lens,Sigma Zoom Super Wide Angle 10-20mm f/4-5.6 EX DC Autofocus Lens
292,0,Fujifilm SDHC Memory Card 4GB Speed Class 10,Transcend Ultimate series - flash memory card 128 GB SDXC UHS-I
293,0,Canon BP-828 Battery Li-Ion,Canon CB-2LC Charger
294,1,Sony FE 24-70mm f/2.8 GM,Sony FE 24-70mm f/2.8 GM
295,1,Sony Alpha a7RII Mirrorless Digital Camera,Sony Alpha a7RII Mirrorless Digital Camera
296,0,Sigma 4.5mm F2.8 EX DC Circular Fisheye HSM (Nikon),Sigma 120-400mm f/4.5-5.6 DG OS HSM APO Autofocus Lens for Sony Alpha
