id,label,left_title,right_title
870,0,Transcend 32GB Class 10 SDHC Flash Memory Card,Transcend TS64GSDXC10 CVK 64GB 9p SDXC Class 10 Secure Digital Extended Capacity Card
871,0,Sony FE 24-70mm f/2.8 GM Standard zoom lens for E-mount mirrorless cameras,Sony Alpha a7 Mirrorless Digital Camera with FE 28-70mm f/3.5-5.6 OSS Lens
872,0,Sony SAL30M28 Macro Lens 30mm,Sony NEX Compact System Cameras Silver-US 30mm f/3.5 Macro Lens
873,0,GoPro Wi-Fi Remote Charging Cable,GoPro HERO3 Black Edition
874,1,Panasonic Lumix G Vario Lens 7-14mm f/4.0 Asph Mirrorless Micro Four Thirds H-FS007014,Used Panasonic Lumix G Vario ASPH. 7-14mm f/4.0
875,1,Canon ImageFormula DR-F120,Canon imageFORMULA DR-F120 Sheetfed Scanner
876,0,Canon EF 70-200mm f/2.8L IS II USM,Canon EF 24-70mm f/2.8L II USM
877,0,Canon BG-E16 Battery Grip,Canon BG-E21 Grip
878,0,GoPro Grab Bag,GoPro Helmet Front Mount
879,1,GoPro Chest Mount Harness,GoPro Chesty Action Camera Mount
880,1,Canon EOS Rebel SL1,Canon DSLR EOS 100D Camera with EF-S 18-55mm f/3.5-5.6 IS STM Lens
881,0,Patriot Memory 128 GB microSDXC,SanDisk Ultra 200GB Micro SDXC
882,0,GoPro Junior Chesty,Fixation Roll Bar Kit
883,1,Manfrotto 502HD Long Quick Release Plate,Manfrotto 504PLONG Camera Plate
884,0,Nikon DSLR D3200 With AF-S DX NIKKOR 18-55mm 3.5-5.6G VR Lens (Black),Nikon AF-S DX 10-24mm f/3.5-4.5G ED
885,1,Elite Screens Manual 84-inch 16:9 Pull Down Projection Screen with 30-inch Drop M84XWH-E30,Elite Screens Manual 84-inch 16:9 Pull Down Projection Screen with 30-inch Drop M84XWH-E30
886,0,Garmin Virb Lithium-ion Battery,Earthwise CHL91302 Cordless Batteries
887,0,GoPro Floating Hand Grip,GoPro Hero3 Wrist Mount
888,0,Canon CB-2LX Battery Charger,GoPro Dual Battery Charger for Hero3/3+
889,0,Panasonic HC-V700M Full HD Camcorder Battery,Canon LP-E10 Camera Battery
890,0,Sony FDR AX33B,Sony Cyber-shot RX100
891,1,PNY Elite Performance 512GB SDXC Class 10 UHS-I,PNY Elite Performance 512GB SDXC Class 10 UHS-I
892,0,,
893,0,Canon Speedlite 270EX II,Canon Speedlite 270EX II
894,0,Canon FS200 Flash Memory Camcorder with 37x Optical Zoom,Sony PAL/HDR-CX260 High Definition Handycam Camcorder
895,0,Canon Deluxe Photo Backpack 200EG for Canon EOS SLR Cameras (Black with Green Accent),Canon EOS Rebel T5 DSLR Camera with 18-55mm and 75-300mm Lens Bundle
896,0,SanDisk 32MB SD Card,Transcend 64GB SDXC Card
897,0,Canon DSLR EOS 1300D Camera with EF-S Mount 18-55mm IS II Lens Kit,Canon DSLR EOS 80D Camera with EF-S Mount 18-134mm f/3.5-5.6 IS USM Lens
898,0,Canon DSLR EOS 5D Mark IV Camera with 24-105mm f/4L IS II USM Lens,Canon EF 17-40mm f/4 L USM Lens
899,1,Sony Hand Strap STP-GB1AM,STP-GB1AM Genuine Leather Hand Grip
900,0,Panasonic Micro Four Thirds 12-35mm f/2.8 ASPH. Vario Lens,Canon EF 100mm f/2.8 Macro USM
901,0,GoPro The Handler Floating Hand Grip,GoPro Jaws Flex Clamp Mount
902,0,Cameron Sino Replacement Battery,Sony FDAEV1MK Electronic Viewfinder Kit
903,0,GoPro Hero5 Black,Used GoPro Hero4 Black Battery Charger
904,0,Grandstream GXV3611IR_HD Fixed Dome Indoor IR Camera,D-Link WiFi PTZ Camera
905,1,Canon DSLR EOS Rebel T3i Body Only,Used Canon DSLR Rebel T3i Body
906,0,Tamron AF 18-270mm f/3.5-6.3 Di-II VC LD Asph. (IF) Macro Lens for Nikon Digital SLR Cameras,Sigma 70-300mm F4-5.6 DG Macro Nikon
907,1,Canon EF 24-70mm f/2.8L II USM Lens,Canon EF 24-70mm f/2.8L II USM Standard Zoom Lens
908,0,Samsung NX300 Mirrorless Digital Camera with 20-50mm F/3.5-5.6 ED II Lens (White) Bundle,Sigma 18-250mm f/3.5-6.3 DC OS HSM Autofocus Zoom Lens For Pentax Cameras
909,0,GoPro HERO4 Black,MCOCEAN 7 in 1 Accessories Kit for GoPro Hero
910,1,Savage 19676 11 TROPHY HUNTER XP 223 NIKON,Savage 19676 11 TROPHY HUNTER XP 223 NIKON
911,0,GoPro Wi-Fi Remote Accessory Kit,GoPro Flat & Curved Adhesive Mounts
912,0,STP-GB1AM Genuine Leather Hand Grip for Alpha Cameras,Alpha Camera Kit
913,0,Transcend SDHC 4GB Class 10,Fujifilm SDHC Memory Card Fujifilm Card (4GB) Speed Class 10
914,0,Panasonic Lumix G Vario Lens 7-14mm f4.0 Asph Mirrorless Micro Four Thirds H-FS007014,Lumix G X Vario Lens 12-35mm f2.8 Asph Professional Micro Four Thirds Power Optical I.S. H-HS12035
915,0,Greddy Oil Cooler Kit Honda Nengun Performance,Aluratek 7 inch Digital Photo Frame
916,0,Canon PowerShot A2300,Sony HX400V
917,0,Canon Zoom Grip EF-S Mount,Canon Battery Grip 6D Mark II
918,0,Panasonic DMW-BCG10 Battery,Canon BG-E14 Battery Grip
919,0,Transcend 32GB Class 10 SDHC Flash Memory Card,Transcend 64GB SDXC Class 10 Flash Memory Card
920,1,Action Outdoor Floating Hand Grip Bobber,Action Outdoor Floating Hand Grip Bobber
921,0,Canon EF 85mm f/1.8 USM Medium telephoto prime lens,Canon EF 17-40mm f/4L USM Lens
922,1,Canon EF 100mm f/2.8L Macro IS USM,Canon EF macro lens - 100 mm
923,0,Manfrotto Pro Backpack 30 DSLR Camera Bag,Manfrotto X-PRO 3-Way Head
924,0,GoPro Suction Cup Mount AUCMT-302,Action outdoor Suction Cup
925,0,Panasonic Lumix GX85 Mirrorless Camera with 12-32mm f/3.5-5.6 ASPH MEGA O.I.S Lens Black,Samsung SMART 20.3 Megapixel Digital Camera
926,0,Nikon DSLR D300S Body Only,Nikon DSLR D5100 With 18-55mm VR Lens
927,0,EyeOn Pet Monitor HD 360 DCS-855L/P,Outdoor HD Wireless Day/Night Cloud Camera DCS-2332L
928,0,Sony Electronic Viewfinder Kit,Canon Battery Charger
929,0,Sony SAL14TC Tele lens,Sony Alpha a5100 Mirrorless Digital Camera with 16-50mm Lens
930,0,"SanDisk Ultra 32GB microSDHC UHS-I Card with Adapter, Grey/Red",SanDisk SDSDAA-032G CRB 32GB SDHC Class 4 Secure Digital High Capacity
931,0,Sandisk CF Extreme 64GB,Transcend Ultimate CompactFlash 128GB
932,0,D-Link DCH-107KT Smart Home Security Kit,Vigilance Full HD Surveillance Starter Kit
933,0,Fujifilm Crystal Archive Type II Lustre Roll Mini Lab Supplies,Fujifilm Instax Mini 25 Camera
934,0,Manfrotto MB PL-3N1-26 Pro Light Rugzak Zwart,Manfrotto 190 MK190XPRO3-BHQ2 Kit
935,1,Fujifilm 4GB SDHC Class 10 Flash Memory Card,Fujifilm SDHC Memory Card (4GB) Speed Class 10
936,1,"Chromo Inc CI55000020 160 LED CI-160 Dimmable Ultra High Power Panel, Camcorder Video Light for Canon, Nikon, Pentax, Panasonic, Sony, Samsung and Olympus Digital SLR Cameras-US Accessories","Chromo Inc CI55000020 160 LED CI-160 Dimmable Ultra High Power Panel, Camcorder Video Light for Canon, Nikon, Pentax, Panasonic, Sony, Samsung and Olympus Digital SLR Cameras-US Lighting"
937,0,SanDisk Ultra 16GB CompactFlash,Transcend Ultimate 64GB CompactFlash
938,0,Kingston 32GB SDHC/SDXC UHS-I U3 Class 3 Flash Memory Card,Kingston Multi-Kit Mobility Kit - flash memory card 16 GB microSDHC
939,0,Canon PF-03 Printhead Series,Nilox Head Strap Mount
940,0,Sigma 120-400mm f/4.5-5.6 DG OS HSM APO Autofocus Lens for Sony Alpha,Sigma 10-20mm f/4-5.6 EX DC HSM FOR CANON
941,0,Nikkor AF 16mm F2.8D Fisheye,Sony E 50mm F1.8 OSS
942,0,Manfrotto MVH502AH Pro Video Head Flat Base Size M,Veho VCC-003-MUVI-PRO Muvi Pro Micro DV Body Camera
943,1,Canon EF 70-300mm f/4-5.6L IS USM Telephoto Zoom Lens,Canon EF 70-300mm f/4-5.6L IS USM Telephoto Lens
944,0,Manfrotto 501 Quick Release Plate Long,Manfrotto Carbon Fiber Tripod MT055CXPRO3
945,0,Canon EF-S 55-250mm f/4-5.6 IS STM Telephoto Zoom Lens,Nikon AF-S Nikkor 55-300mm f/4.5-5.6G ED VR DX Lens
946,1,Panasonic Lumix FZ200 12.1 Megapixel Digital Camera Accessories For Panasonic Camera - DMC-FZ200K,Panasonic Lumix DMC-FZ200 Digital Camera
947,0,Honeywell Lettore Appoggio 4850DR,D-Link DCS-6010L 2-Megapixel Panoramic Wireless Cloud Camera
948,0,D-Link DCS-5020L Wireless Camera,D-Link Cloud Camera
949,0,Camera hồng ngoại Model IRD2936A10H,Nikon DSLR D7100 Body
950,0,Transcend TS4GSDHC 4GB SDHC Secure Digital Class 2,Fujifilm 4 GB SDHC Class 10 Flash Memory Card
951,1,Logitech HD Webcam C310,Logitech HD Webcam C310 Accessories
952,1,Sony Alpha A7 Mirrorless Digital Camera with FE 28-70mm f/3.5-5.6 OSS Lens,Sony Alpha A7 Mirrorless Digital Camera with FE 28-70mm f/3.5-5.6 OSS
953,1,Acid-Free Resealable Bags,Carrying Bag for Sony Cyber-shot DSC-T200
954,0,Kingston Digital 16GB Class 4 microSDHC Flash Card with SD Adapter,Transcend 64GB Ultimate SDXC Class 10 Memory Card
955,0,Logitech Photo Cameras Camera,Logitech BCC950 Conferencecam
956,0,Pretec SD32-BQH 32MB 9p SD Secure Digital Card,Transcend 32GB SDHC Class 10 Memory Card
957,0,SanDisk Ultra 16GB CompactFlash (CF) Card,Transcend TS64GCF1000 DFF 64GB 50p CF 1000x 160MB/s CompactFlash Card
958,0,Veho Muvi Pro Micro DV Body Camera/Action Cam,Sony Alpha a6000 Mirrorless Digital Camera
959,0,Netgear Arlo HD camera set with base station and 2 cameras,Arlo camera protective cover
960,1,Canon Canoscan 9000F Mark II,CS9000 MKII
961,0,Panasonic Lumix GF1 14-45mm Lens,Panasonic DMC-FZ20S Digital Camera
962,0,GoPro Headstrap Mount With Quick Clip,Soft Digits Accessories Kit for GoPro Hero 5 4 3+ 3 2 1 Session Accessory Bundle Set Action Camera SJ4000 SJ5000 SJ6000 Xiaomi Yi-Flotation Handle+Head Strap+Chest Strap
963,1,GoPro Curved & Flat Adhesive Mounts,GoPro Flat & Curved Adhesive Mounts
964,1,D-Link Polska Mini Bullet Cloud Camera,D-Link Portugal Mini Bullet Cloud Camera
965,0,Canon LC-E6 Battery Charger (for LP-E6),Canon EOS 60D Body
966,0,Fujifilm Crystal Archive Paper Type II 8x10 Lustre,HP Everyday Adhesive Matte Polypropylene Film
967,0,Fujifilm X-T20 Body with XF 18-55mm Lens Kit (Silver),Nikon D5200 Kit with 18-55mm zoom lens
968,0,Leica TPS 1000 Battery,Metabones Canon EF to Sony E Mount Speed Booster ULTRA 0.71x
969,0,Canon Battery Grip BG-E11,Canon DSLR EOS 6D Body
970,0,Sony E 35mm f/1.8 OSS,Nikon AF-S Nikkor 50mm f/1.8G Lens
971,0,Canon CanoScan 9000F Mark II Flatbed Scanner A4 Black Silver,Canon EOS 5D Mark IV DSLR Camera Body
972,0,GoPro Mic Stand,DSLR NetPower 6
973,0,Canon DSLR EOS 80D Body Only,Canon DSLR EOS 5D Mark IV Body
974,0,16GB CF CARD 400X,Transcend Secure Digital Card SDHC Class 10 16GB
975,0,Nikon AF-S Nikkor 16-35mm f/4G ED VR Wide Angle Zoom Lens,Nikon AF-S Nikkor 35mm f/1.8 G DX Lens
976,0,Canon Battery Grip BG-E16,Canon Battery Grip BG-E21 for EOS 6D Mark II
977,0,HD PoE Dome Indoor Cloud Camera,D-Link DCS-2310L Outdoor Cloud Camera
978,1,GoPro Protective Lens and Covers,Lentilles et caches de protection GoPro
979,0,Canon Digital Gadget Bag 200DG,Aluratek Frame ADPF07SF
980,0,D-Link Outdoor Mini Bullet Camera DCS-4703E,D-Link Outdoor Dome Camera DCS-6210BS
981,0,Canon EF 70-200mm f/2.8L IS II USM Telephoto Zoom Lens,Canon EF-S Mount 10-22mm f/3.5-4.5 USM Ultra-Wide Zoom Lens
982,1,Canon PowerShot G1 X,PowerShot G1 X Canon
983,0,Case Logic Camera Bag,Nikon DSLR D3200 With AF-S DX NIKKOR 18-55mm VR Lens
984,0,Billingham Professional 335 Black Camera Bag,Fujifilm X-T2 Mirrorless Digital Camera
985,0,GoPro HDMI Cable,GoPro Composite Cable
986,0,SanDisk Extreme SDXC 128GB 90MB/s V30 UHS-I,Transcend TS64GSDXC10U1 64gb Sdxc Class 10 600x Uhs-I
987,1,Nikon DSLR D300S Body Only,Nikon SLR D300s Body Only
988,0,Kingston 128GB SDXC Flash Memory Card Class 3,SDHC Class 10 300X 32GB
989,1,Nilox F60 Reloaded Full HD WiFi,Nilox F60 Reloaded Full HD WiFi
990,0,Sigma 70-300mm f/4-5.6 APO DG Macro Autofocus Lens for Canon,Sigma 120-400mm f/4.5-5.6 DG OS HSM APO Autofocus Lens for Sony
991,0,D-Link DCH-100KT Smart Home HD Starter Kit,D-Link DCS-6210BS Outdoor Full HD Vandal-Resistant Mini Fixed Smoked Dome Network Camera
992,0,Zeiss Conquest HD 10x42,Bushnell Trophy Cam HD Wireless Brown
993,1,GoPro Hero6 Black,GoPro Hero6 Black
994,0,Transcend CompactFlash TS64GCF1000 Flash Memory Card,Transcend 64GB UHS-1 Class 10 SDXC Memory Card
995,0,Panasonic Lumix GX1 Body Only 16 Megapixel Compact System Camera,Panasonic Lumix GH3 Body Only 16 Megapixel Digital Single Lens Mirrorless Camera
996,0,Canon DSLR EOS 5D Mark III Body Only,Canon DSLR EOS 70D Body Only
997,0,Avermedia Visionu50 Document Camera,Sony Alpha A6000 Mirrorless Digital Camera
998,0,Arlo Smart Security 2 HD Camera System Indoor/Outdoor VMS3230,Security Camera System 4 Dome Infrared Cameras Internet DVR iDVR
999,1,Manfrotto Pro Single Carbon Fiber Tripod and Fluid 509HD Head Kit,Manfrotto Pro Single Carbon Fibre Tripod Kit
1000,1,Panasonic NE-1054 Microonda,Sony SEL30M35 30mm f/3.5 Macro Prime Lens
1001,0,Canon DSLR EOS Rebel SL1 Digital SLR with 18-55mm STM Lens,Nikon DSLR D5200 Kit with 18-55mm Zoom Lens
1002,1,Canon EF 24-70mm f/4L IS USM Zoom Lens,Canon EF zoom lens - 24 mm 70 mm
1003,0,"Fujifilm Instax Mini 8 Camera, 3 Packs of Film and Bag",D-Link DCS-6004L HD PoE Mini Dome Cloud Camera
1004,0,Nikon AF 16mm f/2.8D Fisheye,Sigma 4.5mm f/2.8 EX DC Circular Fisheye HSM
1005,1,Canon EF 70-200mm f/2.8L IS II USM Telephoto Zoom Lens,Used Canon Telephoto EF 70-200mm f/2.8L II IS USM Lens
1006,0,Sandisk Extreme microSDHC 64Gb Type 10,HP MSA50 10-Bay 1U Enclosure
1007,0,Canon imagePROGRAF iPF710 Printhead,Nilox Head Strap Mount
1008,0,Canon EF-S Mount 10-22mm f/3.5-4.5 Ultrasonic Motor Lens,Canon EF 85mm f/1.8 Ultrasonic Motor Lens
1009,1,IBM ABT 8MB 72p 70ns 24c 1x4 Parity FPM SIMM,Major/3rd 8T18F14-70-RFB AUM 8MB 72p 70ns 18c 1x4 Parity FPM SIMM
1010,0,Battery LP-E10,"Canon LC-E6 Battery Charger for Canon EOS 5D Mark II, 7D & 60D"
1011,0,Canon DSLR EOS 60D Body,Canon DSLR EOS 6D Body
1012,1,Transcend 32GB Class 10 SDHC Flash Memory Card (TS32GSDHC10E),Transcend 32GB Class 10 SDHC Flash Memory Card (TS32GSDHC10E)
1013,1,Canon EF 85mm f/1.8 USM Lens,Canon EF 85mm F1.8 USM Camera
1014,0,Transcend TS64GSDXC10U1 64gb Sdxc Class 10 600x Uhs-I,Transcend TS8GUSDHC10U1 CVQ 8GB MSDHC r90MB/s 600x Class 10 UHS-I
1015,1,Grandstream GXV3611IR_HD IR Fixed Dome IP Camera,Grandstream GXV3611IR_HD Infrared HD Indoor IP Camera
1016,0,Panasonic Battery DMW-BCG10,Panasonic Battery DMW-BCG10
1017,0,GoPro HERO4 Silver,MCOCEAN 7 in 1 Accessories Kit for GoPro Hero
1018,0,Arlo Smart Home Silicone Skins Pack for Wireless CCTV HD Security Camera,335 Camera Bag Black
1019,0,Chromo CI-216 LED Camera Light,Chromo CI-160 LED Camera Light
1020,1,,
1021,0,NetBotz Room Monitor 355,Arlo Security Camera
1022,1,GoPro Helmet Front Mount,Helmet Mount Go Pro
1023,1,Sigma 10-20mm F3.5 EX DC HSM Canon,Sigma 10-20mm f/3.5 HSM Canon
1024,0,Kodak Czarny,D-Link Vigilance HD DCS-4701E Network Camera
1025,0,SD Card 16GB SDHC Class 10,Transcend 64GB SDXC Class 10 Flash Memory Card
1026,0,Sony 30mm f/3.5 Macro Lens,Tamron AF 18-270mm Di II VC PZD
1027,0,Manfrotto MVH500AH 755CX3 Lightweight Fluid Video System with Carbon Fiber Legs and Bag (Black),Manfrotto Pro Single Carbon Fibre Kit 100 - 509HD
1028,0,Nikon SB-700 Flash,Sony DSC-RX100 Compact Camera
1029,1,Canon Battery Grip BG-E16 9130B001,Canon Battery Grip BG-E16 9130B001
1030,0,Panasonic Lumix DMC-FS15K Digital Camera,Panasonic Lumix DMC-FZ15K Digital Camera
1031,0,Sandisk Extreme Pro 64GB SDXC,PNY Elite Performance 512GB SDXC
1032,1,Vigilance Full HD Outdoor PoE Mini Bullet Camera,Vigilance 3-MPixel Outdoor Poe Mini Bullet Camera
1033,0,Sony Compact HX400V Camera 50x Optical Zoom DSC-HX400V,Sony VCT-R100 Tripod
1034,1,D-Link DCS-2132L HD Camera,D-Link DCS-2132L HD Camera
1035,0,Metabones Canon EF to Micro Four Thirds T Speed Booster ULTRA 0.71x Black Matt,Panasonic Lumix G Vario 7-14mm f4.0 ASPH. Micro Four Thirds Mount
1036,0,Veho MUVI HD NPNG Body Camera Special Edition,GoPro HERO4 BLACK Mount
1037,0,SanDisk 32GB SDHC Secure Digital High Capacity Class 4,Kingston Digital 16GB microSDHC Flash Card with SD Adapter
1038,0,Logitech C930e,C615 USB Webcam
1039,0,Canon EF 40mm f/2.8 STM Pancake Lens,Canon EF 100mm f/2.8 Macro USM Lens
1040,0,Chromo CI5500020 160 LED CI-160 Dimmable Ultra High Power Panel Camcorder Video Light for Canon Nikon Pentax Panasonic Sony Samsung Olympus Digital SLR Cameras,Sony AS30V HDR-AS30V-US Sports Action Camera
1041,0,GoPro HDMI-Micro HDMI Cable,GoPro Wi-Fi Remote Charging Cable
1042,0,Manfrotto MB PL-3N1-26 Pro Light Rugzak Zwart,Vanguard Alta Pro 263AT Tripod
1043,1,Canon DSLR 70D Body Only,Used Canon DSLR 70D Body
1044,1,Sigma 70-300mm F4-5.6 DG Macro (Nikon),Sigma Zoom Telephoto 70-300mm f/4-5.6 DG Macro Autofocus Lens for Nikon
1045,1,Fujifilm Instax Mini 8 Black Camera with 3 Packs of Film and Bag,Fujifilm Instax Mini 8 Yellow Camera with 3 Packs of Film and Bag
1046,1,Savage 11 TH XP 308 Nikon,Savage 11 TH XP 308 Nikon
1047,0,D-Link DCS-2330L HD Wireless N Day/Night Outdoor Cloud Camera,D-Link Mini Bullet Wireless AC Day/Night HD Cloud Camera
1048,0,GoPro Casey (Case for Camera + Mounts Accessories),Fixation Roll Bar Kit
1049,0,,
1050,1,Manfrotto Befree Travel Tripod Black,Manfrotto BeFree Tripod with Ball Head
1051,1,Leica GEB121 Battery,Batteria Per Leica GEB121
1052,0,Action Outdoor Suction Cup with Plate,Action Outdoor Floating Hand Grip Bobber
1053,1,"Avenger 40 Chrome C-Stand with Turtle Base, Grip Head & Arm Base Arm A2030DKIT",Avenger A2030DKIT Steel 40-Inch Detachable Base C-Stand with Grip Kit
1054,1,GoPro Dual Battery Charger for GoPro HERO3+,GoPro Dual Battery Charger for Hero 3/3+
1055,0,Canon Deluxe Gadget Bag 100EG Camera & Photo Accessories,Canon PowerShot SX540 HS
1056,0,GoPro Battery BacPac,Canon Battery CB-2LC Charger
1057,1,Action Outdoor 3 Way Grip Arm,Action Outdoor 3 Way Grip Arm
1058,1,Arlo Adjustable Wall Mount,Arlo Camera Tilt/Pan Wall Mount
1059,1,GoPro Hero5 Black 4K Camera,GoPro Hero5 Black + micro SDHC 32 GB
1060,0,Canon EF 70-300mm f/4-5.6L IS USM Autofocus Telephoto Zoom Lens,Canon EF-S Mount 55-250mm f/4-5.6 IS STM Telephoto Zoom Lens
1061,1,GoPro Rechargeable Battery,GoPro Rechargeable Battery
1062,0,Gateway MX8000 6-Cell Li-Ion Battery,Canon LP-E17 Rechargeable Battery
1063,0,D-Link DCH-100KT Smart Home HD Starter Kit,D-Link Mini-caméra bullet HD Cloud
1064,0,GoPro Hero 4 / 3 Plus 2 Accessory Set (33 Items),Battery for GoPro Camera
1065,1,ViewSonic Digital Photo Frame 8-Inch VFD820-50,ViewSonic Digital Photo Frame 8-Inch VFD820-50 Black
1066,0,UNIDEN UDR444A 4.3 LCD Wireless Video Surveillance System,GoPro Hero Extended Battery Pack 4000mAh
1067,0,Canon EF-S 55-250mm,Sigma 70-300mm F4-5.6 DG Macro
1068,1,Panasonic Lumix FZ100 DMC-FZ100,Panasonic Lumix FZ100 DMC-FZ100
1069,0,Octagon Softbox for Bowen or Alien Bee Monolight,GoPro Helmet Mount
1070,0,GoPro Rechargeable Battery for GoPro HERO3+,GoPro Dual Battery Charger
1071,0,Nikkor AF-S 50mm f1.8G,Nikkor AF-S DX 10-24mm f3.5-4.5G ED
1072,0,Mixchips 26H3216 AUM 8MB 72p 70ns 18c 1x4 Parity FPM SIMM RFB,Canon EF 70-200mm f/2.8L IS II USM Telephoto Zoom Lens
1073,0,Nikon Telephoto AF Micro-Nikkor 105mm f/2.8G ED IF AF-S VR Autofocus Lens,Nikon Zoom-Nikkor DX 10-24mm f/3.5-4.5G ED AF-S
1074,0,Canon Right Angle Finder C (Includes ED-C and ED-D Adapters for All SLR Camera Digital Camera Viewfinder Attachment Accessories),"Canon LC-E6 Battery Charger for Canon EOS 5D Mark II, 7D & 60D Digital SLR"
1075,1,Canon ES-52 Lens Hood for EF 40mm f/2.8 STM Pancake,Lens Hood ES-52 Canon Lens ES-52
1076,0,D-Link DCS-2210L Full HD PoE Day/Night Network Camera,D-Link DCS-2332L
1077,0,"Fujifilm Instax Mini 8 Camera, 3 Packs of Film and Bag",Veho MUVI-HDPRO Mini HD Body Camera
1078,0,Transcend 32GB Class 10 SDHC Flash Memory Card,10 Pack Transcend TS8GSDHC10 8GB SDHC Class Flash Memory Cards
1079,0,Canon EF 70-300mm f/4-5.6L IS USM Telephoto Zoom Lens,Canon EF-S Mount 55-250mm f/4-5.6 IS STM Telephoto Zoom Lens
1080,1,GoPro 3-Way Mount,GoPro 3-Way Mount
1081,0,Billingham Professional 335 Black Camera Bag,GoPro HERO3 Black Edition
1082,0,Panasonic Lumix DMC-FZ18K Digital Camera with 18x Optical Zoom,Panasonic Lumix DMC-FX700 Digital Camera
1083,0,Canon DSLR EOS 60D Body Only,Canon DSLR EOS 5D Mark II Body Only
1084,0,Aluratek Digital Photo Frame,Panasonic Lumix FZ200 12.1MP Digital Camera
1085,0,GoPro Jaws Flex Clamp Mount,GoPro JR
1086,1,Knog Qudos Action Video Light for GoPro Silver,Knog Qudos Action Video Light for GoPro Silver
1087,1,Transcend 128GB SDXC Class 10 UHS-1 Flash Memory Card Up to 90MB/s (TS128GSDXC10U1),"Transcend 128GB SDXC Ultimate UHS-1 Memory Card, Class 10 Card 10 (TS128GSDXC10U1)"
1088,1,Manfrotto Professional DSLR Digital Camera Backpack 30,Manfrotto Professional Backpac 30
1089,0,Panasonic Lumix G Vario 14-45mm f/3.5-5.6 ASPH. Micro Four Thirds MEGA Optical IS,Tamron AF 18-270mm f/3.5-6.3 Di II VC PZD Nikon Mount
1090,0,Canon EF 24-105mm f/4L IS USM Lens,Canon EF 17-40mm f/4L USM Wide-Angle Zoom Lens
1091,0,Nikon AF-S Nikkor 55-300mm f/4.5-5.6G ED VR DX Lens,Nikon AF-S Nikkor 105mm f/2.8G IF-ED VR
1092,0,SanDisk 32MB SD Secure Digital Card,Sandisk 64GB Ultra microSDXC Card
1093,0,Canon ImageFormula DR-F120 Sheetfed Scanner,Canon Electronic Viewfinder EVF-DC1
1094,0,Zebra ZQ110 Mobile Receipt Printer,Garmin GPS Receiver Battery
1095,0,GoPro Grab Bag,Canon Gadget Bag 2400
1096,0,Nikon D7100 Kit 24.1-megapixel digital SLR camera with 18-105mm zoom lens,Canon DSLR EOS Rebel T3i Body Only
1097,0,GoPro Battery BacPac for Hero 4/3+/3+,Panasonic VW-VBK360 Li-Ion Battery Pack
1098,0,Samsung Smart 20.3 Megapixel Digital Camera EV-NX300Z,Canon EF-S Mount 18-55mm f/3.5-5.6 IS STM Lens
1099,1,Sony FS7 II Black,Sony PXW-FS7M2 XDCAM Super 35 Camera System
1100,0,Panasonic Lumix DMC-FX48S Digital Camera,Panasonic Lumix DMC-LC40S Digital Camera
1101,0,Canon Battery BP-2L14,Canon NB-5L Rechargeable Lithium-ion Battery
1102,0,Pentax K-30 DSLR 16MP Weather Resistant 18-55mm Kit Lens,Canon EOS Rebel T3i Body Only
1103,0,Canon Compact Digital Camera SX540 HS 20.3MP 1/2.3 CMOS,Canon PowerShot G7 X Mark II
1104,0,GoPro 3 Way Grip Arm Tripod Mount,GoPro Suction Cup Camera Mount
1105,1,360RIZE Pro6E 360° Plug-n-Play Rig for GoPro HERO4,360RIZE Pro6LE 360° Plug-n-Play Rig for GoPro HERO4/3+/3
1106,0,Panasonic VW-VBK360 Li-Ion Battery Pack,Garmin Virb Lithium-ion Camera Battery
1107,0,Manfrotto 502HD Long Quick Release Plate,GoPro Hero3 Silver Edition Camera
1108,0,Canon EF Telephoto Zoom Lens 70 mm-200 mm,Canon EF-S Mount 10-22mm Ultrasonic Motor Ultra-wide-angle zoom lens
1109,0,Nikkor AF-S 28-300mm f/3.5-5.6G ED VR,Nikon DX 10-24mm f/3.5-4.5G ED AF-S Zoom-Nikkor
1110,0,Sony WX350 Compact Camera with 20x Optical Zoom - DSC-WX350,Sony DSC-W800/B Digital Camera
1111,1,Panasonic Lumix GF1K Series 12.1 Megapixel Interchangeable Lens Camera Kit DMC-GF1K-K,Panasonic Lumix GF1 with 14-45mm lens DMC-GF1
1112,0,Quill.com Camera & Camcorder Accessories,Canon Battery Charger CG-800
1113,0,Canon PowerShot A2300 IS 16MP Digital Camera with 5x Optical Zoom,Canon DSLR G7 X Mark II Digital Camera
1114,0,Manfrotto Pro Video Head 75mm MVH502A,Manfrotto MK190XPRO3-BHQ2 Aluminum Tripod Kit
1115,0,Canon EF 85mm f/1.8 USM,Canon DSLR Camera Cameras Toronto Canada Store Aden
1116,0,Canon DSLR EOS 1300D + EF-S Mount 18-55mm IS II Camera Kit,EOS Rebel T6 EF-S Mount 18-55mm f/3.5-5.6 IS II Kit
1117,0,MicroSD 16GB,Sony Cyber-shot DSC-W800/B 20MP Digital Camera
1118,0,Transcend 64GB SDXC Class 10 Flash Memory Card Up to 30MB/s,8GB SDHC Class 10
1119,1,Sandisk Extreme Pro CompactFlash 16GB 160MB/s,SanDisk Extreme Pro CompactFlash Card
1120,1,Canon DSLR EOS 5D Mark IV 4K Wi-Fi Digital SLR Camera & EF 24-105mm f/4L IS II USM Lens,Canon DSLR EOS 5D Mark IV Camera with 24-105mm f/4L II Lens
1121,0,Veho Mini HD Body Camera/Action Camcorder,GoPro HERO+ LCD HD Video Recording Camera
1122,0,Panasonic Lumix FZ100,LUMIX FZ60 16 Megapixel Digital Camera
1123,0,Transcend 128GB SDXC Class 10 Flash Memory Card Up to 30MB/s,10 Pack Transcend TS8GSDHC10 8GB SDHC Class Flash Memory Card
1124,0,Sigma 10-20mm f/4-5.6 EX DC AF Lens,SSigma 120-400mm f/4.5-5.6 DG APO O HSM Autofocus Zoom Lens
1125,0,Transcend TS16GSDHC10 16GB SDHC Secure Digital Class 10,Fujifilm SDHC Memory Card Fujifilm Card (4GB) Speed Class 10
1126,0,Canon Power Shot SX510 HS Point-and-Shoot Camera,Canon DSLR EOS 6D Body
1127,0,Veho MUVI Atom Body Camera/Action Camcorder Bundle,Veho Muvi HD10 Handfree Camcorder
1128,0,Canon Deluxe Gadget Bag 100EG (Holds 1-2 Cameras and 3-4 Lenses),GoPro Hero Accessory Set
1129,0,Panasonic Lumix GH4 4K Micro Four Thirds Digital Camera Body,Fujifilm X-E2S Mirrorless Body Silver
1130,1,Logitech Webcam C930e,Webcam Logitech C930e
1131,0,Nilox Battery F60 Evo,GoPro Mic Stand Out
1132,0,Sony Alpha a6000 Mirrorless Camera with 16-50mm Retractable Lens,Sony ILCE A3000 Body
1133,1,Sony Alpha 6000 with 16-50mm Lens,Sony Alpha 6000 with 16-50mm Lens
1134,0,Manfrotto Tripod 4 Sections Aluminium MK190XPRO4-BHQ2,Manfrotto 190 MK190XPRO3-BHQ2 Kit
1135,0,Nikon EN-EL4A Rechargeable Battery,Sony Alpha a7 Mirrorless Digital Camera
1136,0,Sony VCT-R100 Camera Tripod,Vanguard Alta Pro 263AT Tripod
1137,0,Sony E-Mount 35mm f/1.8 Prime Lens,Sony Alpha FE 24-70mm f/2.8 GM Zoom Lens
1138,1,GoPro Accessory Kit for Wifi Remote,GoPro Camera Tethers
1139,1,Nilox Battery F60 Evo,Nilox Battery F60 Evo
1140,0,Action Outdoor 3 Way Grip Arm,Nilox Remote Control
1141,0,Sony Alpha ILCE6000L/S 24.3MP Mirrorless Digital Camera 4x 3.0 inch wide type TFT LCD (Silver),"Sony Cyber-shot Digital Camera RX100 II, 20.2MP, Black"
1142,0,GoPro Rechargeable Battery For HERO4,GoPro HERO4 Silver
1143,1,GoPro Hero4 Black Edition,GoPro Hero 4 Black
1144,0,Sony Alpha a7RII Mirrorless Digital Camera,Panasonic GH4 Body
1145,0,Panasonic Lumix DMC-FZ20S Digital Camera,Panasonic Lumix DMC-LC40S Digital Camera
1146,0,Transcend SDXC 64GB Class 10,Transcend Ultimate - flash memory card 4 GB SDHC
1147,0,Dolica Aluminum Alloy Proline Tripod,MeFoto RoadTrip Kit Orange
1148,0,Savage 11 TH XP 300WSM,Sigma 4.5mm F2.8 EX DC Circular Fisheye HSM
1149,0,Tamron AF 18-270mm F/3.5-6.3 Di II VC PZD Nikon Mount,Sigma 70-300mm F4.0-5.6 DG APO Macro Nikon
1150,0,WTC-T201C Camera Quan Sat,WTC-D102H Camera
1151,0,Vigilance 3-MPixel Outdoor Poe Mini Bullet Camera,D-Link DCS-6210BS Outdoor Full HD Vandal Resistant Mini Fixed Smoked Dome Network Camera
1152,0,Nikkor AF-S 70-200mm f/2.8G IF-ED VR II,Nikon AF-S DX Nikkor 10-24mm f/3.5-4.5G ED
1153,0,Sony Handycam HDR-CX260,Canon XF100
1154,0,,
1155,1,Canon EF 75–300mm f/4–5.6 III Telephoto Zoom Lens,Used Canon EF 75-300mm f/4-5.6 III Telephoto Lens
1156,0,Canon DSLR EOS 7D 18MP 1080HD,Canon DSLR EOS 80D with 18-135mm IS USM
1157,1,Canon RC-6 Wireless Remote Controller,RC-6 Wireless Remote Controller
